#,Unknown0,Unknown1
0,TEXT_REGOTH3REISEN_00452_SENRI_000_001,"뭐야, 또 너냐옹.
냐한테 묻고 싶은 것이라도 있냐옹?"
1,TEXT_REGOTH3REISEN_00452_Q1_000_000,무엇을 물어보시겠습니까?
2,TEXT_REGOTH3REISEN_00452_A1_000_001,'서수'에 대해서
3,TEXT_REGOTH3REISEN_00452_A1_000_002,'레이센 신사'에 대해서
4,TEXT_REGOTH3REISEN_00452_A1_000_003,'텐젠'에 대해서
5,TEXT_REGOTH3REISEN_00452_A1_000_004,'현무'에 대해서
6,TEXT_REGOTH3REISEN_00452_A1_000_005,'백호'에 대해서
7,TEXT_REGOTH3REISEN_00452_A1_100_005,'주작'에 대해서
8,TEXT_REGOTH3REISEN_00452_A1_200_005,'청룡'에 대해서
9,TEXT_REGOTH3REISEN_00452_A1_300_005,'텐젠의 자손'에 대해서
10,TEXT_REGOTH3REISEN_00452_A1_000_006,취소
11,TEXT_REGOTH3REISEN_00452_SENRI_000_003,우리 '서수'에 대해서 알고 싶냐옹?
12,TEXT_REGOTH3REISEN_00452_SENRI_000_004,"너냐들 나라에서는 어떤지 모르지만……
여기서는 자신의 본래 수명을 벗어나 백 년의 세월을 산 짐승은
서서히 자아가 생겨서 요력을 다룰 수 있게 된다옹."
13,TEXT_REGOTH3REISEN_00452_SENRI_000_005,"거기다가 천 년에 걸쳐 요력을 쌓은 짐승은 서수로 변해서
인간의 언어로 말할 수 있게 되고, 강한 신통력을 갖게 된다옹.
그래서 우리들은 서수로 변하는 걸 '번드친다'고 한다옹."
14,TEXT_REGOTH3REISEN_00452_SENRI_000_006,"우리가 아무리 겉모습이 귀엽다고 해도
무시하거나 깔보면 혼쭐이 날 거다옹.
지금은 너냐들과 얘기하기 편한 모습으로 있는 것뿐이라옹."
15,TEXT_REGOTH3REISEN_00452_SENRI_000_007,여기 '레이센 신사'에 대해서 알고 싶냐옹?
16,TEXT_REGOTH3REISEN_00452_SENRI_000_008,"아주 먼 옛날, 텐젠과 사성수님들이
미쳐 날뛰던 서수 '황룡'을 토벌하고 봉인한 곳이다옹."
17,TEXT_REGOTH3REISEN_00452_SENRI_000_009,"격렬한 전투 끝에 사성수님들은 요력을 이용해서
봉인을 지키기 위해 멋진 신사를 지었다옹.
그게 바로 여기 레이센 신사다옹!"
18,TEXT_REGOTH3REISEN_00452_SENRI_000_010,"실수로라도 본전에 있는 돌을 만지면 안 된다옹!
금줄이 풀리면 봉인이 깨져서 황룡이 되살아난다옹!
그렇게 되면 홍옥해는 불바다로 변할 거다옹!!"
19,TEXT_REGOTH3REISEN_00452_SENRI_000_011,"안 그래도 그렇게 될까 봐 신사로 통하는 길은 숨겨져 있고
우리 같은 서수가 감시하고 있다옹!
이곳은 사성수님들에게 이끌린 서수가 사는 마을이기도 하다옹!"
20,TEXT_REGOTH3REISEN_00452_SENRI_000_012,'텐젠'에 대해서 알고 싶냐옹?
21,TEXT_REGOTH3REISEN_00452_SENRI_000_013,"텐젠은 과거 사성수님들과 여행을 하던 무사다옹.
세상 모든 생명의 목소리를 들을 수 있는 특별한 힘이 있었는데,
일설에 따르면 하늘의 별하고도 대화를 나눌 수 있었다고 한다옹."
22,TEXT_REGOTH3REISEN_00452_SENRI_000_014,"그 능력 때문에 동족한테 배척을 당했던 모양인데,
본인은 전혀 신경 쓰지 않고 사람들을 도왔다고 한다옹."
23,TEXT_REGOTH3REISEN_00452_SENRI_000_015,"짐승을 데리고 사람들을 구하는 여행을 하다 보니
어느샌가 텐젠은 영웅이라 불리게 된다옹.
그 소문을 들은 황제는 그에게 황룡을 토벌하라는 명령을 내렸다옹."
24,TEXT_REGOTH3REISEN_00452_SENRI_000_016,"텐젠은 신검 '봉황도'를 들고
사성수보다 강력한 신통력이 있던 황룡을 상대로 용감하게 싸웠다옹.
하지만 안타깝게도 결국 황룡을 봉인하면서 목숨을 잃었다옹."
25,TEXT_REGOTH3REISEN_00452_SENRI_000_017,"홍옥해의 위기를 구한 텐젠의 활약은
전래동화가 되어 후세에 회자되고 있다옹.
이게 바로 '요괴 잡는 텐젠'의 탄생 비화다옹."
26,TEXT_REGOTH3REISEN_00452_SENRI_000_018,'현무'님에 대해서 알고 싶냐옹?
27,TEXT_REGOTH3REISEN_00452_SENRI_000_019,"현무 님은 사성수라 불리는 엄청난 서수 중 한 분이시다옹.
과거엔 사성수 중에서도 가장 강한 신통력을 갖고 계셨다고 한다옹.
하지만 지금은 상당히 약해지신 것 같다옹."
28,TEXT_REGOTH3REISEN_00452_SENRI_000_020,"어쩔 수 없다옹. 현무 님은 몇천 년 동안이나
황룡의 봉인을 지키기 위해 신통력을 계속 써 오셨으니…….
신통력은 마구 솟아나오는 게 아니라, 언젠간 고갈되는 것이다옹."
29,TEXT_REGOTH3REISEN_00452_SENRI_100_020,"그렇지만 소로반이라는 후계자를 찾았으니
현무 님의 뜻은 차기 사성수로 계승될 것이다옹."
30,TEXT_REGOTH3REISEN_00452_SENRI_200_020,"그나저나 소로반은 엄청냔 재능이 있다옹.
이미 현무 님의 요력을 뛰어넘었다는 게 그 증거다옹.
외모가 거북 같다는 이유만으로 선택받은 건 아닌가 보다옹."
31,TEXT_REGOTH3REISEN_00452_SENRI_000_021,'백호'님에 대해서 알고 싶냐옹?
32,TEXT_REGOTH3REISEN_00452_SENRI_000_022,"현무 님과 마찬가지로 사성수 중 한 분이신 백호 님은
아주 먼 옛날 얀샤에서 나고 자라셨다옹."
33,TEXT_REGOTH3REISEN_00452_SENRI_000_023,"하지만 흰색 털을 갖고 태어난 탓에
동족 무리에 끼지 못하고 산속에서 고독하게 사셨다옹.
참으로 애처로운 얘기다옹……."
34,TEXT_REGOTH3REISEN_00452_SENRI_000_024,"하지만 마음이 통하는 텐젠이라는 친구를 만난 백호 님은
자신처럼 의지할 곳 없는 자들을 구하기 위한 여행을 떠났다옹."
35,TEXT_REGOTH3REISEN_00452_SENRI_000_025,"그런 배경을 가졌음에도 불구하고
백호 님은 몇 번이나 얀샤를 재앙에서 구해내셨다옹.
정말, 너무나도 대인배이시다옹!"
36,TEXT_REGOTH3REISEN_00452_SENRI_000_030,'주작' 님에 대해서 알고 싶냐옹?
37,TEXT_REGOTH3REISEN_00452_SENRI_000_031,"주작 님은 태어냘 때부터 화염과 같은 붉은 깃털을 갖고
태어났다고 한다옹."
38,TEXT_REGOTH3REISEN_00452_SENRI_000_032,"그 모습을 보고 '봉황'으로 착각한 인간들은
불사의 힘을 얻으려고 주작 님을 집요하게 따라다닌 모양이다옹!
정말이지 야만적인 놈들이 아닐 수 없다옹!"
39,TEXT_REGOTH3REISEN_00452_SENRI_000_033,"하지만 텐젠만은
주작 님을 있는 모습 그대로 받아들였다옹."
40,TEXT_REGOTH3REISEN_00452_SENRI_000_034,"주작 님은 텐젠의 그런 상냥한 모습에 끌려
반해 버린 모양이다옹."
41,TEXT_REGOTH3REISEN_00452_SENRI_000_035,"그 후, 텐젠을 잃고 봉황의 능력과 비슷한
부활 능력에 눈 뜬 주작 님은
전쟁과 역병으로 죽어가던 많은 생명을 구했다 한다옹."
42,TEXT_REGOTH3REISEN_00452_SENRI_100_040,'청룡' 님에 대해서 알고 싶냐옹?
43,TEXT_REGOTH3REISEN_00452_SENRI_000_040,"동쪽 나라의 동쪽, 큰 뱀을 신으로 모시는 섬에서
청룡 님은 행운의 신으로 추앙받고 있었다옹.
당시엔 요력도 없는 그냥 뱀이었는데도 말이다옹."
44,TEXT_REGOTH3REISEN_00452_SENRI_000_041,"당연히 사람들의 소원을 이루어줄 수가 없었다옹.
요력에 약간 눈떴다고 해서 기적을 일으킬 순 없었다옹.
소원을 이루어주지 않는 신에게 사람들은 불만을 갖게 됐다옹."
45,TEXT_REGOTH3REISEN_00452_SENRI_000_042,"결국 신앙은 소멸되고 청룡 님은 목숨까지 위협받게 되었다옹.
사람들이 떠나간 건 그 기대에 부응하지 못했기 때문……
청룡님은 그렇게 생각하게 된 거다옹."
46,TEXT_REGOTH3REISEN_00452_SENRI_000_043,"그래서 청룡 님은 텐젠과의 맹세를……
어떻게 해서든 꼭 지키고 싶었던 거다옹.
텐젠이 자신을 떠나지 않길 바랐기에……."
47,TEXT_REGOTH3REISEN_00452_SENRI_100_500,"겉모습이 귀엽다고 해서 우리를 얕보면
혼쭐이 날 거다옹.
지금은 너냐들과 얘기하기 편한 모습으로 변한 것뿐이라옹."
48,TEXT_REGOTH3REISEN_00452_SENRI_000_500,백호 님의 모습을 보는 건 몇백 년만인지 모르겠다옹.
49,TEXT_REGOTH3REISEN_00452_SENRI_000_501,"아라미타마를 해방시킨 백호 님과 싸우다니
넌 정말 대단한 사람이다옹."
50,TEXT_REGOTH3REISEN_00452_SENRI_000_510,너라면 주작 님을 구할 수 있을 거다옹.
51,TEXT_REGOTH3REISEN_00452_SENRI_000_511,"주작 님의 아라미타마를 진정시킨 모양이구냐?
역시 넌 보통 놈이 아니다옹."
52,TEXT_REGOTH3REISEN_00452_SENRI_000_520,"냐옹…… 황룡의 부활을 막지 못하면 신사뿐 아니라
홍옥해 일대가 파멸될 것이다옹……."
53,TEXT_REGOTH3REISEN_00452_SENRI_000_525,"여기 있는 녀석들은 결국 도망가지 않고
숨어서 몰래 지켜보고 있었다옹.
만일의 사태가 벌어진다면 뛰어나갈 각오였다옹."
54,TEXT_REGOTH3REISEN_00452_SENRI_000_530,"너희들의 이야기를 후세에 남기는 것이
이 박식한 센리에게 남겨진 마지막 임무다옹."
55,TEXT_REGOTH3REISEN_00452_SENRI_000_550,"내가 본 녀석은
역시 텐젠의 자손이 아니었다옹."
56,TEXT_REGOTH3REISEN_00452_SENRI_000_551,"이번에는 네 덕분에 해결되었지만,
또 그런 생각을 하는 녀석이 나타날 수도 있다옹.
앞으로도 눈을 부릅뜨고 감시하면서 간식도 찾으러 갈 거다옹."
