#,Singular,Plural,Name,Tooltip,Adjective,PossessivePronoun,StartsWithVowel,Unknown0,Pronoun,Article,Icon
0,,,,,0,0,0,1,0,0,0
1,,,이프리트 마석,이프리트를 소환하는 마석. 고대의 비술을 사용해 사용자의 기억 속에서 유사 야만신을 만들어 냅니다.,0,0,0,1,0,0,27966
2,,,타이탄 마석,타이탄을 소환하는 마석. 고대의 비술을 사용해 사용자의 기억 속에서 유사 야만신을 만들어 냅니다.,0,0,0,1,0,0,27967
3,,,가루다 마석,가루다를 소환하는 마석. 고대의 비술을 사용해 사용자의 기억 속에서 유사 야만신을 만들어 냅니다.,0,0,0,1,0,0,27968
4,,,오딘 마석,오딘을 소환하는 마석. 고대의 비술을 사용해 사용자의 기억 속에서 유사 야만신을 만들어 냅니다.,0,0,0,1,0,0,27969
5,,,노간주나무 향: 숙명,"광요 교회에서 죽은 자를 떠나보낼 때 그 곁에서 피우는 노간주나무 향.
요정왕을 불러내, 앞을 가로막는 자에게 죽어야 할 운명을 내린다.",0,0,0,1,0,0,27975
