106,1,1,1,1,1,1,1,1,0,0,0,0,0,0,0,0,1,1,1,1,1,1,1,1,0,0,0,0,0,0,0,0,0,0,0,0,0,0,0,0,False,False,False,False,False,False,False,False,1,1,1,1,1,1,1,1,"오오, 어여쁜 우리 미레와……
이 몸에게 와준다면 내 모든 걸 바치겠어……!!","","","","","","",""
107,2,2,2,2,2,2,2,2,0,0,0,0,0,0,0,0,1,1,1,1,1,1,1,1,0,0,0,0,0,0,0,0,0,0,0,0,0,0,0,0,False,False,False,False,False,False,False,False,0,0,0,0,0,0,0,0,"현재 고블린족한테서
'해적의 약탈품'을 압수하는 작전 중입니다.
위험하니 멀리 떨어져 주십시오!","혹시 도와주실 의향이 있다면
'해적의 약탈품'을 이쪽으로
가져와 주셨으면 합니다.","해적의 약탈품'은 야영지 안에 떨어져 있거나
고블린족을 물리치면 손에 넣을 수 있을 겁니다!","","","","",""
108,2,2,2,2,2,2,2,2,0,0,0,0,0,0,0,0,1,1,1,1,1,1,1,1,0,0,0,0,0,0,0,0,0,0,0,0,0,0,0,0,False,False,False,False,False,False,False,False,0,0,0,3,0,0,0,0,"쉿!
지금 비밀 작전 중이니 조용히 해주십시오.
고블린족에게 들키면 큰일입니다.","사실 이 너머에 있는 야영지에서
고블린족이 '해적의 약탈품'을
사고판다는 정보를 얻었습니다…….","그 '해적의 약탈품'을 압수하는 작전을
준비하고 있던 참입니다.","작전을 도와주시겠습니까?

<UIForeground>F201F4</UIForeground><UIGlow>F201F5</UIGlow>※ 이 돌발 임무의 권장 레벨은 <Value>IntegerParameter(1)</Value>입니다.<UIGlow>01</UIGlow><UIForeground>01</UIForeground>","오오, 도와주신다니 정말 든든합니다!
'해적의 약탈품'은 야영지 안에 떨어져 있거나
고블린족을 물리치면 손에 넣을 수 있을 겁니다!","","음, 그럼 작전에 휩쓸리지 않도록
이 근처에서 최대한 멀리 떨어져 주십시오.",""
109,2,2,2,2,2,2,2,2,0,0,0,0,0,0,0,0,1,1,1,1,1,1,1,1,0,0,0,0,0,0,0,0,0,0,0,0,0,0,0,0,False,False,False,False,False,False,False,False,0,2,0,0,0,0,0,0,"'해적의 약탈품'을 가지고 와주셨습니까?","","","","오, 정말 고맙습니다!
혹시 또 발견한다면 제게 가져와 주시기 바랍니다!","","해적의 약탈품'은 아직 압수 못 하셨습니까?
야영지 안에 떨어진 걸 줍거나
고블린족한테 빼앗으면 됩니다!",""
110,2,2,2,2,2,2,2,2,0,0,0,0,0,0,0,0,1,1,1,1,1,1,1,1,0,0,0,0,0,0,0,0,0,0,0,0,0,0,0,0,False,False,False,False,False,False,False,False,0,0,0,3,0,0,0,0,"저, 하나만 물을게요.
혹시 남쪽 방파벽으로 가시는 길인가요?","남쪽 방파벽에 급히 전해야 할
물자가 있는데, 웬 수상한 배가 발견됐다면서
병사들이 모두 나가는 바람에 호위해줄 사람이 없어요.","저와 함께 가면서 호위를 맡아주실 수 없을까요?
요즘 이 부근은 혼자 지나다니기엔 너무 뒤숭숭하거든요.","함께 가주시겠습니까?

<UIForeground>F201F4</UIForeground><UIGlow>F201F5</UIGlow>※ 이 돌발 임무의 권장 레벨은 <Value>IntegerParameter(1)</Value>입니다.<UIGlow>01</UIGlow><UIForeground>01</UIForeground>","","","그렇군요, 그럼 다른 사람을 찾을게요.",""
111,2,2,2,2,2,2,2,2,0,0,0,0,0,0,0,0,1,1,1,1,1,1,1,1,0,0,0,0,0,0,0,0,0,0,0,0,0,0,0,0,False,False,False,False,False,False,False,False,0,0,0,3,0,0,0,0,"뭐, 뭐야……. 나를 보살펴주고 나서
사례비를 엄청 뜯어 가려는 건가? 그렇게는 안 되지.","나는 바로 코앞에 있는 저녁별 만으로
상품을 사들이러 갈 뿐이야. 어때, 별거 없지?","뭐, 그쪽 길이 좀 위험하고 내가 실수로
무릎을 다치긴 했지만, 조용히 걸어가면 될 거야…….
어차피 호위를 고용할 형편도 못 되니까…….","저녁별 만까지 데려다주시겠습니까?

<UIForeground>F201F4</UIForeground><UIGlow>F201F5</UIGlow>※ 이 돌발 임무의 권장 레벨은 <Value>IntegerParameter(1)</Value>입니다.<UIGlow>01</UIGlow><UIForeground>01</UIForeground>","","","내 꼴을 비웃을 거라면 썩 꺼져버려.
혹시 적이 널 쫓아가기라도 하면 난 만세를 부를 일이고.",""
112,2,2,2,2,2,2,2,2,0,0,0,0,0,0,0,0,1,1,1,1,1,1,1,1,0,0,0,0,0,0,0,0,0,0,0,0,0,0,0,0,False,False,False,False,False,False,False,False,0,0,0,0,0,0,0,0,"땅 정령의 핵은 충분히 모였네…….
하지만 아직 가진 게 남아있다면…… 주게.","","","","","","",""
113,2,2,2,2,2,2,2,2,0,0,0,0,0,0,0,0,1,1,1,1,1,1,1,1,0,0,0,0,0,0,0,0,0,0,0,0,0,0,0,0,False,False,False,False,False,False,False,False,0,2,0,0,0,0,0,0,"땅 정령의 핵은 필요한 만큼 모였네.
물론…… 많으면 많을수록 좋지만 말이야…….","","","","고맙게 받아두겠네…….
다음 공사에 쓸 수 있을 거야…….","","상관없네……. 이미 필요한 만큼 가지고 있어.",""
114,2,2,2,2,2,2,2,2,0,0,0,0,0,0,0,0,1,1,1,1,1,1,1,1,0,0,0,0,0,0,0,0,0,0,0,0,0,0,0,0,False,False,False,False,False,False,False,False,0,0,0,0,0,0,0,0,"선인장 과육이 많이 모였어요!
모험가님이 친절하게 도와주신 덕분이에요. 정말 고마워요.","","","","","","",""
115,2,2,2,2,2,2,2,2,0,0,0,0,0,0,0,0,1,1,1,1,1,1,1,1,0,0,0,0,0,0,0,0,0,0,0,0,0,0,0,0,False,False,False,False,False,False,False,False,0,2,0,0,0,0,0,0,"선인장 과육이요……?
더 받아도 괜찮아요……?","","","","와, 정말 고맙습니다!
이렇게 많으니까 저도 조금만 먹어도 될까요……?","","모험가님도 선인장을 좋아하시는군요.",""
116,2,2,2,2,2,2,2,2,0,0,0,0,0,0,0,0,1,1,1,1,1,1,1,1,0,0,0,0,0,0,0,0,0,0,0,0,0,0,0,0,False,False,False,False,False,False,False,False,0,0,0,0,0,0,0,0,"도적단한테 빼앗긴 짐은 다 찾았습니다요.
위대하신 모험가님 덕분이죠!","","","","","","",""
117,2,2,2,2,2,2,2,2,0,0,0,0,0,0,0,0,1,1,1,1,1,1,1,1,0,0,0,0,0,0,0,0,0,0,0,0,0,0,0,0,False,False,False,False,False,False,False,False,0,2,0,0,0,0,0,0,"어라? 아직 제 짐이 남아있었나요?","","","","아하, 그러고 보니 이런 것도 있었죠.
역시 모험가님은 빈틈이 없으시다니까!","","그야 그렇죠!
제 짐은 다 되찾았거든요.",""
118,2,2,2,2,2,2,2,2,0,0,0,0,0,0,0,0,1,1,1,1,1,1,1,1,0,0,0,0,0,0,0,0,0,0,0,0,0,0,0,0,False,False,False,False,False,False,False,False,0,0,0,0,0,0,0,0,"영혼석이 이렇게 잔뜩 있다니…….
우후후, 아주 깊이 있는 연구를 할 수 있겠어요.","","","","","","",""
119,2,2,2,2,2,2,2,2,0,0,0,0,0,0,0,0,1,1,1,1,1,1,1,1,0,0,0,0,0,0,0,0,0,0,0,0,0,0,0,0,False,False,False,False,False,False,False,False,0,2,0,0,0,0,0,0,"아직 골렘의 영혼석을 가지고 있나요?
좋아요, 주세요.","","","","이미 충분하긴 하지만 무심코 욕심을 부리게 되네요.
당신의 헌신적인 모습 때문일까요?","","어머, 저를 가지고 노신 건가요?",""
120,2,2,2,2,2,2,2,2,0,0,0,0,0,0,0,0,1,1,1,1,1,1,1,1,0,0,0,0,0,0,0,0,0,0,0,0,0,0,0,0,False,False,False,False,False,False,False,False,0,0,0,3,0,0,0,0,"앗, 거기 계신 모험가님!
제 부탁 좀 들어주세요!","저는 공예품 만들 때 쓸 '무지개조개'를 모으고 있었어요.
그런데…… 갑자기 콜리브리가 나타나더니
조개껍질을 몽땅 집어삼키고 말았어요……!","하지만 소화되려면 아직 시간이 있을 거예요!
콜리브리들이 먹은 '무지개조개'를 되찾아주세요!
무슨 수를 쓰든 상관없으니까요!","조개를 되찾아주시겠습니까?

<UIForeground>F201F4</UIForeground><UIGlow>F201F5</UIGlow>※ 이 돌발 임무의 권장 레벨은 <Value>IntegerParameter(1)</Value>입니다.<UIGlow>01</UIGlow><UIForeground>01</UIForeground>","와! 도와주시는 건가요?
정말 고맙습니다 모험가님!","","이럴 수가…….
어쩌지, 이러다 조개가 다 소화되겠어……!",""
121,2,2,2,2,2,2,2,2,0,0,0,0,0,0,0,0,1,1,1,1,1,1,1,1,0,0,0,0,0,0,0,0,0,0,0,0,0,0,0,0,False,False,False,False,False,False,False,False,0,0,0,0,0,0,0,0,"콜리브리들이 소화시키기 전에
'무지개조개' 껍데기를 되찾아주세요!","","","","","","",""
122,2,2,2,2,2,2,2,2,0,0,0,0,0,0,0,0,1,1,1,1,1,1,1,1,0,0,0,0,0,0,0,0,0,0,0,0,0,0,0,0,False,False,False,False,False,False,False,False,0,2,0,0,0,0,0,0,"'무지개조개'는 가지고 오셨나요?","","","","정말 고맙습니다!
조개를 먹은 콜리브리가 아직 더 있을 거예요.
그러니까 더 많이 되찾아주세요!","","콜리브리가 조개를 소화시켜버리기 전에 서둘러주세요!",""
123,2,2,2,2,2,2,2,2,0,0,0,0,0,0,0,0,1,1,1,1,1,1,1,1,0,0,0,0,0,0,0,0,0,0,0,0,0,0,0,0,False,False,False,False,False,False,False,False,0,0,0,0,0,0,0,0,"무지개조개'은 이제 충분히 모았어요.
좀 끈적거리는 것 같지만……
멋진 공예품을 만들게요!","","","","","","",""
124,2,2,2,2,2,2,2,2,0,0,0,0,0,0,0,0,1,1,1,1,1,1,1,1,0,0,0,0,0,0,0,0,0,0,0,0,0,0,0,0,False,False,False,False,False,False,False,False,0,2,0,0,0,0,0,0,"'해적의 약탈품'을 가지고 오셨습니까?","","","","고맙습니다!
혹시 더 압수하시거든 가져다주십시오.","","저는 곧 복귀할 예정이니
혹시 '해적의 약탈품'을 가지고 계신다면
서둘러 건네주시기 바랍니다.",""
125,2,2,2,2,2,2,2,2,0,0,0,0,0,0,0,0,1,1,1,1,1,1,1,1,0,0,0,0,0,0,0,0,0,0,0,0,0,0,0,0,False,False,False,False,False,False,False,False,0,0,0,0,0,0,0,0,"고블린족 강제수사는 무사히 마쳤습니다!
협력해주셔서 고맙습니다!","저는 곧 복귀할 예정이니
혹시 '해적의 약탈품'을 가지고 계신다면
서둘러 건네주시기 바랍니다.","","","","","",""
126,2,2,2,2,2,2,2,2,0,0,0,0,0,0,0,0,1,1,1,1,1,1,1,1,0,0,0,0,0,0,0,0,0,0,0,0,0,0,0,0,False,False,False,False,False,False,False,False,0,0,0,3,0,0,0,0,"궤짝과 관짝은 키키룬 출입 금지야.
너 혹시 키키룬을 데리고 온 건…… 아니겠지.","수인 배척령이 내려진 것도 내려진 거지만
솔직히 그놈들 냄새가 너무 지독해!
그래서 못 들어오게 하는데, 끈질긴 놈이 있어서…….","한두 마리면 나 혼자서도 쉽게 처리할 수 있지만
요즘은 떼를 지어서 쳐들어오더군.
바쁜 일이 없다면 내쫓는 걸 도와주지 않겠나?","처리를 도와주시겠습니까?

<UIForeground>F201F4</UIForeground><UIGlow>F201F5</UIGlow>※ 이 돌발 임무의 권장 레벨은 <Value>IntegerParameter(1)</Value>입니다.<UIGlow>01</UIGlow><UIForeground>01</UIForeground>","","","그래, 손님한테 부탁할 일은 아니지…….
미안하군. 신경 쓰지 말고 안에서 한잔하게.",""
127,1,1,1,1,1,1,1,1,0,0,0,0,0,0,0,0,1,1,1,1,1,1,1,1,0,0,0,0,0,0,0,0,0,0,0,0,0,0,0,0,False,False,False,False,False,False,False,False,0,0,3,0,0,0,0,0,"모험가여, 때마침 잘 왔군!
미안하네만 '자이언트' 물리치는 걸 도와주게.
놈들이 아예 이 주변에 자리를 잡으려는지 자꾸 나타나.","특히 '비석 탑'이 수차례 습격당하는 바람에
안 그래도 경비 인력이 부족하거든…… 도와줄 수 있겠나?","경비를 도와주시겠습니까?

<UIForeground>F201F4</UIForeground><UIGlow>F201F5</UIGlow>※ 이 돌발 임무의 권장 레벨은 <Value>IntegerParameter(1)</Value>입니다.<UIGlow>01</UIGlow><UIForeground>01</UIForeground>","","도와줘서 고맙네, 모험가!
자, 그럼 우리 손으로 승리를 거머쥐어볼까!","","그런가…… 그렇다면 다른 사람을 '비석 탑' 쪽에
지원군으로 보내달라고 전달이라도 해주겠나?
우리는 여기서 놈들을 계속 감시하고 있을 테니 말이야.",""
128,2,2,2,2,2,2,2,2,0,0,0,0,0,0,0,0,1,1,1,1,1,1,1,1,0,0,0,0,0,0,0,0,0,0,0,0,0,0,0,0,False,False,False,False,False,False,False,False,0,0,0,3,0,0,0,0,"오, 그야말로 하늘이 도우셨군요!
모험가님, 갑자기 죄송하지만
제 호위를 맡아주실 수 없을까요?","실은 '성 코이나크 재단 조사지'까지
가야 하는데, 그……
마물이 무서워서 꼼짝 못 하고 있습니다.","그래서 호위를 찾고 있었는데……
도움을 부탁할 곳도 없고
어찌해야 하나 고민하던 참이었죠.","호위를 맡으시겠습니까?

<UIForeground>F201F4</UIForeground><UIGlow>F201F5</UIGlow>※ 이 돌발 임무의 권장 레벨은 <Value>IntegerParameter(1)</Value>입니다.<UIGlow>01</UIGlow><UIForeground>01</UIForeground>","","","그렇군요…… 아쉽습니다.
힘든 부탁을 해서 죄송합니다.
다른 분을 찾아보도록 하죠.",""
129,1,1,1,1,1,1,1,1,0,0,0,0,0,0,0,0,1,1,1,1,1,1,1,1,0,0,0,0,0,0,0,0,0,0,0,0,0,0,0,0,False,False,False,False,False,False,False,False,0,0,0,3,0,0,0,0,"모험가!? 사, 살았다…….
미안하지만 당신 도움이 필요해.","부끄러운 일이지만, 정찰 도중에 조난을 당했다네.
그것도 모자라 늑대 무리 눈에 띄고 말았지.
놈들한테 쫓기느라 이 눈 속을 얼마나 뛰었는지 몰라.","어떻게든 놈들을 쫓아내려 했지만
도망치는 데 기운을 다 써서 뜻대로 안 되더군.
이보게, 나를 좀 도와주지 않겠나?","처리를 도와주시겠습니까?

<UIForeground>F201F4</UIForeground><UIGlow>F201F5</UIGlow>※ 이 돌발 임무의 권장 레벨은 <Value>IntegerParameter(1)</Value>입니다.<UIGlow>01</UIGlow><UIForeground>01</UIForeground>","","","그래? 그럼 할 수 없지…….
뭐, 잠깐 여기서 쉬다가
내 힘으로 어떻게든 해보겠네.",""
130,2,2,2,2,2,2,2,2,0,0,0,0,0,0,0,0,1,1,1,1,1,1,1,1,0,0,0,0,0,0,0,0,0,0,0,0,0,0,0,0,False,False,False,False,False,False,False,False,0,0,0,3,0,0,0,0,"우리는 빙벽 조사대라네.
마침 좋을 때 나타나주었군, 모험가여.
잠깐 우리 이야기 좀 들어주지 않겠나?","실은 이 너머에 자이언트족이 버티고 서있어서
야영지로 돌아가지도 못한 채 발이 묶였다네.","빙벽 조사대는 이름 그대로 조사가 주된 임무라
자이언트족을 쓰러뜨릴 만한 힘은 없어.
그러니 모험가인 자네가 우리를 도와줄 수 없겠나?","처리를 도와주시겠습니까?

<UIForeground>F201F4</UIForeground><UIGlow>F201F5</UIGlow>※ 이 돌발 임무의 권장 레벨은 <Value>IntegerParameter(1)</Value>입니다.<UIGlow>01</UIGlow><UIForeground>01</UIForeground> ","","","그런가…… 아니, 자네를 원망하진 않아.
하지만 이제 어찌해야 할지 모르겠군.
일단 물러나서 지원군을 불러야 하나……?",""
131,2,2,2,2,2,2,2,2,0,0,0,0,0,0,0,0,1,1,1,1,1,1,1,1,0,0,0,0,0,0,0,0,0,0,0,0,0,0,0,0,False,False,False,False,False,False,False,False,0,0,0,0,0,0,0,0,"모험가여, 우리를 도와줄 생각은 없는가?
우리는 여기 동쪽에 있는 '아도넬 점성대'를 지키는
뒤랑데르 가 위병일세.","지금 우리가 지키는 그 땅으로
자이언트족이 이동하고 있네.
서둘러 놈들과 맞서 싸울 작전을 펼쳐야만 해.","우리는 놈들을 상대하는 데 익숙하지만……
놈들에게 밀릴 가능성이 아예 없는 건 아닐세.
그러니 확고한 승리를 위해 그대의 힘을 보태주게!","","","","",""
132,2,2,2,2,2,2,2,2,0,0,0,0,0,0,0,0,1,1,1,1,1,1,1,1,0,0,0,0,0,0,0,0,0,0,0,0,0,0,0,0,False,False,False,False,False,False,False,False,0,0,0,3,0,0,0,0,"거기 당신…… 모험가 맞죠?
같은 모험가끼리 서로 돕고 사는 거 어때요?","길드에서 맡긴 일 때문에 유품을 찾으러 왔는데……
저기 보세요, 닉스가 떡하니 버티고 있잖아요?
도저히 작업할 상황이 아니라니까요.","그렇다고 힘으로 없애버리자니
내가 감당하기엔 조금 버거운 상대거든요…….
그래서 당신이 도와줬으면 해요.","처리를 도와주시겠습니까?

<UIForeground>F201F4</UIForeground><UIGlow>F201F5</UIGlow>※ 이 돌발 임무의 권장 레벨은 <Value>IntegerParameter(1)</Value>입니다.<UIGlow>01</UIGlow><UIForeground>01</UIForeground> ","","","……냉정한 사람이군요.
됐어요, 이제 부탁 안 할게요.
그 대신 당신한테 무슨 일이 생겨도…… 안 도와줄 거예요!",""
133,2,2,2,2,2,2,2,2,0,0,0,0,0,0,0,0,1,1,1,1,1,1,1,1,0,0,0,0,0,0,0,0,0,0,0,0,0,0,0,0,False,False,False,False,False,False,False,False,0,0,0,0,0,0,0,0,"그럼 부탁할게요!
시원하게 물리쳐버려요!!","아, 야영지 안에 있는 녀석만 처리하면 돼요!
밖에 있는 녀석은 그냥 내버려둬도 상관없어요.","","","","","",""
134,2,2,2,2,2,2,2,2,0,0,0,0,0,0,0,0,1,1,1,1,1,1,1,1,0,0,0,0,0,0,0,0,0,0,0,0,0,0,0,0,False,False,False,False,False,False,False,False,0,0,0,3,0,0,0,0,"이 주변에서 제국군이 쓰던 마도 병기 잔해가
발견됐다고 해서…… 찾으러 왔어.
적 병기를 연구하는 건 전략 구성의 첫걸음이잖아?","이건 녀석들이 쓰는 마도 병기의 핵심,
'청린기관 부품'을 손에 넣을 다시없는 기회야……
그렇게 마음먹고 왔는데 생각만큼 쉽지 않더군.","그러니 부품 회수하는 걸 도와주지 않겠나?
부품은 떨어져 있는 병기 잔해를 살펴보거나……
아직 움직이는 녀석을 물리치면 손에 넣을 수 있어.","회수를 도와주시겠습니까?

<UIForeground>F201F4</UIForeground><UIGlow>F201F5</UIGlow>※ 이 돌발 임무의 권장 레벨은 <Value>IntegerParameter(1)</Value>입니다.<UIGlow>01</UIGlow><UIForeground>01</UIForeground>","자네, 아주 훌륭하군!
자네의 헌신이 반드시 보답 받을 날이 올 거야!","","크읍……
이런 단순 노동은 나랑 안 맞는데…….",""
135,2,2,2,2,2,2,2,2,0,0,0,0,0,0,0,0,1,1,1,1,1,1,1,1,0,0,0,0,0,0,0,0,0,0,0,0,0,0,0,0,False,False,False,False,False,False,False,False,0,2,0,0,0,0,0,0,"어디 보자…… 주 기관이 이쪽이고, 보조 기관은 이쪽.
이 관을 저쪽에 연결하면…… 앗, 미안하네.
그래, 청린기관 부품은 모아왔나?","","","","오, 자네 정말 훌륭하지 않나!
덕분에 부품이 상당히 모였어.
하지만…… 아직 모자라는군. 조금만 더 부탁하지.","","그런가? 그럼 열심히 해주게나.",""
136,2,2,2,2,2,2,2,2,0,0,0,0,0,0,0,0,1,1,1,1,1,1,1,1,0,0,0,0,0,0,0,0,0,0,0,0,0,0,0,0,False,False,False,False,False,False,False,False,0,0,0,0,0,0,0,0,"이 근처에 있는 '마도 병기 잔해'를 살펴보고
'청린기관 부품'이 나오면 가져다주게.","","","","","","",""
137,2,2,2,2,2,2,2,2,0,0,0,0,0,0,0,0,1,1,1,1,1,1,1,1,0,0,0,0,0,0,0,0,0,0,0,0,0,0,0,0,False,False,False,False,False,False,False,False,0,0,2,0,0,0,0,0,"좋아, 좋아. 부품을 이렇게나 모았으니
갈레말 제국 핵심 기술은 속이 훤히 드러난 거나 마찬가지야!","그렇지만 자료로 쓸 부품은 많으면 많을수록 좋지.
아직 더 가지고 있다면 철수하기 전에 건네주길 바라네.
곧 있으면 청린 연구소로 돌아가야 하거든.","","","좋아, 정말 훌륭해.
혹시 또 발견하면 가져다주게.","","그런가? 알았네.
혹시 발견하면 바로 가져다주겠나?",""
138,2,2,2,2,2,2,2,2,0,0,0,0,0,0,0,0,1,1,1,1,1,1,1,1,0,0,0,0,0,0,0,0,0,0,0,0,0,0,0,0,False,False,False,False,False,False,False,False,0,0,0,0,0,0,0,0,"청린기관 부품은 필요한 만큼 모았어.
이제 청린 연구소로 돌아가서 이걸 잘 조사해봐야지.","","","","","","",""
139,2,2,2,2,2,2,2,2,0,0,0,0,0,0,0,0,1,1,1,1,1,1,1,1,0,0,0,0,0,0,0,0,0,0,0,0,0,0,0,0,False,False,False,False,False,False,False,False,0,0,0,3,0,0,0,0,"저는요, 골렘이 생겨난 원인을 조사하기 위해서요
골렘이나 스프리건이 가지고 있다는
'골렘의 영혼석'을 모으러 왔어요.","근데요 근데요, 이 주변 마물은 너무 세서……
제 힘으론 도저히 상대가 안 되지 뭐예요.","그러니까요, 저 대신 모험가님이요
'골렘의 영혼석'을 모아주시면 안 될까요?","조사를 도와주시겠습니까?

<UIForeground>F201F4</UIForeground><UIGlow>F201F5</UIGlow>※ 이 돌발 임무의 권장 레벨은 <Value>IntegerParameter(1)</Value>입니다.<UIGlow>01</UIGlow><UIForeground>01</UIForeground>","정말 고마워요.
그럼 잘 부탁해요.","","그러시구나…….
알겠어요, 다른 사람한테 부탁할게요.",""
140,2,2,2,2,2,2,2,2,0,0,0,0,0,0,0,0,1,1,1,1,1,1,1,1,0,0,0,0,0,0,0,0,0,0,0,0,0,0,0,0,False,False,False,False,False,False,False,False,0,2,0,0,0,0,0,0,"앗, 광석을 가지고 와주셨나요?","","","","덕분에 살았어요.
좀 더 많이 필요하니까 부탁할게요!","","그렇군요.
그럼 힘내세요.
기다릴게요.",""
141,2,2,2,2,2,2,2,2,0,0,0,0,0,0,0,0,1,1,1,1,1,1,1,1,0,0,0,0,0,0,0,0,0,0,0,0,0,0,0,0,False,False,False,False,False,False,False,False,0,0,0,0,0,0,0,0,"골렘이 생겨난 원인을 조사하기 위해서요
마물이 가진 '골렘의 영혼석'을 모으고 있어요.
혹시 발견하면요…… 저한테 가져다주세요.","","","","","","",""
142,2,2,2,2,2,2,2,2,0,0,0,0,0,0,0,0,1,1,1,1,1,1,1,1,0,0,0,0,0,0,0,0,0,0,0,0,0,0,0,0,False,False,False,False,False,False,False,False,0,0,0,0,0,0,0,0,"필요한 광석은 다 모았어요. 고마워요.
근데요 근데요, 많으면 많을수록 좋으니까요……
혹시 더 있으면 가지고 와주세요.","","","","","","",""
143,2,2,2,2,2,2,2,2,0,0,0,0,0,0,0,0,1,1,1,1,1,1,1,1,0,0,0,0,0,0,0,0,0,0,0,0,0,0,0,0,False,False,False,False,False,False,False,False,0,2,0,0,0,0,0,0,"덕분에 필요한 만큼 모았어요.
근데요, 자료로 쓸 광석은 많을수록 좋으니까요
좀 더 가져오셔도 돼요.","","","","정말 고마워요.
필요한 양은 이미 채웠지만 잘 받을게요.
조사 정밀도가 더 오를 테니까요.","","그렇군요…….
그렇지만 필요한 양은 다 모았으니까요, 괜찮아요.",""
144,2,2,2,2,2,2,2,2,0,0,0,0,0,0,0,0,1,1,1,1,1,1,1,1,0,0,0,0,0,0,0,0,0,0,0,0,0,0,0,0,False,False,False,False,False,False,False,False,0,0,0,3,0,0,0,0,"흉악한 드래곤족 황룡 '스바라'를 알고 있나?
아도넬 점성대 관측 결과가 나왔는데, 그 녀석이 지금
'강철 경계초소' 쪽으로 가고 있다는군.","놈들을 요격하기 위해
우리 공병들은 한시라도 빨리 드래곤용 대포를 설치해야만 해.","하지만 아마 놈들의 졸개가 방해하러 오겠지…….
이보게 모험가, 설치 작업을 마칠 때까지
자네가 우리 공병부대를 지켜주지 않겠나!?","호위를 맡으시겠습니까?

<UIForeground>F201F4</UIForeground><UIGlow>F201F5</UIGlow>※ 이 돌발 임무의 권장 레벨은 <Value>IntegerParameter(1)</Value>입니다.<UIGlow>01</UIGlow><UIForeground>01</UIForeground>","","","",""
145,2,2,2,2,2,2,2,2,0,0,0,0,0,0,0,0,1,1,1,1,1,1,1,1,0,0,0,0,0,0,0,0,0,0,0,0,0,0,0,0,False,False,False,False,False,False,False,False,0,0,0,3,0,0,0,0,"실은 기가스족이 이 땅을 노리고 있거든요~
그래서 몇 번이나 쫓아냈는데
이번엔 여기 물자를 노리기 시작했어요~","이 물자를 수송하다가 우리도 습격당해서요~
겨우겨우 여기까지 도망치긴 했는데
물자를 노리고 다시 습격해올 것 같아서요~","호위를 맡은 자들도 오면서 계속 싸우느라 지쳐서 말이죠~
누군가 도와주지 않을까~ 해서요.","호위를 맡으시겠습니까?

<UIForeground>F201F4</UIForeground><UIGlow>F201F5</UIGlow>※ 이 돌발 임무의 권장 레벨은 <Value>IntegerParameter(1)</Value>입니다.<UIGlow>01</UIGlow><UIForeground>01</UIForeground>","","","역시 그렇겠죠~
그런 마음씨 착한 분이 어디
그렇게 쉽게 나타나겠어요~?",""
146,0,0,0,0,0,0,0,0,0,0,0,0,0,0,0,0,1,1,1,1,1,1,1,1,0,0,0,0,0,0,0,0,0,0,0,0,0,0,0,0,False,False,False,False,False,False,False,False,0,0,0,0,0,0,0,0,"이곳 '성 다니펜의 눈물'은 이슈가르드에서
'성수'가 솟아나는 성스러운 샘으로 알려져 있어요.","저도 '성수'를 구하러 찾아왔는데
갑자기 위험한 물 정령이 나타나는 바람에……
부디 저 대신 '성수'를 모아주시겠어요?","","","","","",""
147,0,0,0,0,0,0,0,0,0,0,0,0,0,0,0,0,1,1,1,1,1,1,1,1,0,0,0,0,0,0,0,0,0,0,0,0,0,0,0,0,False,False,False,False,False,False,False,False,0,2,0,0,0,0,0,0,"혹시 '성수'를 가지고 와주셨나요?","","","","마…… 맞아요. 바로 이거예요!
아, 이게 조금만 더 있으면 좋을 텐데요…….","","그렇군요…… 저기, 모험가님?
혹시 당신도 '성수'를 구하러
여기까지 찾아오신 건가요?",""
148,0,0,0,0,0,0,0,0,0,0,0,0,0,0,0,0,1,1,1,1,1,1,1,1,0,0,0,0,0,0,0,0,0,0,0,0,0,0,0,0,False,False,False,False,False,False,False,False,0,0,0,0,0,0,0,0,"이 정도 있으면 의식에 필요한 양은 맞출 수 있겠어요.
그렇지만 여분도 어느 정도 있어야 하니까……
혹시 '성수'를 더 가지고 계신다면 꼭 제게 가져다주세요.
","","","","","","",""
149,0,0,0,0,0,0,0,0,0,0,0,0,0,0,0,0,1,1,1,1,1,1,1,1,0,0,0,0,0,0,0,0,0,0,0,0,0,0,0,0,False,False,False,False,False,False,False,False,0,2,0,0,0,0,0,0,"'성수'는 이미 필요한 만큼 모았지만
무슨 일이 있을지 모르니 여분을 마련하고 싶어요.
혹시 '성수'를 더 가지고 계신다면 제가 받을게요.","","","","정말 고맙습니다.
당신은 이렇게 선한 일을 하셨으니
반드시 신께서 보살피실 거예요.","","그렇군요…….
저기 혹시…… 당신도 역시
의식에 '성수'를 가지고 가시려는 건가요?",""
