#,Text
1221,"아플리케 기중기가 완성되었슴다!
협력해 주셔서 고맙슴다~!
드디어 구덩이 바닥으로 첫발을 내디뎠슴다!
지상과 단절된 미지의 환경은 어떨지…… 정말 기대됨다~!
탐색의 발자취에
레포팅웨이의 새로운 기사도 게재되었슴다!"
1222,"폭포 지대에 우주 라이너가 설치되었슴다!
협력해 주셔서 고맙슴다~!
캡슐 협곡으로 이동하기가 편해졌슴다!
이제 연구팀 여러분도 본격적으로 현지 조사를 할 수 있겠슴다~!
탐색의 발자취에
레포팅웨이의 새로운 기사도 게재되었슴다!"
1223,"유리직공 기지가 더욱 확장되었슴다!
협력해 주셔서 고맙슴다~!
기지 중앙을 증축하고 개축해서 시설이 꽤 갖춰졌슴다!
앞으로의 탐색을 위해 기지도 점점 정비해 나갈 검다~!
탐색의 발자취에
레포팅웨이의 새로운 기사도 게재되었슴다!"
1224,"로더 격납고가 개축되었슴다!
협력해 주셔서 고맙슴다~!
벽 내장재를 유리 자원을 사용한 소재로 교체했슴다!
기능성과 아름다움을 겸비한 새로운 소재에 건배임다~!
탐색의 발자취에
레포팅웨이의 새로운 기사도 게재되었슴다!"
1225,"우주 공항이 개축되었슴다!
협력해 주셔서 고맙슴다~!
전용 발뢰소를 정비했으니 에너지 충전도 순식간임다!
더 먼 우주로 떠날 준비도 완벽하단 뜻임다~!
탐색의 발자취에
레포팅웨이의 새로운 기사도 게재되었슴다!"
1226,"'거대 뇌력판: 남부'가 건설되었슴다!
협력해 주셔서 고맙슴다~!
다양한 광선을 이용해서 뇌력을 발생시킬 수 있게 됐슴다!
앞으로의 시설 발전을 고려해 한 대 더 건설할 검다!
다음은 거대 뇌력판: 서부 건설을 위한 공동 시공을 진행할 검다~!
시작 시간은 탐색의 발자취에서 확인할 수 있슴다!"
1227,"거대 뇌력판 두 대가 완성되었슴다!
협력해 주셔서 고맙슴다~!
이제 기지에서도 뇌력을 여유롭게 쓸 수 있을 검다!
이 에너지를 이용하면 계획이 또 얼마나 진전될지 기대됨다~!
탐색의 발자취에
레포팅웨이의 새로운 기사도 게재되었슴다!"
1228,"'동원관'이 건설되었슴다!
협력해 주셔서 고맙슴다~!
무거운 냉각 탱크를 옮기는 대형 무인기의 활약이 기대됨다!
이미 무인기가 녹은 유리 냉각을 시작했슴다~!
다음은 분화구의 녹은 유리 냉각을 위한 공동 시공을 진행할 검다~!
시작 시간은 탐색의 발자취에서 확인할 수 있슴다!"
1229,"녹은 유리 냉각 작전이 반쯤 진행되었슴다!
협력해 주셔서 고맙슴다~!
이 주변은 이제 무인기가 계속 냉각하면 충분할 듯함다!
계속해서 탐색 지역을 확대해 나가는 검다~!
다음은 녹은 유리 냉각 작전: 후반부를 위한 공동 시공을 할 검다~!
시작 시간은 탐색의 발자취에서 확인할 수 있슴다!"
1230,"녹은 유리 냉각 작전을 완수하였슴다!
협력해 주셔서 고맙슴다~!
이제 무인기가 냉각하면 충분할 듯함다!
녹은 유리가 굳어 투명해진 유리 지면이…… 참 예쁨다~!
탐색의 발자취에
레포팅웨이의 새로운 기사도 게재되었슴다!"
1231,"분화구 지대에 우주 라이너가 설치되었슴다!
협력해 주셔서 고맙슴다~!
퓨징웨이 분화구 안으로 이동하기가 편해졌슴다!
이걸로 모든 구역에 우주 라이너가 설치된 검다~!
탐색의 발자취에
레포팅웨이의 새로운 기사도 게재되었슴다!"
1232,"유리직공 기지에 천체망원경이 완성되었슴다!
여러분 덕분에 행성 파엔나의 모든 시설이 완성되었슴다~!
이제 우주에 있는 별들을 훨씬 더 잘 관측하고 분석할 수 있겠슴다!
우리의 우주 탐색이 더욱 큰 걸음을 내디디는 검다~!
여기까지 협력해 주셔서 정말 고맙슴다~!!
탐색의 발자취에 레포팅웨이의 기사도 게재되었슴다!"
1233,"유리조각 강가에서
번개 이온 에너지가 대량으로 발생했다!"
1234,"이 번개 이온의 힘을 이용하면 강변 지하에 잠든
화산 유리 자원인 '파엔나이트' 광맥을 더 쉽게 채굴할 수 있을 테지."
1235,"파워 로더를 출동시켜 파엔나이트를 채굴한다!
탑승 신청권을 가진 자는 조종사 신청을 해다오!"
1236,"냉각 주름 동굴 안에서 일어난 지열 변동으로
땅속에서 유리 덩어리가 대량으로 나타났다!"
1237,"순도가 매우 높은 유리 덩어리라서
행성 파엔나에서 정밀 기기를 개발하는 데 활용할 수도 있지!"
1238,"휠 로더를 출동시켜 이것을 파괴한 다음 회수한다!
탑승 신청권을 가진 자는 조종사 신청을 해다오!"
1239,
1240,
1241,
1242,
1243,
1244,
1245,
1246,
1247,
1248,
1249,
1250,
1251,
1252,
1253,
1254,
1255,
1256,
1257,
1258,
1259,
1260,
1261,
1262,
1263,
1264,
1265,
1266,
1267,
1268,
1269,
1270,
1271,
1272,
1273,
1274,
1275,
1276,
1277,
1278,
1279,
1280,
1281,
1282,
1283,
1284,
1285,
1286,
1287,
1288,
1289,
1290,
1291,
1292,
1293,
1294,
1295,
1296,
1297,
1298,
1299,
1300,
1301,"이번에는 갈레안계 마도 중장비를 준비했다.
이 기계의 장비를 사용해서 중력 뒤틀림을 없애는 임무를 맡아 다오."
1302,"플라스마 분사기는 넓은 범위의 중력 뒤틀림에 효과가 있지.
다만 중형 그라비데 덩어리에는 거의 효과가 없을 거다."
1303,"중형 그라비데 덩어리에는 우주 발파기를 사용해라.
연비는 나쁘지만, 위력은 확실하게 발휘하겠지!"
1304,"기체 작전을 시작한다!
검보라색 중력 뒤틀림 덩어리를 모조리 소멸시켜 다오!"
1305,"기체 작전에 협력해 줘서 고맙다!
'우주 땅다짐기'를 써서 땅속에 있는 그라비데 덩어리를 소멸시켜라!"
1306,"이번 임무에는 필드 탐지기를 설치하지 않았다.
중력 뒤틀림을 없애는 데에만 전념해 다오!"
1307,"중력 뒤틀림의 이상 수치가 정상화되었다…… 지령 성공이다!
조종사와 지원군 제군, 협력해 줘서 고맙다!"
1308,"안타깝게도 지령은 실패다…….
각자 해산하고 원래 임무로 복귀하도록……."
1309,"잊힌 당근 주변에서 대규모 중력 뒤틀림이 관측되었다.
그대로 두면 주변 지역에 악영향을 끼치겠지."
1310,"이 현상에 대비해 갈레안계 기술로 개조한 신형 로더를 준비했다.
이 기체라면 중력 뒤틀림을 인위적으로 없앨 수 있겠지."
1311,"이 기체를 사용하는 기체 작전을 발령한다!
탑승 신청권을 가진 자는 조종사 신청을 해다오!"
1312,"이번 지령은 레비테트스톤을 수집하는 일이다.
중력 이상 때문에 반중력 에너지를 띤 바위가 일대에 떠다니고 있다."
1313,"자네는 중력 이상에 적응할 수 있도록 개조한 기체를 타게 된다.
개량형 파워 흡인기를 사용하면, 레비테트스톤을 회수할 수 있겠지."
1314,"또한 기회가 닿으면,
상공에 떠 있는 거대 레비테트스톤 회수를 시도해 다오.
회수 시점은 추후에 알려주겠다!"
1315,"기체 작전을 시작한다!
공중에 떠오른 레비테트스톤을 수집해 다오!"
1316,"기체 작전에 협력해 줘서 고맙다!
공중에 떠오른 소형 레비테트스톤을 수집해라!"
1317,"수집한 자원은 필드 탐지기에 납품하라!
파워 로더의 활동에 도움이 될 거다!"
1318,"필드 탐지기가
상공에 떠다니는 거대 레비테트스톤을 발견했다!"
1319,"레비테트스톤 획득 목표치를 50% 달성했다!
이 기세라면 예상보다 더 많은 자원을 얻을 수 있겠군!"
1320,"레비테트스톤 획득 목표치를 90% 달성했다!
엄청난 성과를 기대할 수 있겠군!"
1321,"지령은 성공이다. 예상보다 많은 자원을 확보했군!
조종사와 지원군 제군, 협력해 줘서 고맙다!"
1322,"안타깝게도 지령은 실패다…….
각자 해산하고 원래 임무로 복귀하도록……."
1323,게라스 만에 국소적인 중력 이상이 발생했다!
1324,"이 중력 이상의 영향으로 땅속에 있던 레비테트스톤이
지표에 노출되어 떠오르는 현상이 확인되었다."
1325,"기체 작전을 발령하여, 레비테트스톤을 수집한다!
탑승 신청권을 가진 자는 조종사 신청을 해다오!"
1326,"현재 상황이다만, 해결의 실마리가 보이기 시작한 모양이다.
각자 담당하는 임무를 마지막으로 철수하라!"
1327,"모두의 협력으로 무사히 문제가 해결됐다!
긴급 상황 해제, 그대들의 협력에 감사한다."
1328,"해결될 기미가 보여 긴급 상황은 해제되었다.
남은 일은 본부에 맡기고, 귀환하도록……."
1329,"모두의 공헌으로 물자는 충분히 모았다!
협력할 수 있는 인원은 이어서 예비 물자 조달에도 참여해 다오."
1330,"난중력 발생 조짐을 확인했다!
예기치 못한 사태에 대비하여, 작업원 전원 경계를 늦추지 마라!"
1331,"난중력에 의해 남부 먼바다에서 바닷물 부유 현상이 발생했다.
탐색 구역에도 영향을 미칠 가능성이 있으니 경계하라!"
1332,"엄마 봄급 극대 저기압의 접근을 확인!
탐색 구역 전체에 폭풍 발생이 예상되니 주의하라!"
1333,"立盾の壁を中心に、大規模な乱重力が発生した！
緊急状況を発令、各員に協力を要請する！"
1334,"ケープ・ゲーラス一帯で海水が浮かび、水泡嵐が発生している。
稀少資源確保のため、各員に緊急作業を依頼したい！"
1335,"強い突風により、リフティング・レグ周辺で事故が発生！
緊急状況を宣言、貴君らに協力を要請する。"
1336,"強い突風により、基地北部の広域にて被害が生じている。
緊急状況を宣言、現地での協力を依頼したい！"
1337,"立盾の壁を中心に、大規模な乱重力が発生中！
必要物資の調達が急務である、現地に向かってくれたまえ。"
1338,"極束の浜と、先駆者のオアシスにて水泡嵐が発生中。
稀少資源確保のため、各員に緊急作業を依頼したい！"
1339,"強い突風により、リフティング・レグ周辺で事故が発生！
対応作業に、是非とも協力してほしい！"
1340,"ロングロスト・キャロット南部にて緊急状況発生中。
また、リフティング・レグでも負傷者が出たため、協力を求む！"
1341,"各員の貢献により、緊急状況解決の目途が立った。
予備物資は引き続き、立盾の壁で引き取るぞ。"
1342,"各員の貢献により、必要な稀少資源が十分に確保できた。
予備物資は引き続き、ケープ・ゲーラス付近で引き取るぞ。"
1343,各員の貢献により、緊急状況解決の目途が立った。予備物資は引き続き、リフティング・レグ周辺で引き取ろう！
1344,"ロングロスト・キャロットおよび、リフティング・レグにて、
予備物資の納入を受け付けており、状況は無事解決の見込みだ。"
1345,"방패의 벽의 응급 작업은 순조로운 모양이군.
여력이 있는 자는 기지 북부 물자 조달에 협력해 다오."
1346,"기지 북부에 필요한 기자재는 충분히 확보된 것 같다.
여력이 있는 자는 방패의 벽 작업을 도우러 가 다오!"
1347,"선구자의 오아시스에서 수집 목표를 달성했다.
여력이 있는 자는 극속 해변 물자 조달에 협력해 다오."
1348,"극속 해변의 희귀 자원은 충분히 확보된 것 같다.
여력이 있는 자는 선구자의 오아시스에서 작업을 도와 다오!"
1349,"허공의 벽에서 발생한 사고는 순조롭게 대처 중인 모양이군.
여력이 있는 자는 거석 도시 동쪽 물자 조달에 협력해 다오."
1350,"거석 도시 동쪽에서 일어난 사고는 거의 해결됐다.
여력이 있는 자는 허공의 벽에서 발생한 사고에 대처해 다오!"
1351,"낙석 사고는 순조롭게 처리 중인 모양이군.
여력이 있는 자는 뜬자갈 사막 물자 조달에 협력해 다오."
1352,"응급 처치용 물자는 충분히 확보했다.
여력이 있는 자는 잊힌 당근에서 협력해 다오!"
1353,
1354,"기지에서 생활하는 분들을 위한 거주 모듈 건설이 곧 시작됨다!
시작 시간이 다가오면 여기로 모여 주십쇼~!"
1355,"기지에서 생활하는 분들을 위한 거주 모듈이 완성됐슴다!
협력해 주셔서 고맙슴다~!
이 별에 있는 유적 중 일부를 거점으로 쓴다니,
신선한 느낌이 들지 않슴까?
탐색의 발자취에
레포팅웨이의 새로운 기사도 게재됐슴다!"
1356,"기지를 중심으로 한 중앙 평야에 우주 라이너를 설치할 검다!
자재 조달을 위한 우주 임무에 협력 부탁드림다!"
1357,"중앙 평야로 가는 우주 라이너의 완공 예정 시간이 결정됐슴다!
완공되면 더 편해질 테니 조금만 기다려 주십쇼~!"
1358,"중앙 평야에 우주 라이너가 완성되었슴다!
협력해 주셔서 고맙슴다~!
이제 기지를 중심으로 한 넓은 지역을 편하게 이동할 수 있게 됐슴다!
먼 곳을 조사하러 가기도 더 수월해질 검다~!
탐색의 발자취에
레포팅웨이의 새로운 기사도 게재됐슴다!"
1359,"필요한 에너지와 물을 확보하기 위해 기반 시설을 건설할 검다!
자재 조달을 위한 우주 임무에 협력 부탁드림다!"
1360,"발뢰소를 건설하는 공동 시공 작업의 시작 시간이 결정됐슴다!
작업이 시작되면 협력 부탁드림다~!"
1361,"발뢰소인 '동력 공급관'이 건설되었슴다!
협력해 주셔서 고맙슴다~!
환경 에테르를 에너지로 변환해서 확보할 수 있게 됐슴다!
이걸로 기지에 필요한 뇌력을 공급할 수 있겠슴다~!
곧바로 급수장 건설을 위한 공동 시공을 진행할 검다~!
시작 시간은 탐색의 발자취에서 확인할 수 있슴다!"
1362,"급수장인 '수자원관'이 건설되었슴다!
협력해 주셔서 고맙슴다~!
시설 부근에 딜리즈 씨의 연구소도 설치했슴다!
연구 거점으로 사용하신다고 함다!
탐색의 발자취에
레포팅웨이의 새로운 기사도 게재됐슴다!"
1363,"중력 이상으로 떠 있는 남동부 암반에는
이 별을 연구할 단서나 미지의 광물이 잠들어 있을지도 모름다!
닻산에서 중력 제어 장치로 주변에 떠다니는 바위를 고정하면
떠 있는 암반…… 푸른줄 부유대지로 가는 다리를 만들 수 있을 검다!
자재 조달을 위한 우주 임무에 협력 부탁드림다!"
1364,"중력 제어 장치의 설치 시작 시간이 결정됐슴다!
작업이 시작되면 협력 부탁드림다~!"
1365,"중력 발생기 설치가 완료됐슴다!
떠다니는 바위를 고정해서 푸른줄 부유대지로 갈 수 있게 됐슴다!
공중에 떠 있는 푸른줄 부유대지를 조사하다 보면
이 행성의 중력 이상도 더욱 자세히 규명할 수 있을 검다!
탐색의 발자취에
레포팅웨이의 새로운 기사도 게재됐슴다!"
1366,"푸른줄 부유대지로 가는 우주 라이너를 설치할 검다!
자재 조달을 위한 우주 임무에 협력 부탁드림다!"
1367,"푸른줄 부유대지로 가는 우주 라이너의 완공 예정 시간이 결정됐슴다!
완공되면 더 편해질 테니 조금만 기다려 주십쇼~!"
1368,"푸른줄 부유대지에 우주 라이너가 완성됐슴다!
협력해 주셔서 고맙슴다~!
남동부의 떠 있는 암반 안쪽까지 편하게 이동할 수 있게 됐슴다~!
이제 중력 이상 조사의 효율이 더욱 높아질 검다~!
탐색의 발자취에
레포팅웨이의 새로운 기사도 게재됐슴다!"
1369,"연구팀에 따르면, 기지 안쪽에 있는 무너진 결정체의 중앙 기구는
선구자들의 중앙 시스템일 수도 있다고 함다!
이게 움직이게 된다면 행성 오이지스와 선구자들에 대해
많은 걸 알게 될 검다~!!
'에우헤드론' 복구를 위해 기지를 재정비할 검다!
자재 조달을 위한 우주 임무에 협력 부탁드림다!"
1370,"발뢰소의 에너지를 끌어오기 위한
'마른땅 기지 재정비 공사'의 시작 시간이 결정됐슴다~!
작업이 시작되면 협력 부탁드림다~!"
1371,"마른땅 기지를 재정비했슴다!
다음 목표는 중앙 기구의 완전한 부활임다~!
이 시설 전체가 복구되면 선구자들이 남긴 정보를
알게 될 수 있을지도 모름다!
탐색의 발자취에
레포팅웨이의 새로운 기사도 게재됐슴다!"
1372,"에우헤드론 중앙 기구의 결정체는
행성 오이지스에서만 나는 매우 희귀한 광물인 것 같슴다!
하지만 지금은 색도 탁하고 표면이 열화된 듯한 상태이니……
활성화시키고 에테르 유동성을 조절해서 반짝반짝하게 만들 검다~!
지원 물자 조달을 위한 우주 임무에 협력해 주십쇼!"
1373,"열화된 중앙 기구의 결정체를 반짝반짝하게 만들기 위한
'에우헤드론 복원 계획'의 시작 시간이 결정됐슴다!
작업이 시작되면 협력 부탁드림다~!"
1374,"에우헤드론 중앙 기구가 복원됐슴다!
이제부터 연구팀이 분석을 시작할 검다~!
다시 작동시키는 데는 아직 시간이 조금 더 걸리겠지만,
어떤 정보가 잠들어 있을지…… 너무 기대됨다!
탐색의 발자취에
레포팅웨이의 새로운 기사도 게재됐슴다!"
1375,"이 별의 유물과 광석을 더 효율적으로 아이테리스에 운반해
분석하기 위해, 우주 공항 기능을 업그레이드할 검다!
자재 조달을 위한 우주 임무에 협력 부탁드림다!"
1376,"'우주 공항 정비 지원'의 시작 시간이 결정됐슴다!
작업이 시작되면 협력 부탁드림다~!"
1377,"우주 공항이 고성능으로 업그레이드됐슴다!
이제 더 많은 연구 물자를 아이테리스에 보내 분석할 수 있슴다~!
이 별에서만 나는 광물의 성질이나 선구자들이 남긴
문화의 흔적에 대한 연구가 엄청나게 진행될지도 모름다!
탐색의 발자취에
레포팅웨이의 새로운 기사도 게재됐슴다!"
1378,"비취핵 골짜기 지하에서 유적 같은 걸 발견했슴다!
지상 유적과 달리 보존 상태가 좋다면 엄청난 발견을 할지도 모름다!
연구팀의 주도로 발굴을 진행할 검다~!
지원 물자 조달을 위한 우주 임무에 협력해 주십쇼!"
1379,"'비취핵 골짜기 유적 발굴 계획'의 시작 시간이 결정됐슴다!
작업이 시작되면 협력 부탁드림다~!"
1380,"비취핵 골짜기에서 발굴을 진행하다 유적 입구 같은 걸 발견했슴다!
딜리즈 씨가 조사를 통해 안으로 들어가는 법을 알아내면 좋겠네요!
탐색의 발자취에
레포팅웨이의 새로운 기사도 게재됐슴다!"
1381,"닫혀 있던 비취핵 골짜기 유적의 문을 여는 방법이 판명됐슴다!
입구 옆에 있던 비활성 광석…… 그게 힌트였슴다!
아이테리스로 보낸 견본을 자세히 분석해서 알아낸 건데,
행성 고유의 광물을 촉매로 쓰면 광석이 활성화될지도 모름다!
유적을 개방할 계획을 세우는 중이니
지원 물자 조달을 위한 우주 임무에 협력해 주십쇼!"
1382,"'비취핵 골짜기 유적 개방 계획'의 시작 시간이 결정됐슴다!
작업이 시작되면 협력 부탁드림다~!"
1383,"드디어 비취핵 골짜기 유적의 문을 열었슴다~!
안에는 무엇이 잠들어 있을지…… 탐색을 계속해야겠슴다!
활성화되어 녹색 빛을 되찾은 광석에 대해서도
연구팀이 고찰하는 중이라고 함다!
탐색의 발자취에
레포팅웨이의 새로운 기사도 게재됐슴다!"
1384,"개방된 유적 안에서 새로운 결정체 기구가 우릴 기다리고 있었슴다!
이게 움직인다면 선구자들이 유적을 이용한 방법을 알 수 있을 검다!
복구할 계획을 세우는 중이니
지원 물자 조달을 위한 우주 임무에 협력해 주십쇼!"
1385,"'유적 기능 부활 계획'의 시작 시간이 결정됐슴다!
작업이 시작되면 협력 부탁드림다~!"
1386,"가이드 스톤이 복구되어 유적 내부가 본래의 기능을 되찾았슴다!
이제 유적 안쪽에 있는 닫힌 문 너머도 조사할 수 있겠슴다~!
이 기구는 지하 유적을 가동시켰을 뿐만 아니라,
행성 각지의 거점과 접속되어 있었다는 가설을 세우고 있다고 함다!
탐색의 발자취에
레포팅웨이의 새로운 기사도 게재됐슴다!"
1387,"유적 최심부에 잠들어 있던 새로운 결정체 기구는……
본부 기지의 기구처럼 표층이 열화되어 있는 듯함다.
이것도 활성화시키고 반짝반짝하게 갈고닦으면
본래의 기능을 되찾을 검다!
확실하게 재기동시킬 수 있도록 계획을 세우는 중이니
지원 물자 조달을 위한 우주 임무에 협력해 주십쇼!"
1388,"'비취핵 골짜기 유적 최심부 재기동 계획'의 시작 시간이 결정됐슴다!
작업이 시작되면 협력 부탁드림다~!"
1389,"사막굴 유적 최심부 기구, 메타헤드론이 다시 가동됐슴다~!
지하 유적의 용도에 대한 연구도 크게 진척될 검다!
게다가 기구에는 상당히 많은 정보가 손실 없이 남아 있는 듯함다!
어쩌면 본부 기지의 기구를 완전히 복구하는 데 도움이 될지도……!!
탐색의 발자취에
레포팅웨이의 새로운 기사도 게재됐슴다!"
1390,"비취핵 골짜기 내부에 우주 라이너를 설치할 검다!
자재 조달을 위한 우주 임무에 협력 부탁드림다!"
1391,"비취핵 골짜기로 가는 우주 라이너의 완공 예정 시간이 결정됐슴다!
완공되면 더 편해질 테니 조금만 기다려 주십쇼~!"
1392,"비취핵 골짜기에 우주 라이너가 완성되었슴다!
협력해 주셔서 고맙슴다~!
비취핵 골짜기 유적 안쪽까지 편하게 이동할 수 있게 됐슴다!
이제 유적 기구를 조사하기가 더 수월해질 검다~!
탐색의 발자취에
레포팅웨이의 새로운 기사도 게재됐슴다!"
1393,"유적에 있는 메타헤드론에 축적되어 있던 에테르 정보를
본부 기지의 기구인 에우헤드론을 복구할 때 활용할 수 있을 듯함다!
하지만 우리에겐 선구자들처럼 특수한 에테르 감응력이 없으니
기구끼리 공명시켜서 동기화할 수는 없슴다…….
대신, 기지에 통신 설비를 세워 에테르 정보를 직접 보낼 검다~!
우선 기지 구조를 강화해야 하니, 자재 조달 임무에 협력해 주십쇼!"
1394,"'마른땅 기지 구조 강화 공사'의 시작 시간이 결정됐슴다!
작업이 시작되면 협력 부탁드림다~!"
1395,"마른땅 기지의 구조를 튼튼하게 강화했슴다~!
이제 기지 옥상에 강력한 통신 설비를 세울 수 있슴다!
통신 설비로 비취핵 골짜기 유적에서 방대한 정보를 전송하면
더 많은 걸 알 수 있게 될지도 모름다!
탐색의 발자취에
레포팅웨이의 새로운 기사도 게재됐슴다!"
1396,"마른땅 기지에 거대한 통신 설비를 세운 다음
유적의 에테르 정보를 동기화해서 본부 기구를 재기동시킬 검다!
잠들어 있던 기구 에우헤드론이 드디어 원래대로 기동되면……
이 별을 둘러싼 수수께끼도 여러모로 해명될 검다!
으으~ 진짜 설렘다!!
자재 조달을 위한 우주 임무에 협력 부탁드림다!"
1397,"'에우헤드론 재기동 작전'의 시작 시간이 결정됐슴다!
작업이 시작되면 협력 부탁드림다~!"
1398,"통신 설비인 기립석 탑이 완성되었슴다!
쌍둥이 탑을 끝으로 이 기지도 드디어 최종 완성되었슴다!
이제 비취핵 골짜기 유적에서 방대한 에테르 정보를 동기화시키면
마침내 에우헤드론을 복구할 수 있을 검다~!
여기까지 협력해 주셔서 정말 고맙슴다~!!
탐색의 발자취에 레포팅웨이의 기사도 게재되었슴다!"
1399,"여러분이 협력해 주신 덕분에
행성 오이지스 탐색에서 엄청난 성과를 거둘 수 있었슴다!
우리는 계속해서 선구자들이 간 곳이 어딘지 찾아보겠슴다!
지금까지 협력해 주셔서 고맙슴다~!!"
1400,"중력 뒤틀림의 이상 수치가 반으로 줄어들었다.
이대로 계속해 다오!"
1401,"이건……!? 참가자 전원에게 고한다!
임무 지역에 엄청나게 큰 그라비데 덩어리가 나타났다!"
1402,"거대 그라비데 덩어리의 힘이 약해졌다……!
뒤틀림이 착실하게 바로잡히고 있다!"
1403,"좋아, 중력 뒤틀림이 더 약해졌다!
조금만 더 힘내 다오!"
1404,"해냈다!
거대 그라비데 덩어리가 소멸했다!!"
1405,각자 공중에 떠오른 레비테트스톤을 수집해 다오!
1406,"바로 그거다!
이대로 중력 뒤틀림을 계속 없애자!"
1407,"음……!? 갑자기 중력 뒤틀림의 이상 수치가 튀어 올랐다.
모두 조심해라!"
1408,"물거품 폭풍은 곧 끝날 것으로 보인다.
각자 담당하는 임무를 마지막으로 철수하라!"
1409,"모두의 협력으로 희귀 자원 확보에 성공했다!
긴급 상황 해제, 그대들의 협력에 감사한다."
1410,"물거품 폭풍은 곧 끝날 것으로 보인다.
목표 미달이지만 긴급 상황 해제……. 그대들의 협력에 감사한다."
