#,Text
1411,"이 거대 그라비데 덩어리가 이번 이상 현상의 원인으로 보인다.
조종사, 지원군 모두 온 힘을 다해 이것을 없애 다오!"
1412,"수집한 레비테트스톤을 분석하여
상공에 떠다니는 거대 레비테트스톤을 발견했다!"
1413,"또 다른 거대 레비테트스톤이
상공에 존재하는 모양이다!"
1414,"파워 로더는 표식이 있는 지점에서
강화 인양 광선을 사용해 다오!"
1415,"방패의 벽 주변에서 돌발적으로 강력한 난중력이 발생했다!
그로 인해 기자재가 공중에 뜨는 등, 탐색 활동에 영향을 주고 있다."
1416,"휴대형 중력 발생기로 기자재를 고정하고는 있지만,
필요한 비품이 부족하므로, 긴급 조달을 의뢰한다."
1417,이어서 난중력과 관련된 다른 보고다.
1418,"강력한 난중력이 기지 내에도 영향을 미쳐,
물자함이 높이 떠올라 회수하지 못하는 사고가 발생했다."
1419,"이로 인해 탐사차 정비용 자재를 분실했다.
물자 운송에 미칠 영향이 우려되므로, 대용품 조달이 급선무다!"
1420,"모두의 협력으로 추가 정비용 자재를 충분히 확보했다.
예비 물자는 계속해서 현장에서 접수하겠다."
1421,"방패의 벽의 기자재 고정 작업용 물자는 충분히 모였다.
이쪽은 무사히 수습될 것 같군. 모두의 협력에 감사한다!"
1422,"게라스 만 일대에서 바닷물이 떠올라 물거품 폭풍이 발생했다.
그 영향으로 탐색 구역 내 습도가 급격히 높아지고 있다."
1423,"선구자의 오아시스에서 호습성 식물이 대량 발생했다고 한다.
유익한 특성을 가진 해당 식물을 이 기회에 자재로 회수하라!"
1424,이어서 물거품 폭풍과 관련된 다른 보고다.
1425,"극속 해변에 금속질 산호가 든 물거품이 떠다닌다고 한다.
먼바다의 자원이 바닷물과 함께 날아온 것으로 보인다."
1426,"이 기회에 주변 해역의 환경과 식생 분포를 연구하고자 한다!
떠다니는 물거품과 바닷물에서 금속산호의 시료를 확보해 다오."
1427,"극속 해변의 식생 분포 연구용 시료는 충분히 확보했다.
예비 시료는 계속해서 현장에서 접수하겠다."
1428,"선구자의 오아시스의 호습성 식물은 충분히 확보했다.
자재로 유용하게 활용될 것이다. 모두의 협력에 감사한다!"
1429,"중력 이상으로 기압이 변동되어 맹렬한 돌풍이 닥쳤다!
그로 인해 보급 물자를 운송하던 탐사차가 전복하는 사고가 발생했다."
1430,"현재 돌풍은 약해졌고, 2차 피해가 발생할 가능성은 낮다.
즉시 현지 복구 작업 및 분실된 우주 즉석면 보충을 부탁한다!"
1431,이어서 폭풍과 관련된 다른 보고다.
1432,"연구 대상인 유적 조각을 운송하는 무인기 부대가 돌풍으로 추락했다.
불운하게도 거석 도시 동쪽 연못에 빠졌다고 한다."
1433,"현장에는 유적 조각을 인양할 인원과 세척 용품이 부족하다.
인양에 협력하고 필요 비품을 조달하는 것이 급선무다!"
1434,"거석 도시 동쪽 연못의 유적 조각 인양은 순조롭다고 한다.
모두의 협력 덕분에 상황은 무사히 해결될 듯하다."
1435,"탐사차 수리용 물자와 우주 즉석면은 충분히 확보했다.
예비 물자는 계속해서 현지에서 접수하겠다. 빠른 대처에 감사한다!"
1436,"중력 이상으로 기압이 변동되어 생긴 맹렬한 돌풍으로 인해
잊힌 당근 남부에서 대규모 낙석이 발생했다!"
1437,"돌풍은 가라앉았으니, 낙석 제거 작업에 협력해 다오.
채굴에 소양이 있는 자는 희귀 광물 회수를 부탁한다."
1438,이어서 폭풍과 관련된 다른 보고다.
1439,"조금 전 불었던 맹렬한 돌풍으로 인해 부상자가 다수 발생했다.
이 때문에 응급 처치용 물자가 부족하다고 한다."
1440,"부상자 보고가 계속 증가하고 있으니,
즉시 응급 처치용 물자를 조달해 다오!"
1441,"부족했던 응급 처치용 물자가 충분히 모였다고 한다.
부상자 보고도 줄어들고 있다. 그대들의 협력에 감사한다."
1442,"낙석 제거 작업에 필요한 물자는 충분히 확보된 것 같다.
희귀 광물 회수도 순조롭다는군. 협력에 감사한다!"
1443,"協力可能な技術を持つ者は、至急現場に向かってくれたまえ！
続けて、乱重力に関する別件の報告だ。"
1444,"이상이 현재 발생 중인 상황이다.
협력 가능한 기술을 가진 자는 즉시 현장으로 가다오!"
1445,"協力可能な技術を持つ者は、至急現場に向かってくれたまえ！
続けて、水泡嵐に関する別件の報告だ。"
1446,"協力可能な技術を持つ者は、至急現場に向かってくれたまえ！
続けて、暴風に関する別件の報告だ。"
1447,협력 가능한 기술을 가진 자는 즉시 현장으로 향하도록!
1448,
1449,
2000,
2001,봄맞이 풀베기
2002,점수: UNKNOWN점 / 최고 기록: UNKNOWN점
2003,현자의 알(금)(UNKNOWN점)
2004,현자의 알(은)(UNKNOWN점)
2005,현자의 알(동)(UNKNOWN점)
2006,처치한 마물(UNKNOWN점)
2007,"이상 발생한
초목강 마물을 처치하라!"
2008,"앗, 바로 저게 초강력 파리지옥이에요~!
행사장 여기저기에 자라나서 우릴 방해하고 있죠……!"
2009,"앞길을 가로막고 있던 덤불이 사라졌어!
마물을 전부 처치해서 영향력이 약해졌나……? 앞으로 나아가자!"
2010,"유난히 시선을 끄는 고귀한 변이종이 있네!
저 아이도 한번 베어봐 주겠어……!?"
2011,"음후후, 네가 그렇게 특별한 힘을 얻게 될 줄이야……!
만일 또 나타나면 놓치지 말고 꼭 베어 버려!"
2012,"알 사냥 정원낫을 사용해
모조리 베어 주세요!"
2013,풀베기 완료
2014,"여기가 말끔히 정리되면 행사장은 확보할 수 있겠어요……!
부탁이에요, 조금만 더 힘내 주세요~!"
2015,
2016,
2017,
2018,
2019,
2020,
2021,
2022,
2023,
2024,
2025,
2026,
2027,
2028,
2029,
2030,
2031,
2032,
2033,
2034,
2035,
2036,
2037,
2038,
2039,
2040,
2041,
2042,
2043,
2044,
2045,
2046,
2047,
2048,
2049,
