key,0,1,2,3,4,5,6
13,9,72609,72509,2,"ロフィー・ピル・ポティトゥス","로피 피르 포티투스","19세. 미코테족. 달마스카 구역 발나인 출신.
갈레말 제국 제IV군단 '술사대대' 소속 선발병.

로피는 탈영병이다. 적전 탈영은 중대한 군법 위반이며, 제국군에서는 어지간한 이유가 아닌 한 '사형'에 처해진다. 그녀의 경우, 실험 동물인 '모노케로스'를 탈취해 도주했다. '모노케로스'는 술사대대의 귀중한 실험 동물이며, 그것을 은닉하기만 해도 문제가 되는데 적전 탈영까지 했으니 잡히는 즉시 사형당해도 이상하지 않다…… 아니, 그렇게 될 것이 뻔한 중죄다. 로피는 이를 잘 알면서도 대대를 이탈했다…… 어째서인가?
제국군은 '마술'을 실전에 배치하는 데에 소극적이었다. 에오르제아와 같은 타지에서 술식을 유입하더라도, 갈레안족은 원래 마술에 익숙하지 않으므로 제국 시민과 식민지 주민에 맞게 술식을 조정해야만 한다. 때문에 기초 연구부터 개량까지 우선 동물과 마수, 요마를 대상으로 실험을 거듭했다.
로피는 재능 있는 신입 소환술사였다. 마술을 사용하기에 충분한 에테르를 지녔으며 누구보다도 정확하게 술식을 구사하는 기술은 다른 동기들보다 몇 단계나 위였다. 마술 학교를 월반해서 졸업한 로피는 제IV군단에 입대, 엄격한 훈련을 거친 후 알비레오 휘하의 '술사대대'에 배속되었다. 그녀의 임무는 새로운 마술을 조정하고 개량하는 것이었다. 그러나 로피는 보즈야에서 잔혹한 현실을 마주한다. 많은 야생 동물과 마수, 요마가 마술 실험체로서 학대받고 있음을 알게 된 것이다.
로피는 '모노케로스'라는 마수 한 마리를 그녀가 연구하는 마술의 실험 대상으로 쓰라고 지시받았다. '모노케로스'는 언데드를 없애는 '정화의 빛'을 사용하는 진귀한 마수이다. 개체수가 적어 귀한 마수임에도, 오히려 귀하기 때문에 붙잡혀 실험대상이 되었다. 모노케로스는 혹독한 실험을 몇 번이나 견뎌냈지만, 결국 실험으로 살처분하라는 지시가 내려왔다. 로피는 자신이 창조한 마술이 얼마나 무거운 죄를 지녔는지 제대로 인식하게 되었다. 깊은 후회와 실망 속에서 로피는 결심했다. 이 마수를 도망시키자, 그리고 나도 제국을 버리자…… 라고.
"
14,11,72614,72514,5,"ダボグ・アン・イニヴァシュ","다보그 안 이비니쉬","34세 추정. 로스가르족. 보즈야 구역 출신.
갈레말 제국 제IV군단 '기계화 보병대대' 소속 특수병.

고화력 육지전 마도 병기 '비질' 및 신형 비행 마도 아머 '가브리엘'의 조종사. 두 마도 병기를 조종하기 위하여 '최적화'된 강화병이다.
달마스카 발나인에는 제국에서 개발된 수많은 마도 병기가 보관되어 있다. 이 마도 병기들은 마도기사장 시시니우스의 지휘 아래, 개조를 거쳐 고성능 병기가 되어 실전에 배치되었다. 그중에서 '비질'과 '가브리엘'은 물리적 조종뿐 아니라 정신을 통한 조종으로 더욱 빠르고 섬세하게 기동하는 것이 가능하다. 단, 조종은 강화병만이 할 수 있다. 정신 감응력을 높여 기계와 정신을 동기화할 수 있도록 강화된 특수한 조종사가 필요하기 때문이다.
시시니우스의 말에 따르면, 이는 아직 시험 단계이며, 이론적으로는 완성되었으나 살아있는 인간에게 사용하는 이상 어떠한 위험과 예상 외의 문제가 발생할지 모른다고 한다. 때문에 곧 다가올 달마스카 저항군과의 전면 충돌에 대비하여 보즈야에서 미리 시험해 본다는 것이 그의 계획이었고, 이 성능 실험의 피험자로 선택된 사람이 다보그였다.

다보그는 자원해서 입대한 것이 아니다. 오히려 제IV군단과 싸우는 저항군의 일원이었다.
15년 전, 보즈야 사건 때 부모와 형제를 잃은 다보그는 곧바로 저항군에 들어갔다. 가족의 원수를 갚기 위하여 싸웠지만, 2년 전 작전에 실패하여 제국군에 붙잡혔다. 포로가 된 다보그는 2번째 탈주를 시도하던 중 성벽에서 떨어지는 바람에 목뼈가 부러지고 말았다. 누가 봐도 회복은 불가능해 보였고, 길어야 일주일이라는 사망 선고가 내려졌다.
제IV군단은 원래 시험을 목적으로 한 인체 실험을 금지한다. 어디까지나 실용성과 안정성이 입증된 경우에만 허가한다는 것이 규칙이다. 그런데 죽어가는 다보그를 살린다는 명목으로 시험적인 인체 실험이 비밀리에 진행되었다. 제IV군단에서 가브란스가 정한 '포로에게 최저한의 인도적 배려를 한다'는 규칙을 시시니우스가 악용한 것이다.
이렇게 강화병으로 개조된 다보그는 신형 마도 병기의 조종사로서 전쟁터로 돌아왔다. 시시니우스는 '최저한의 인도적 배려'를 거듭했다. 다보그가 옛 동포를 죽이고 괴로워하지 않기를 바란다는 이유로, 그의 기억을 지운 것이었다…….
"
15,12,72615,72515,4,"ユンブ・ピル・ポティトゥス","윤부 피르 포티투스","24세. 미코테족. 달마스카 구역 라베나 출신.
갈레말 제국 제IV군단 '술사대대' 소속 선발병.

치유술사인 윤부는 그 능력을 살려 휘하의 병사들과 함께 전쟁터에서 싸우는 젊은이다.
갈레말 제국 내부에서는 바리스 황제가 암살당하고 후계자가 없어 내란이 시작되었다는 사실을 이미 일반 병사들도 많이들 알고 있다. 본국의 지휘 계통이 붕괴되고, 강건했던 대제국이 무너져 간다…… 설마 그런 일이 벌어지리라고는 아무도 생각하지 못했다. 그러나 윤부는 달랐다. 누구보다도 가브란스 군단장의 사상에 경도되었던 그녀는 지금이 절호의 기회라고 판단했다. 제국 지배에서 벗어나 새로운 '낙원'을 만들려면 바로 지금이다. 구 란디스 공화국을 재건하는 것도 아니며, 달마스카와 보즈야를 부활시키는 것도 아니다. 새로운 국가를 수립하는 것이다.
제국이 붕괴되는 바람에 미래가 보이지 않게 된 병사도 많다. 식민지 주민이라면 더욱 불안할 것이다. 윤부는 본국에 가족을 두고 온 사람들에게 제국을 빠져나와 이곳에 모이도록 권유했다. 불안한 마음에 저항군 쪽으로 기우는 사람들에게는, 자기들이 반드시 저항군을 물리치겠다며 결심을 말했다.
윤부가 이렇게 생각하게 된 것은 자신의 출신 때문이다. '포티투스'는 제국이 지배하는 식민지에 사는 '시민권을 얻은 미코테'들이 많이 쓰는 이름이다. 그녀는 부모를 잃은 고아였다. 거리의 아이로 자란 윤부는 자신의 처지를 한탄하는 다른 아이들과는 달리, 언젠가 시민권을 얻으리라는 꿈이 있었다. 그러려면 학문을 익혀야 한다고 생각했기 때문에, 학교에 몰래 숨어들어 수업을 훔쳐보는 것이 그녀의 일과가 되었다. 어느 날, 복지국의 보호를 받게 된 윤부는 다른 아이와 달리 읽고 쓸 수 있었기에 예비군을 양성하는 중등 교육 기관으로 보내진다. 여기서 가브란스의 사상에 대해 알게 된 윤부는 그의 추종자가 된다. 가브란스를 경외하고, 가브란스를 위하여 싸우는 것만이 이 나라의 국민을 풍요롭게 한다고 맹신하게 된 것이다.
치유술사가 된 윤부는 오늘도 전쟁터에서 동료를 구하기 위해 애쓰고 있다.
"
16,19,72619,72519,3,"ミーシィヤ・ヴォートヤシュ","미시야 보트야쉬","29세. 루가딘족. 보즈야 구역 출신.
보즈야 저항군에 잠입한 제IV군단 공작원.

보즈야의 빈민가에서 나고 자랐다. 제국의 정책에 따라, 복지국의 허가를 받아 학교에 다니며 학문에 정진했다. 성적이 우수하여 특대생으로서 장학금을 받고 제국 수도의 최고학부로 진학, 민속학과 선사학을 배웠다. 그래서 보즈야의 역사와 민족에 조예가 깊다.

투신 세이브 더 퀸을 부활시키기 위해, 저항군에 '군힐드의 검'을 복각시키게끔 조언한 사람이 미시야이다. 그녀가 저항군을 적으로 돌리고 제IV군단을 따르는 이유는 두 가지. 하나는 보즈야에 남아 있는 뿌리 깊은 빈곤 문제에 기인한다.

제국이 지배하기 전인 소국 보즈야 시대에는 약 70%에 달하는 국민의 소득이 전체 평균 소득의 1/2에 미치지 못하였으며, 그중에서도 빈민가에 사는 자들의 소득은 평균의 1/3밖에 되지 않았다. 지배 계급인 귀족과 대상인들이 부를 독과점하는 것이 원인이었다. 제국의 식민지가 되고 나서 이러한 상태는 점차 완화되었으나, 보즈야 같은 대도시에서는 여전히 집이 없는 노숙자나 부모를 잃고 거리에 나앉은 아이들을 볼 수 있었다.
미시야도 그러한 빈곤층에서 태어나 빈민가에서 자란 보즈야인이다. 어릴 적에는 끼니를 거르는 날도 많았고, 쓰레기 더미에서 조금이라도 쓸 만한 물건을 주워다 파는 것이 일과였다. 이렇게 극도로 빈곤한 아이들에게 의식주와 교육 기회가 주어지지 않는 것을 문제로 생각한 제국은 복지국을 설치하여 아동 구제에 힘썼으나, 실제로 도움을 받을 수 있었던 아이들은 전체의 절반도 되지 않았다.
미시야의 경우 다행히도 학교에 다니게 되었고, 우수한 성적을 거두어 특대생으로서 제국 수도에 있는 대학에 진학할 수 있었다. 그러나 보즈야에서는 '부유한 자'가 빈곤층을 마치 사회악처럼 대하는 일이 일상다반사였다. 면전에서 욕을 하는 경우도 허다했고 물리적인 괴롭힘을 당한 적도 있다. 어느새 그녀는 '부유한 자'를 증오하게 되었다.
또한 미시야는 마지막 여왕 군힐드와 같은 핏줄로, 먼 후손이다. 그래서 여왕의 비참한 최후를 알고 있었다.
자신이 '가지지 못한 자'인 것. 여왕이 암살당한 것. 이 두 가지 이유로 그녀는 보즈야 사회에 깊은 불신을 품게 되었고, '자신은 이 사회의 일원이 아니다'라는 의식이 강해졌다.

또 다른 이유로 제IV군단의 사상이 있다. 가브란스 부자는 병사란 능력과 충성심만 있으면 된다고 공언해왔다. 출신, 문화, 종교, 성별을 불문하고, 능력이 있고 제IV군단에 충성을 맹세한다면 누구든지 평등하게 대우한다…… 이것이 가브란스 부자의 방침이다. 미시야는 이 방침에 매력을 느꼈다.

마음에 상처를 입은 미시야를, 이제 누구도 막을 수 없을 것이다…….
"
17,17,72617,72517,5,"ライアン・レム・ヘルソス","라이언 렘 헬소스","68세. 휴런족. 구 란디스 공화국 안베르크 출신.
갈레말 제국 제IV군단 천인대장.

가브란스 부자를 2대째 섬기는 용맹한 장수. 죽은 바슈 반 가브란스와 마찬가지로 란디스 공화국 출신의 전사이다. 반세기 전의 보즈야 침공 때, 10대였음에도 백인대장으로서 임무을 맡았다고 한다. 현 군단장인 노아 반 가브란스를 어릴 적부터 알고 있어서인지 아직도 그를 '노아 도련님'이라고 부른다.

메네니우스 휘하의 보즈야 구역 분견대 소속. '마수대대'를 지휘하고 있다. '마수왕'이라는 이름대로, 마수조련사로서 손수 키운 마수와 함께 저항군과 대치한다.
68세라는 고령이지만 아직도 일기당천의 전투 능력을 자랑하며, 오랜 전쟁터 생활로 길러진 용병술을 구사하는 장수이다. 다만 자신이 세운 작전을 무시하고 단독으로 출격하는 일도 종종 있다. 이기는 것보다 강한 상대와 싸우는 걸 좋아하기에 결투를 신청하는 일도 잦은 듯하다. 군사 전략을 소용없게 만드는 행동 때문에 상관인 메네니우스에게 질책을 당하기도 한다. 전투와 전쟁을 무척 즐기는 열렬한 무투파로, 메네니우스가 선호하는 모략이나 계략 같은 것을 몹시 싫어한다. ""용사라면 주먹으로 말해라.""가 그의 말버릇이다.
"
18,18,72618,72518,3,"メネニウス・サス・ラナトゥス","메네니우스 사스 라나투스","45세. 엘레젠족. 갈레말 제국 갈레말드 출신.
갈레말 제국 제IV군단 분견대장.

정보 무관으로서 밀정을 통솔하여 여러 정보를 수집하고, 군사 전략 등을 군단장인 가브란스에게 조언하는 위치에 있다. 또한 달마스카와 보즈야 등 남쪽 식민지에서 성유물 탐사대를 지휘하고 있으며, 고대 알라그 제국과 이발리스 왕국 등 현재의 지식으로는 재현할 수 없는 과학과 마도를 손에 넣으려 한다.
이번 보즈야 저항군의 대규모 반격으로 인하여 보즈야 구역 분견대장으로서 카스트룸 라쿠스리토레에 부임했다. 3개 대대를 이끌고 있는데, 구체적으로는 마수왕 라이언이 지휘하는 '마수대대', 요술사 알비레오가 지휘하는 '술사대대'와 자신이 직접 지휘하는 제국의 일반적인 마도 병기 부대 '기계화 보병대대'가 있다.

라나투스 가문은 갈레말 공화국 시대에는 유력 귀족으로 이름이 알려졌으나, 메네니우스의 조부인 타이러스가 당시 독재관이었던 솔 조스 갈부스의 황제 즉위에 반대하여 쫓기게 되었다. 타이러스는 유랑 끝에 병사하고, 그의 아들인 루시우스는 변경에서 싸우던 제IV군단에 거두어진다. 그 후, 두각을 나타낸 루시우스는 실력을 인정받아 바슈 반 가브란스의 부관 중 하나로 활약했다. 라나투스 가문을 일으키려는 루시우스는 바슈의 권유로 엘레젠족인 몰락 귀족의 딸과 혼인했다. 그녀에게는 이미 아들이 하나 있었는데, 루시우스는 그 아들을 자신의 양자로 들였다. 그 아들이 메네니우스이다.
현 군단장인 노아 반 가브란스와 메네니우스는 어린 시절부터 친구 사이로, 때문에 그는 가브란스 부자에 대한 충성심이 남보다 훨씬 강하다. 더러운 일도 도맡아 하며, 정보 무관으로서 활동하는 것은 그야말로 메네니우스가 바라던 일이었다. 그의 수법은 냉철하고 비정하여, 군단 내에서도 '목적을 위해서는 수단을 가리지 않는 남자'라는 평가를 받는다. 하지만 실제로 그는 가브란스 부자를 위해서 모든 일을 할 뿐이며, 가슴 속 깊은 곳에는 무척이나 뜨거운 마음을 품고 있다.

갈레말 제국에 내란이 일어난 후 가브란스는 숙원을 이루고자 제국에서 독립하는 길을 택한다. 그것은 제국에서 오는 군수품 보급이 끊긴다는 뜻으로, 저항군과의 싸움이 길어질수록 제IV군단은 불리해진다. 그러나 메네니우스는 가브란스를 위하여, 새로운 '낙원'을 만들기 위하여, 병력을 아끼면서 저항군을 혼란에 빠뜨릴 수 있는 작전을 고안해냈다. 그중 하나가 '성검 세이브 더 퀸' 전설을 이용한 작전이었다…….
"
19,16,72616,72516,3,"サドル・レム・アルビレオ","사드르 렘 알비레오","37세. 엘레젠족. 에오르제아 울다하 출신.
갈레말 제국 제IV군단 천인대장.

메네니우스 휘하의 보즈야 분견대 소속이자, '술사대대'를 지휘하는 마술사이다. 잃어버린 고대 마술에 심취한 나머지, 자신의 마도를 발전시키고 완성하기 위해 포로를 실험대에 올려 죽게 만드는 일도 허다하다. 적의 목숨에는 가치가 없다고 생각하는 냉철한 성격 때문에, 적뿐만 아니라 아군에게도 '요술사'라고 불린다.

울다하에서는 주술사 길드에 소속되어 있었으나, 당시 길드마스터 무무에포가 알비레오의 마음에 감춰진 냉혹함을 일찌감치 눈치채고 위험 분자로 판단, 길드에서 추방했다. 울다하에서 쫓겨난 알비레오는 더욱 강력한 파괴 마법과 소환 마법을 찾아 각지를 방랑했고, 제국이 지배하는 달마스카에 도착했을 때 마침 다양한 재능의 소유자를 모집하던 제IV군단에 술사 부대를 만들어달라는 조건으로 입대했다. 그가 제IV군단에 들어온 후 가브란스는 약속한 대로 술사 부대를 알비레오에게 맡겼고, 지난 15년 동안 다수의 마술사를 육성하여 이윽고 에오르제아 각국과 대등하게 싸울 수 있는 부대를 만드는 데에 성공했다.
이후 메네니우스가 지휘하는 성유물 탐색에 흥미를 느낀 알비레오는 보즈야 저항군과의 싸움에 지원했다. 그리하여 고대 이발리스의 성유물인 '성석' 중 하나가 이 보즈야로 오게 된 것이다…….
"
20,20,72620,72520,3,"グンヒルド","군힐드","고대 보즈야를 다스린 여왕.

씨족 간의 싸움이 끝없이 이어졌던 고대 보즈야 시대, 싸움에 종지부를 찍고자 씨족 공동으로 여왕을 옹립함으로써 통일 국가가 탄생했다. 여왕의 이름은 '군힐드'로, 이는 여왕을 잇는 자에게 주어지는 칭호이다.
여왕은 유력 씨족의 혈통에서 선출되는 것이 아니었다. 신에게 올리는 제사를 담당하는 무녀들 중에서 가장 유능한 자가 뽑히는 구조로, 종족을 따지지는 않았으나 실제로는 로스가르족에서 뽑히는 일이 많았다. 보즈야 인구 분포에서 다수를 차지하는 것이 로스가르족이기 때문이다.

제3성력 말기, 알라그 제국이 일으킨 제4재해가 고대 보즈야를 덮쳤다. 위정자인 유력 씨족의 씨족장과 신관들은 성검 세이브 더 퀸의 힘을 해방하여 난국을 헤쳐나가려 했다. 그러나 당시의 여왕 군힐드는 알라그 제국과의 전쟁에서 당한 부상으로 자리에 누워 있었고, 죽는 것을 두려워했다. 그래서 신관들과 군힐드의 검은 하급 무녀였던 보트야쉬 씨족의 젊은이를 여왕으로 추대했다. 성검의 힘을 해방하고 죽을 운명일 여왕이었다. '일회용 여왕'이라면 집안이 좋지 않은 평민 출신 무녀로 충분하다고 판단한 것이다. 그런 내막을 전혀 몰랐던 그녀는 성검의 힘을 해방시키고 투신이 되어 제4재해에서 백성을 지켜냈다.
하지만 신관들에게는 한 가지 오산이 생겼다. 투신이 되었던 여왕이 죽지 않고 인간 모습으로 돌아와 투신의 힘을 자유자재로 제어하게 된 것이다. 위정자들은 그 힘을 몹시 두려워했다. 두려웠던 그들은 군힐드의 검을 이용하여 여왕 암살을 꾀한다. 쓰고 버릴 장기말에 지나지 않는 보트야쉬 씨족의 여왕을 살려둘 수는 없다는 이유였다.
그녀는 불시에 습격을 받았고, 젊은 생명은 허망하게 지고 말았다. 그러나 그녀의 에테르 일부가 성검에 남아 있다는 것을 주모자들은 알아차리지 못했다…….
"
21,0,0,0,0,"","",""
22,0,0,0,0,"","",""
23,0,0,0,0,"","",""
