key,0,1,2,3,4,5,6
#,Number,Icon,Image,Rarity,NameJP,Name,Description
int32,byte,Image,Image,byte,str,str,str
0,0,0,0,0,"","",""
1,1,72601,72501,1,"バイシャーエン・ウルガッシュ","바이샤엔 울가쉬","54세. 로스가르족. 구 보즈야 왕국 수도 보즈야 출신.
보즈야 저항군의 지도자.

갈레말 제국으로부터 보즈야 구역을 해방시켜, 독립 국가를 수립하려 한다.

의학을 공부하던 중 제국군에 징용되어 군의관으로서 종군했다. 공훈을 인정받아 제국 명예 시민권을 얻고 결혼 후 아이도 가졌으나, 반란을 진압하기 위해 원정에 나간 사이에 보즈야 사건이 발생하여 아내와 아이를 잃었다.
사건이 일어난 후 제국을 버리고 동료와 함께 군에서 탈주하여, 지하에서 잠복 활동을 하다가 저항군에 참가하게 되었다.

제국군 시절에는 자신의 삶이 나쁘지 않다고 생각했지만, 사건 후에 정반대로 바뀌어 지금은 제국에 대해 누구보다 강한 원망과 증오를 갖고 있다.
그러나 지성인인 바이샤엔은 그런 부정적인 감정을 가능한 한 억누르려 노력한다. 감정만을 내세우면 부정적인 상황이 끝나지 않는다는 것을 역사에서 배웠기 때문이다.

군힐드의 검(레지스탕스 웨폰)을 복각하고 여왕 친위대를 재현한 바이샤엔은, 이윽고 보즈야에서 제IV군단을 쫓아내기 위해 반격에 불을 붙였다…….
"
2,2,72602,72502,1,"マルシャーク・アペッラ","마르샤크 아펠라","42세. 로스가르족. 보즈야 구역 출신.
보즈야 저항군의 일원.

바이샤엔의 오른팔로 활약하고 있다.
징용병으로서 제국군에 복무하던 중 보즈야 사건이 발생하여 부모와 형제를 모두 잃었다. 사건 후, 군을 떠나 저항군에 참가했다.
바이샤엔을 스승으로 섬기며, 저항군의 자금 및 물자 조달과 인재 육성 등의 일을 맡고 있다. 도마의 히엔이나 동부 알데나드 상회와 같은 외부 협력자의 섭외와 연락 담당으로서 특히 재능을 발휘한다. 성격이 온화하여 연락책으로서 신뢰받는 모양이다.

제국을 원망하긴 하지만, 식민지 백성으로서 태어나 자랐기 때문에 국가와 국민을 별개로 보려고 한다. 사람이 너무 좋아 탈이라고 할 수도 있으나, 그 부드러운 말씨는 남의 경계심을 늦추는 데에 도움이 되기도 한다.
전투 능력도 높이 평가되는데, 그도 그럴 것이 로스틱에게 직접 가르침을 받은 건브레이커이기 때문이다. 온후하며 듬직한 모두의 방패, 그것이 마르샤크이다."
3,3,72603,72503,1,"ゼヴェン・スヴァナシュ","제벤 스바나쉬","47세. 로스가르족.
보즈야 저항군의 일원이자, '신생 군힐드의 검' 중 한 명.

출신 불명. 보즈야 사람으로 추정되나, 제벤의 과거를 아는 이는 없으며 본인도 과거에 대해 말하고 싶어하지 않는다. 아주 약간 알아낸 정보에 따르면 마술에 통달하기 위하여 각지를 방랑했다고 한다. 남으로는 사베네어, 동으로는 동쪽 나라, 북으로는 갈레말 제국 수도 갈레말드까지 가 본 모양이다.
마술에 뜻을 두게 된 계기는 에오르제아에 왔을 때 겪은 일 때문이었다. 불치병에 걸린 어머니를 구하기 위해 아버지와 둘이서 그리다니아로 떠났는데, 안타깝게도 치료법을 찾지 못하고 여행 중에 어머니가 죽고 말았다. 어머니의 병은 갈레말 제국이 보즈야를 침공한 것이 원인으로, 모친을 잃은 슬픔은 어린 마음에 제국을 향한 증오와 복수심을 싹틔우기 충분한 것이었다.
여행길에서 다양한 마술을 본 제벤은 그 지식을 보즈야에 가지고 돌아가려고 했다. 독학으로 마술을 배워 보즈야 해방에 이바지할 셈이었다.
제벤은 각지에서 배운 마술에 독자적인 체계를 세워 하나의 학문을 이루었지만, 이를 다른 사람에게 가르치려 하지 않았다. 이유인즉, 그의 마술은 파괴를 위한 마술이므로 이용자의 목적에 따라서는 그저 '재앙'이 될 수도 있기 때문이었다.
어느덧 제벤은 둘도 없는 마술사로서 병사들의 경외의 대상이 되어 군신이라고 칭송받는 존재가 되었다.
제벤은 전쟁터에서 죽는 것을 두려워하지 않았다. 오히려 죽음을 바랐다. 이는 과거 달마스카 대미궁에 갔을 때 만난 수상한 이국의 마도사가 한 예언 때문이다. 이국의 말을 알아들을 수는 없었지만, 뜻은 이해할 수 있었다. 언젠가 보즈야 해방의 봉화가 오를 때, 제벤에게 죽음이 찾아올 것이라고. 바로 이곳, 남부 보즈야 전선이 그 사지가 아닐까? 그렇다면 자신은 죽음을 두려워하지 않고 그저 한 자루의 검, 신생 군힐드의 검으로서 싸우다 죽으면 된다. 제벤은 죽음이 두렵지 않다.
그런 제벤에게 예언이 이루어지려 하고 있다…….
"
4,4,72604,72504,2,"イソルデ・コヴィー","이솔데 코비","26세. 휴런족. 달마스카 구역 레아몽드 출신.
보즈야 저항군의 일원이자, '신생 군힐드의 검' 중 한 명.

어엿한 보즈야인. 양친은 달마스카로 도망친 보즈야 난민이며, 달마스카가 식민지가 된 후에 제국이 실시한 보즈야 난민 귀국 정책을 거부하고 레아몽드로 이주했다. 이솔데는 제국 식민지에서 태어나 제국식 교육을 받았지만, 그녀의 관심은 온통 보즈야의 전통 춤과 노래에 쏠려 있었다. 보즈야 음악의 큰 특징은 빠른 박자와 격렬하게 오르내리는 선율이다. 가사 또한 서민의 생활과 자연을 소재로 한 것들이며, 대부분이 연애에 대한 노래이다. 현악기와 타악기로 이루어진 연주에 맞춰 무용수가 노래를 하며 격렬한 스텝을 밟는다. 이솔데는 어린 시절부터 그런 춤꾼을 꿈꿨고, 어느새 차세대 무용수로서 기대를 한몸에 받게 되었다. 보즈야 무도의 또 다른 커다란 특징은 무기인 활을 악기로 사용하는 것이다. 활시위를 다른 활로 켜서 음색을 만들거나 손가락으로 튕겨서 타악기처럼 리듬을 연주한다. 이는 사냥을 하며 보즈야 각지를 떠돌던 선조에 대한 존경의 표시이며, 무용수는 모두 활을 쏠 줄도 안다.
보즈야로 돌아와 저항군에 참가한 이솔데는 순식간에 궁술사로서 활약하게 되었다.

그러나 그녀의 마음에는 서민의 생활과 자연에 대한 깊은 이해와 애정이 진하게 남아 있다. 그것은 보즈야인 뿐만 아니라 제국인에게도 마찬가지이다. ""하루빨리 평화로워지기를. 보즈야도 제국도."" 이것이 그녀의 말버릇이다.
"
5,5,72605,72505,1,"スタニック・アルボフ","스타니크 알루보프","36세. 로스가르족. 보즈야 구역 출신.
보즈야 저항군의 일원이자, '신생 군힐드의 검' 중 한 명.

스타니크는 어렸을 때부터 '영웅'을 동경했다.
식민지 주민인 대다수의 보즈야인은 몹시 궁핍했고, 스타니크의 부모님이 경영하는 잡화점도 하루하루 식비를 버는 게 고작이었다. 학교에 다닐 돈조차 없었지만, 빈곤에 허덕이는 보즈야인에게는 흔한 일이었다. 스타니크는 푼돈이라도 벌기 위해 아이 돌보기부터 구두닦이까지 안 해본 일이 없었으나, 소매치기나 도둑질 같은 범죄에 손을 대지는 않았다. 아무리 가난하더라도 사람이 해서는 안 되는 일이 있다고 부모님이 가르쳤기 때문이다.
15세가 된 스타니크는 제국군의 징병 검사를 받고 병사가 되었다. 영웅이 되고 싶어서가 아니다. 자기 한 입 줄여서 부모님의 부담을 조금이라도 덜어주고 싶었기 때문이다.
쥐꼬리만 한 급료에서 적은 금액이나마 떼어 부모님에게 보내기도 했다. 매번 보낼 수는 없었지만, 스타니크에게는 그것이 '자기 나름의 영웅적 행위'로 느껴졌다. 부모님이 보낸 편지가 그의 유일한 안식이었고 살아 있다는 증거였다.

보즈야 사건이 일어났을 때, 스타니크는 멀리 떨어진 지역에서 임무를 수행하고 있었다. 사건이 일어난 지 5일 후에 부모님의 편지가 도착했지만, 그 편지의 날짜는 사건이 일어나기 바로 전날이었다…….
"
6,6,72606,72506,3,"ブラズ・アゼティナ","블라즈 아제티나","25세. 로스가르족. 도마 출신.
보즈야 저항군의 일원이자, '신생 군힐드의 검' 중 한 명.

권술, 검술, 유술, 창술 등 온갖 무술을 가르치는 '취일문'의 직계 사무라이.
취일문에서는 지금까지 문하생이 저항군에 참가하는 것을 인정하지 않았다. 무술에 정진함은 자신의 혼을 단련하기 위함이지, 결코 싸움의 도구가 되어서는 안 된다고 가르치기 때문이다. 보즈야에서 반란이 일어났을 때도 제국에 대한 불만과 증오를 참지 못해 반란에 참가한 문하생이 있었으나, 취일문은 그런 문하생들을 파문하고 제국과 직접 부딪치는 일을 피했다.
블라즈의 아버지는 취일문 종가의 막내였으나 그 역시 금기를 깨고 반란에 참가했다. 반란은 실패로 끝났고, 보즈야를 떠나 도마로 도망친 그는 도마에서 아내를 만나 블라즈를 낳았다. 블라즈는 사무라이 검술의 명문에 제자로 들어갔고, 부친에게 물려받은 재능으로 어린 나이에 스승의 기술을 모두 전수받는 실력자가 되었다. 히엔이 돌아온 후, 블라즈는 도마에 은혜를 갚고자 도마 해방 전쟁에 참가하여 활약했고 도마 탈환 후에는 자신의 역할이 끝났다고 여겨 출가했지만, 동방 연합과 보즈야가 봉기했다는 소문을 듣고 고향으로 돌아가기로 결심한다.
때마침 취일문의 문주가 바뀌고, 전과는 반대로 보즈야를 다시 일으키기 위하여 힘을 다한다는 방침이 세워졌다. 취일문에 돌아오는 것을 허락받은 블라즈는 문주에게 사무라이 검술의 사범이 되어줄 것을 부탁받지만, 이를 거절하고 저항군에 들어간다. 이미 세상을 떠난 아버지의 유지를 이어받아 보즈야 독립과 재건을 위해 노력하겠다고 굳게 다짐한 것이었다…….
"
7,7,72607,72507,3,"ヴェリボル・アゼティナ","벨리보르 아제티나","24세. 로스가르족. 보즈야 구역 제티나 출신.
보즈야 저항군의 일원이자, '신생 군힐드의 검' 중 한 명.

권술, 검술, 유술, 창술 등 온갖 무술을 가르치는 '취일문'의 직계 기사. 블라즈와는 육촌이다.

'취일문'은 2백년 이상의 역사를 자랑하는 무예의 명문이다. 갈레말 제국이 침공했을 때, 소국 보즈야를 지키기 위하여 많은 문하생이 싸움에 나섰다 목숨을 잃었다고 한다. 당시 제IV군단 군단장 바슈 반 가브란스는 그들의 재능을 아깝게 여겨 제국에 충성을 맹세한다면 취일문을 지켜주겠다고 약속했고, 문주는 스스로 목을 내놓음으로써 문파가 몰살되어 '혈통'이 끊기는 것을 피했다.
문주 대리를 맡은 벨리보르의 할머니는 가브란스와 한 약속을 고집스럽게 지켰다. 보즈야가 점령된 후에도 이따금 반란이 발생하여 일부 제자들이 참가했으나, 그때마다 그들을 파문시키고 문파에 피해가 가지 않도록 온 힘을 다했다. 할머니가 세상을 떠날 때, 새로 문주가 된 벨리보르의 아버지에게 이런 유언을 남겼다고 한다. ""나는 가브란스와 한 약속을 평생 지켰다. 그것이 내 남편의 부탁이었고, 나와 너를 지키기 위한 깊은 사랑이었다. 하지만 너는 솔직하게 살아라. 세상은 변한다…….""

일문에 복귀한 육촌 블라즈와는 죽이 잘 맞았다. 처음 만난 날을 지금도 기억한다. 같은 뜻을 지닌 동문 사이를 넘어 하나의 혼은 나눠 가지고 이 세상에 태어난 진정한 형제라고 벨리보르는 느꼈다. 짧은 기간이었지만 서로 절차탁마했으며, 새로운 기술을 만들어내기도 했다. 보즈야가 봉기하며 취일문은 정식으로 저항군에 참가한다. 자신의 사명을 다하기 위하여 오늘도 벨리보르는 대검을 휘두른다…….
"
8,8,72608,72508,1,"アギー・グローヴァー","애지 글러버","17세. 휴런족. 보즈야 구역 마르트르브예 출신.
보즈야 저항군의 일원이자, '신생 군힐드의 검' 중 한 명.

권술, 검술, 유술, 창술 등 온갖 무술을 가르치는 '취일문'의 권술사.

보즈야의 오래된 항구 도시인 마르트르브예의 인구는 20만명. 일을 찾아 지방에서 온 노동자가 많은 번잡한 도시로, 노숙자와 고아도 많다. 전쟁과 질병, 갖은 사건으로 당국에 체포된 보즈야인을 부모로 둔 아이들……. 부모를 잃은 고아는 대부분 하수가 흐르는 지하 시설에 모여 살고 있었다. 애지도 그런 '하수구 아이' 중 하나였다.
애지는 부모님을 모르고, 자신의 진짜 이름도 모른다. '애지'라는 이름은 추운 겨울날 동사 직전인 애지를 구해준 제국 복지국 직원이 지어줬다.
보호를 받게 된 5살 이전의 기록은 없다. 부모와 함께 살던 시절도 기억하지 못한다. 애초에 애지는 말조차 하지 못했다고 한다.
하수구 아이 시절 기억하는 유일한 것은 제피르의 맛. 마시멜로와 비슷한 달콤한 과자로, 애지가 가장 좋아하는 음식이다.

복지국은 애지를 무예의 명문 '취일문'에 맡겼다. 애지는 눈 깜짝할 사이에 읽기와 쓰기를 익혔고, 사형제들 상대로 실력을 쌓으며 무럭무럭 성장했다. 보호 당시에는 죽은 사람처럼 눈동자가 어둡고 생기가 거의 느껴지지 않았던 애지가, 지금은 밝고 붙임성 있는 성격으로 취일문의 분위기 메이커가 되었다.
특히 블라즈와 벨리보즈, 두 사람과 마음이 맞은 애지는 그 둘에게 지지 않으려 권술에 매진했다. 재능이 있었는지, 아니면 노력이 결실을 맺은 것인지, 16살에 스승의 기술을 모두 전수받았다.
애지는 저항군에 참가한 후에도 툭하면 가라앉고 까칠해지기 쉬운 분위기를 밝게 바꾸었다. 그녀는 모두의 우상이 되었고, 그런 애지가 '신생 군힐드의 검'으로 선택된 것에 블라즈와 벨리보르는 기뻐했다. 바이샤엔의 정치적 배려임을 애지는 눈치챘지만, 겉으로 티내지는 않았다. 지금도 그녀는 부상병에게 힘을 북돋워주고자 밝게 행동한다.
"
9,10,72610,72510,3,"エルネイス・ピル・ロングス","에르네이스 피르 롱구스","24세. 휴런족. 란디스 몽팔코네 출신.
갈레말 제국 제IV군단 '마수대대' 소속 전령장.

마수왕 라이언을 동경하여 '마수대대'에 지원한 젊은이. 직접 작전을 세우고 상황에 따라 다채롭게 변경하는 라이언의 지휘는 무엇 하나 기발하지 않은 것이 없으며, 사관학교에서는 절대로 배울 수 없는 것이다. 때문에 중앙의 장수들은 라이언을 변방의 시골뜨기 정도로 업신여기고 있다. 실제로 장수답지 않은 거친 말투와 차림새, 인간보다도 마수에게 사랑을 쏟는 모습은 '야만족 장수'로 보일 만하다.
에르네이스도 입대 직후에는 그렇게 생각했다. 하지만 4년 전, 달마스카 구역에서 일어난 반란을 진압하면서 그 생각은 정반대로 바뀌었다. 라이언은 입이 험할지언정, 부하들 이름을 하나하나 다 기억하고 각각의 약점을 적확하게 지적했다. 전쟁터에서는 누구보다도 먼저 적과 대치하며 몸을 사리지 않고 위험에 뛰어들었다. ""죽는 녀석은 그냥 약한 거다""라고 라이언은 입버릇처럼 말했고, 그 말대로 전쟁터에서 죽는 자는 실력 없는 겁쟁이뿐이었다. 라이언이 인간보다 마수에게 애정을 보이는 이유는, 병사들이 죽지 않도록 마수를 방패로 쓰는 병법을 구사하기 때문이다. 마수들이 죽는 확률이 훨씬 높기 때문에 죽음에 가장 가까이 있는 마수를 사랑하는 연인처럼 아끼는 것이다. 그것을 깨달았을 때, 에르네이스는 라이언을 스승으로 모시고 '마수대대' 소속이 되었다.

아래는 몽팔코네 지역 신문인 '큐리어스'에 게재된 에르네이스의 기사에서 발췌한 내용이다.
(기자) 제IV군단 동료들에게 '충견'이라고 불리신다던데, 야유라고 생각하진 않으시나요?
(에르네이스) ……그 녀석들은 날 부러워하는 거야.
(기자) 왜 그렇게 생각하시죠?
(에르네이스) 녀석들은 대개 겉과 속이 다르지. 얌전히 상관의 명령을 따르는 척하면서 내심 반발하고 있어.
(기자) 군인이라면 상관에게 절대복종해야 하지만, 그들도 인간이니까요.
(에르네이스) 하지만 나는 달라. 마음속 깊이 라이언 님을 숭배하니까. 영혼 밑바닥부터 그를 따라갈 준비가 되어 있어. 마음대로 지껄이라고 해…… 나에게는 훈장이나 마찬가지야. 그렇게 불리는 것이 무엇보다 행복하고…… 자랑스럽게 생각해!

(기자) 라이언 님, 롱구스 전령장은 이렇게 말씀하셨는데, 당신은 어떻게 생각하시죠?
(라이언) 이야, 까맣게 잊고 있었는데 방금 이야기를 듣고 생각났어. 그 강아지 같은 꼬맹이 말이지. 그렇게 기운이 넘치는 녀석은 좋아하지만…… 대개 빨리 죽더라고, 그런 녀석들이.
(기자) ………….
"
10,13,72611,72511,2,"クラリシー・クォ・プリスクス","클라리시 쿠오 프리스쿠스","33세. 엘레젠족.
갈레말 제국 제IV군단 '마수대대' 소속 백인대장.

거만한 말투 등으로 미루어 보아 가식적인 면이 강하고 성격도 특이한 클라리시이지만, 그것은 그녀의 외적인 측면, 즉 페르소나이다.
클라리시가 제IV군단의 일원이 된 지 약 10년. 그녀는 마수왕 라이언이 인정하는 마수조련사 중 한 명이다. 사람들은 마수를 뜻대로 조종하는 그녀를 '마녀'라고도 불렀다. 소문에 따르면 그녀는 이 세상에 존재하지 않는 듯한 신비한 발음으로 인간의 언어가 아닌 말을 하며, 그 말로 마수를 부린다고 한다. 반면 이렇게 말하는 사람도 있다. 그렇지 않다. 그것은 그녀를 싫어하는 사람들이 흘린 악의 가득한 소문이다. 그녀는 '마녀'가 아닌 '성녀'이다. 다친 병사와 마수를 위하여 몸 바쳐 싸우는 그 모습은 전설의 군신이자 여신인 그라디아 그 자체라고 한다. 실제로 그녀가 전쟁터에서 세운 무공은 셀 수 없을 정도이다.
두 소문 다 사실일지도 모른다. 동료를 위하여 그 누구보다 앞장서서 싸우는 모습은 그야말로 '성녀', 한편 마수를 조종하며 무자비하게 적을 사냥하는 모습은 '마녀'가 틀림없다. 어느 쪽이든 그녀의 눈동자를 본 자는 요염한 눈빛에 매료되거나 두려움에 떨거나 둘 중 하나이다…….

그녀의 과거를 아는 자는 극히 적다.
클라리시는 국경을 넘어 여행하는 유랑민인 에슈와족 출신이다. 제국 지배하에서 정착을 권장하는 정책이 시행되었으나, 에슈와족은 그것을 거부했다. 군단장인 가브란스는 절충안으로서 일정 기간 동안 병역을 이행할 사람을 넘기면 지금까지처럼 살아도 된다고 제안했다. 에슈와족은 그 조건을 받아들여 젊은 남성 여러 명을 내주었다. 클라리시의 남편도 그중 하나였다. 그녀의 남편은 마수왕 라이언 휘하의 마수대대 일원으로 참가했지만 첫 출전에서 덧없이 목숨을 잃고 말았다. 결혼한 지 몇 달 지나지 않았을 때의 일이었다. 가브란스 대신 조문을 온 라이언은 남편을 죽게 해서 미안하다고 사죄했다. 남편을 잃은 클라리시는 남편 대신 자신이 병역을 수행할 테니 더는 일족 남자들을 빼앗아가지 말아달라고 탄원했고, 라이언은 이를 승낙했다. 이후로 그녀는 '마녀'와 '성녀' 가면을 번갈아 쓰며, 죽은 남편의 넋을 달래고 일족의 평화를 지키기 위하여 싸우고 있다…….
"
11,14,72612,72512,5,"サルトヴォアール・クォ・ソラノス","사르토부아르 쿠오 소라누스","61세. 엘레젠족. 구 란디스 공화국 만토바 출신.
갈레말 제국 제IV군단 '술사대대' 소속 상급 백인대장.

보즈야를 침공한 제IV군단은 초대 솔 황제의 명에 따라, 다음 목표인 구 달마스카 왕국을 침공할 준비를 하고 있었다. 당시의 군단장 바슈 반 가브란스에게는 달마스카의 마술사 부대가 위협적이었다. 독으로써 독을 제압한다…… 까지는 아니지만, 가브란스는 제IV군단에 그와 유사한 마술사 부대를 편성하여 대항하려고 계획했다. 그는 제일 먼저 주목한 것은, 구 란디스 공화국에서 유일하게 마술을 무기로 한 마술기사단을 보유한 도시 만토바였다. 제국은 자신들의 지배를 받아들인 국가의 기사단을 해체하여 제국군으로 재편하는 수법을 사용하곤 했는데, 이는 구 란디스 공화국도 마찬가지였다. 하지만 마술을 위협으로 인식했던 제국은 마술기사단을 탄압하였고, 소속 마술사들은 죽음을 피해 각지로 도망쳤다. 가브란스는 그렇게 도망친 만토바의 마술사들을 찾아다녔다.

사르토부아르도 그중 한 명이었다. 그는 만토바 인근 작은 농촌에서 정체를 숨기고 작은 학교를 운영하다가 제IV군단에게 들키고 말았다. 사르토부아르는 제안을 받고 거절했지만, 제국과 유사하면서도 다른 가브란스의 사상에 흥미를 가지게 된다. 제IV군단은 오랜 시간 동안 끈질기고 정중하게 사르토부아르를 설득했다. 어느 날, 학교에 낯선 무인이 찾아왔다. 칼도 차지 않고 호위도 없는 초로의 무인…… 사르토부아르는 자신의 마술로는 그를 쓰러뜨릴 수 없다는 것을 금세 깨달았다. 그 무인이 바로 바슈 반 가브란스였다. 가브란스 본인과 직접 대화를 나눌 기회를 얻은 사르토부아르는 그의 가치관과 사상에 깊이 감명받아 충성을 맹세했다.

그 후로 삼십여 년이 지나 요술사 알비레오가 가담하면서 제IV군단의 마술은 더욱 높은 경지에 이르렀으나, 그 기반은 어디까지나 만토바의 마술사들이다. 사르토부아르는 이를 긍지로 여기며 융통성을 발휘하여 알비레오에게 마술을 배웠다. 그렇게 그는 현 군단장인 노아 반 가브란스와 함께 죽은 바슈의 유지를 실현하려 한다…….
"
12,15,72613,72513,3,"シシニアス・マル・ヴェリュータス","시시니우스 말 벨루투스","42세. 갈레안족. 갈레말 제국 갈레말드 출신.
갈레말 제국 제IV군단 '기계화 보병대대' 소속 기술사관.

갈레말 제국 초월기술 연구소에서 마도기사장 아울루스 말 아시나를 사사하고 연구원으로 활동했다. 알라미고 함락과 함께 초월기술 연구소가 해체되고 연구 데이터가 갈레말드로 보내질 때 시시니우스에게도 갈레말드로 귀환하라는 명령이 내려졌지만, 그는 원래 고대 알라그 제국의 유물과 잃어버린 기술이 연구 대상이었기 때문에 제IV군단으로 전속시켜줄 것을 요청했다. 제IV군단이 전부터 '성유물'이라고 불리는 고대 보물을 수집했다는 소문을 들은 데다가, 귀환 명령과 동시에 제IV군단에서 스카우트를 받았기 때문이다. 군단장 가브란스와 성유물 탐색 책임자인 메네니우스는 시시니우스의 재능을 인정했고, 시시니우스 또한 가브란스의 사상에 감명받아 충성을 맹세했다. 이리하여 시시니우스는 제IV군단의 마도기사장으로 취임했다.

현재는 달마스카 남쪽의 발나드 해에 있는 리도르아나 대등대에서 회수한 고대 병기와 기구의 부활을 목적으로 연구를 계속하고 있다. '노동' 시리즈는 이미 작동 원리 조사를 마쳤고, 새로운 마도병기로서 실전에 투입할 수 있는 선까지 연구가 진행되었다. 시시니우스는 이 신병기를 실전에 투입하기 전에 데이터를 수집하고자 남부 보즈야 전선에 부임한 것이다. 그저 연구실에 처박혀 있는 학자가 아니라 자신의 눈과 귀와 손으로 데이터를 모으는 성향은 스승에게 배운 것일까…….
"
