key,0,1,2
#,,,
int32,bit&01,str,str
0,False,"無効","無効"
100,True,"모험","발길 닿는 대로 여행하라"
101,True,"","처음 가는 곳에 행운이 있으리라"
102,True,"","탐험수첩을 펴고, 추억의 장소를 돌아보라"
103,True,"","날씨마저 도울 것이다"
104,True,"","사람이 특히 많은 도시에 가보라"
105,True,"","멀리 있는 찻집에서 만남이 있으리라"
106,True,"","덩치 큰 사람과 교류하라"
200,True,"인연","영웅으로서 신뢰와 명성을 얻을지니 크게 보답하라"
201,True,"","영원한 인연에 눈을 돌리면 행운이 있으리라"
202,True,"","동료에게 도움을 많이 받으니 고마움을 잊지 말라"
203,True,"","별이 이끄는 상대가 가까이에 있다"
204,True,"","동료와 걸음을 맞추면 행운이 따르리라"
205,True,"","친구가 늘 곁에 있을지니 미지의 땅도 두려워 말고 나아가라"
206,True,"","다양한 부족과 인연을 맺으면 황금빛 결실을 맺으리라"
300,True,"금전","욕심을 버리면 큰 수가 나와 전리품을 얻으리라"
301,True,"","일확천금의 기회가 있으니 오락장으로 가라"
302,True,"","행운이 따를지니 보물지도를 펼쳐라"
303,True,"","바라는 대로 될지니 주저 말고 보물 상자를 열라"
304,True,"","정직하게 장사하면 이익이 따르리라"
305,True,"","오랜 우정이 큰 보상을 가져다 주리라"
306,True,"","생각지도 못한 희귀품을 얻게 되니 집사를 치하하라"
400,True,"투쟁","강적과 싸울 만큼 성장하리니 마음 놓고 도전하라"
401,True,"","기술을 반복하면 진리를 깨달으리라"
402,True,"","전우를 살피면 성장의 열쇠를 얻는다"
403,True,"","새로운 직업으로 기술을 익히면 도약할 징조가 있다"
404,True,"","기술을 반복하면 진리를 깨달으리라"
405,False,"",""
406,False,"",""
500,True,"운세","전쟁신 같은 투쟁심이 있다면 항상 승리하리라"
501,True,"","달의 신 같은 자애심이 있다면 많은 사람들에게 사랑받으리라"
502,True,"","태양신 같은 열정이 있다면 목표로 가는 지름길이 보이리라"
503,True,"","해신 같은 결의가 있다면 순풍에 돛 단 듯 비약할 수 있으리라"
504,True,"","여행신 같은 호기심이 있다면 여행지에서 많은 기쁨을 얻으리라"
1100,True,"모험","혼자 하는 여행도 좋으니 각지를 돌며 평온한 시간을 보내라"
1101,True,"","강해진 상태로 탐구 여행에 다시 도전하면 새로운 발견이 있으리라"
1102,True,"","계절의 변화를 느끼며 축제에 참가하라"
1103,True,"","사람들의 목소리에 귀를 기울이면 새로운 이야기가 들리리라"
1104,True,"","미지의 땅을 방문하면 생각지 못한 발견을 하게 되리라"
1105,True,"","카드를 잘 꾸미면 새로운 만남이 있으리라"
1106,True,"","강한 빛이 내리쬐는 땅에서 좋은 모험을 하게 되리라"
1200,True,"인연","생각지 못한 만남이 있으리니 마음의 준비를 하라"
1201,True,"","일생에 한 번뿐인 인연에서 싹이 트리라"
1202,True,"","좋은 인연이 닿으리니 나서서 동료를 모으라"
1203,True,"","친구에게 도움을 받으리니 그 은혜를 갚을지어다"
1204,True,"","처음에는 결실을 맺기 어려우나 좋은 인연을 소개받으리라"
1205,True,"","별의 노래가 애정을 자라게 하니 기나긴 환상을 따라가라"
1206,True,"","때를 같이하여 협력하면 머나먼 별도 개척할 수 있으리라"
1300,True,"금전","오락장에서 큰 이익을 얻으리니 도량을 넓게 가질지어다"
1301,True,"","풍어의 기운이 있으니 배에 오르라"
1302,True,"","집 지을 운이 있으니 투자하라"
1303,True,"","옛것을 버리고 새것을 취하라"
1304,True,"","장사 기회를 제대로 잡는다면 견실한 부를 이루리라"
1305,True,"","초승달과 별들에 이끌려 여행하면 재산을 모으게 되리라"
1306,True,"","단골을 찾아가면 견실한 이득이 있으리라"
1400,True,"투쟁","거리낄 것 없으니 동료와 대련에 매진하라"
1401,True,"","지금 다루는 무기가 잘 맞으니 마음 편히 정진하라"
1402,True,"","패가 잘 돌아 덕망 높은 작패꾼이 될 수 있다"
1403,True,"","악명 높은 마물을 쫓아 각국을 돌면 행운이 따르리라"
1404,True,"","지금 다루는 무기가 잘 맞으니 마음 편히 정진하라"
1405,False,"",""
1406,False,"",""
1500,True,"운세","별의 신 같은 총명함이 있다면 모든 운명이 좋게 흐르리라"
1501,True,"","파괴신 같은 호방함이 있다면 강적도 쓰러뜨릴 수 있으리라"
1502,True,"","제작신 같은 발상력이 있다면 장인으로서 성장하리라"
1503,True,"","상업신 같은 명민함이 있다면 좋은 기회를 잡을 수 있다"
1504,True,"","대지신 같은 포용력이 있다면 새로운 인연이 싹트리라"
2100,True,"모험","자신의 신념을 관철하면 길이 열리리라"
2101,True,"","사건의 조짐이 있으니 사건해결사를 의지하라"
2102,True,"","지역 풍물이나 역사에 눈을 돌리면 새로운 발견을 하리라"
2103,True,"","단체로 자세를 잡고 여행의 추억을 남겨라"
2104,True,"","운명에 몸을 맡기면 성장하리라"
2105,True,"","외딴 섬에서 평온하게 지내라"
2106,True,"","'12'와 관련된 곳으로 가라"
2200,True,"인연","감사를 잊지 않으면 좋은 인연이 닿으리라"
2201,True,"","지금 곁에 있는 동료가 최고의 보물이니 더더욱 소중하게 여겨라"
2202,True,"","이국에서 동지를 만나리니 두려워 말고 교류하라"
2203,True,"","손짓 발짓으로 소통하면 마음이 통하리라"
2204,True,"","인연을 기다리지만 말고 모험가가 주최하는 모임에 참가하라"
2205,True,"","아낌없이 나누면 인덕의 도움을 받으리라"
2206,True,"","전우를 얻어 투기장의 정상을 향해라"
2300,True,"금전","티끌 모아 태산이니 일과를 게을리하지 말라"
2301,True,"","집을 옮기면 행운이 따를지니 기회를 놓치지 말라"
2302,True,"","산과 들에서 채집하면 이익이 있으리라"
2303,True,"","동료의 중개로 장사 기회를 잡으리라"
2304,True,"","하늘과 바다에 재물이 있으니 비공정이나 잠수함을 파견하라"
2305,True,"","훈련장에서 성과가 있으니 상배를 모아라"
2306,True,"","자원을 얻고자 한다면 기한을 잘 확인하라"
2400,True,"투쟁","음식과 약품을 꼼꼼하게 준비하면 이길 수 있다"
2401,True,"","힘겹게 이길 수 있으니 장비를 새로 갖춰라"
2402,True,"","이길 수 있으나 자만하면 질 것이다"
2403,True,"","역량은 충분하니 동료와 손발을 맞춰라"
2404,True,"","역량은 충분하니 동료와 손발을 맞춰라"
2405,False,"",""
2406,False,"",""
2500,True,"운세","시간신 같은 신념이 있다면 다른 이에게 현혹되지 않으리라"
2501,True,"","지식신 같은 지혜가 있다면 나쁜 일도 헤쳐 나갈 수 있으리라"
2502,True,"","전쟁신 같은 의지가 있다면 계속 싸워나갈 수 있으리라"
2503,True,"","달의 신 같은 시야가 있다면 대세를 읽을 수 있으리라"
2504,True,"","태양신 같은 호기가 있다면 동료를 이끌 수 있으리라"
3100,True,"모험","움직이기 전에 목적지를 정하라"
3101,True,"","이종족을 만나면 솔선해서 부탁을 들어주도록 하라"
3102,True,"","방해물이 없으니 가는 길에 행운이 따르리라"
3103,True,"","혼자 하는 여행에 어려움이 있으니 친구와 함께 걸을지어다"
3104,True,"","맨 처음 방문했던 도시로 가면 운이 트이리라"
3105,True,"","용사들이 모이는 땅에서 실력을 보여라"
3106,True,"","무기를 만들어 힘을 추구하라"
3200,True,"인연","연락을 게을리하지 말고 부지런히 소식을 전하면 평안하리라"
3201,True,"","옛 친구와 연이 닿으리니 회포를 풀도록 하라"
3202,True,"","때늦은 만남이 있으니 진득하게 기다려라"
3203,True,"","다른 이를 도우면 인연을 만나리라"
3204,True,"","지금의 인연을 귀하게 여기고 더욱 견고히 하라"
3205,True,"","고독도 마음먹기에 따라 즐거우리라"
3206,True,"","안경을 쓰면 타인의 진심을 읽을 수 있으리라"
3300,True,"금전","가지고 있을수록 손해가 나니 팔아라"
3301,True,"","살림살이를 잘 정리하라"
3302,True,"","손해를 두려워하지 않으면 소소한 이익을 얻으리라"
3303,True,"","지출은 크겠지만 원하는 물건을 손에 넣으리라"
3304,True,"","친구의 도움으로 얻는 것이 있으리라"
3305,True,"","작은 토지에 행운이 있으리라"
3306,True,"","축제에 보물이 있으니 샅샅이 살펴라"
3400,True,"투쟁","지겠지만 바닥에 누운 횟수만큼 강해진다"
3401,True,"","방심할 수 있으니 끝까지 긴장하고 도전하라"
3402,True,"","수행에 잡념이 많으니 매사에 온 힘을 다하라"
3403,True,"","동료와 함께 단련하라"
3404,True,"","동료와 함께 단련하라"
3405,False,"",""
3406,False,"",""
3500,True,"운세","해신 같은 격정이 있다면 운명의 파도에 저항할 수 있으리라"
3501,True,"","여행신 같은 느긋함이 있다면 작은 실패에 연연하지 않으리라"
3502,True,"","별의 신 같은 달관이 있다면 운명에 농락당하지 않으리라"
3503,True,"","파괴신 같은 엄격함이 있다면 곤란한 상황도 타파할 수 있으리라"
3504,True,"","제작신 같은 기교가 있다면 장비가 부서져도 걱정이 없으리라"
4100,True,"모험","계획을 충분히 세워라"
4101,True,"","무리하면 좋지 않으니 몸을 잘 돌보며 여행하라"
4102,True,"","메기를 닮은 자가 길을 가로막을지니 조심하라"
4103,True,"","방해물이 없으니 평소처럼 임하라"
4104,True,"","재앙이 있으리니 자신이 주변 사람들을 도와라"
4105,True,"","토끼가 많은 땅으로 가라"
4106,True,"","저편을 추억하며 기분을 전환하라"
4200,True,"인연","옛 지인 중에 좋은 인연이 있으나 뒤를 조심하라"
4201,True,"","마음이 기우나 망설여진다"
4202,True,"","소문에 휘둘리지 말고 동료를 믿어라"
4203,True,"","싸움의 싹이 보이니 배려를 잊지 말아라"
4204,True,"","오해를 살지도 모르나 성의를 다하라"
4205,True,"","열두 길을 둘러보며 망설이니 믿음을 가져라"
4206,True,"","가까운 곳에서 만남이 적으니 물리적인 경계를 넘어가라"
4300,True,"금전","침착하게 행동해야 시세를 잘못 보지 않는다"
4301,True,"","복권 운이 없으니 느긋하게 기다려라"
4302,True,"","재고가 쌓이지만 헛되지는 않다"
4303,True,"","이익은 적으나 집사 장비를 새로 갖추면 행운이 있으리라"
4304,True,"","흉어의 기운이 있으니 낚시는 때를 가려라"
4305,True,"","창고가 넘치니 결단을 내려라"
4306,True,"","멋쟁이가 되나 재산을 낭비하게 되리라"
4400,True,"투쟁","동행자에 따라 다르니 관대한 마음으로 도전하라"
4401,True,"","두려움은 실패로 이어지니 단단히 각오하고 싸움에 임하라"
4402,True,"","빨리 이기려다가 시간이 더 걸릴 수 있다"
4403,True,"","승리하지만 원하던 보상을 얻기는 어려우니 반복해서 도전하라"
4404,True,"","승리하지만 원하던 보상을 얻기는 어려우니 반복해서 도전하라"
4405,False,"",""
4406,False,"",""
4500,True,"운세","파괴신의 번개 같은 갑작스러운 불행에 평소 대비하라"
4501,True,"","전쟁신의 방패 같은 고난의 벽에도 과감하게 부딪쳐라"
4502,True,"","달의 신의 수호견 같은 사나운 적에게는 대책을 세운 후 도전하라"
4503,True,"","해신의 파도 같은 고난에는 때를 기다렸다가 대처하라"
4504,True,"","지식신의 두루마리 같은 난제에는 새로운 지식으로 답을 찾아라"
5100,True,"모험","날씨도 돕지 않으니 진득하게 기다려라"
5101,True,"","방심하면 축제를 놓치니 잊지 말고 참가하라"
5102,True,"","순서가 올 때까지 조금 더 기다릴지어다"
5103,True,"","감옥에 갈지도 모르니 평소 행동거지를 되돌아보라"
5104,True,"","방심하면 파멸하리니 유성에 대비하라"
5105,True,"","어두운 땅에서 운을 높여라"
5106,True,"","그리운 시작을 떠올려라"
5200,True,"인연","소식이 있을지니 상대를 배려하고 말을 가려라"
5201,True,"","이루어지지 않으니 과분한 상대를 넘보지 말라"
5202,True,"","깊이 엮이면 진흙탕에 빠진다"
5203,True,"","말하고 나서 후회하면 늦으니 주의하라"
5204,True,"","붕괴의 조짐이 보이니 성의에 보답하라"
5205,True,"","이별이 가까우니 이야기를 나누면 막을 수 있으리라"
5206,True,"","허영으로 신뢰가 흔들리니 자중하라"
5300,True,"금전","탐낼수록 작은 숫자가 나오니 마음을 비우고 도전하라"
5301,True,"","마법 문양과는 인연이 없으니 동료의 지도에 의지하라"
5302,True,"","즐기는 것이 최고이니 오락장에서는 욕심을 버려라"
5303,True,"","상급 마테리아일수록 잘 깨지니 목욕재계하고 도전하라"
5304,True,"","석판 모으기를 잊을 수 있으니 일찌감치 마쳐라"
5305,True,"","살림살이가 철거될 수 있으니 집에 돌아가라"
5306,True,"","시장에서 거액을 치르게 되니 자신의 힘으로 손에 넣어라"
5400,True,"투쟁","벼락치기는 실패하기 마련이니 갈고닦아온 기술로 도전하라"
5401,True,"","잡념이 많으니 집중해서 온 힘을 다하라"
5402,True,"","고전이 계속되니 노력의 방향을 바꿔라"
5403,True,"","이기지 못해 괴로울 때일수록 동료들과 서로 격려하라"
5404,True,"","벼락치기는 실패하기 마련이니 갈고닦아온 기술로 도전하라"
5405,False,"",""
5406,False,"",""
5500,True,"운세","별의 신 같은 어긋난 사랑을 놓지 못하면 파멸에 이르리라"
5501,True,"","상업신 같은 양면성을 놓지 못하면 오해를 사고 신용을 잃으리라"
5502,True,"","대지신 같은 분노를 놓지 못하면 싸움이 길어지리라"
5503,True,"","시간신 같은 혼돈을 놓지 못하면 사태는 더욱 악화되리라"
5504,True,"","태양신 같은 호기로움을 놓지 못하면 주위를 불태우게 되리라"
