#,Unknown0,Unknown1,Unknown2
0,無効,無効,False
100,모험,발길 닿는 대로 여행하라,True
101,,처음 가는 곳에 행운이 있으리라,True
102,,"탐험수첩을 펴고, 추억의 장소를 돌아보라",True
103,,날씨마저 도울 것이다,True
104,,사람이 특히 많은 도시에 가보라,True
105,,멀리 있는 찻집에서 만남이 있으리라,True
106,,덩치 큰 사람과 교류하라,True
200,인연,영웅으로서 신뢰와 명성을 얻을지니 크게 보답하라,True
201,,영원한 인연에 눈을 돌리면 행운이 있으리라,True
202,,동료에게 도움을 많이 받으니 고마움을 잊지 말라,True
203,,별이 이끄는 상대가 가까이에 있다,True
204,,동료와 걸음을 맞추면 행운이 따르리라,True
205,,친구가 늘 곁에 있을지니 미지의 땅도 두려워 말고 나아가라,True
206,,다양한 부족과 인연을 맺으면 황금빛 결실을 맺으리라,True
300,금전,욕심을 버리면 큰 수가 나와 전리품을 얻으리라,True
301,,일확천금의 기회가 있으니 오락장으로 가라,True
302,,행운이 따를지니 보물지도를 펼쳐라,True
303,,바라는 대로 될지니 주저 말고 보물 상자를 열라,True
304,,정직하게 장사하면 이익이 따르리라,True
305,,,False
306,,,False
400,투쟁,강적과 싸울 만큼 성장하리니 마음 놓고 도전하라,True
401,,기술을 반복하면 진리를 깨달으리라,True
402,,전우를 살피면 성장의 열쇠를 얻는다,True
403,,새로운 직업으로 기술을 익히면 도약할 징조가 있다,True
404,,기술을 반복하면 진리를 깨달으리라,True
405,,,False
406,,,False
500,운세,전쟁신 같은 투쟁심이 있다면 항상 승리하리라,True
501,,달의 신 같은 자애심이 있다면 많은 사람들에게 사랑받으리라,True
502,,태양신 같은 열정이 있다면 목표로 가는 지름길이 보이리라,True
503,,해신 같은 결의가 있다면 순풍에 돛 단 듯 비약할 수 있으리라,True
504,,여행신 같은 호기심이 있다면 여행지에서 많은 기쁨을 얻으리라,True
1100,모험,혼자 하는 여행도 좋으니 각지를 돌며 평온한 시간을 보내라,True
1101,,강해진 상태로 탐구 여행에 다시 도전하면 새로운 발견이 있으리라,True
1102,,계절의 변화를 느끼며 축제에 참가하라,True
1103,,사람들의 목소리에 귀를 기울이면 새로운 이야기가 들리리라,True
1104,,미지의 땅을 방문하면 생각지 못한 발견을 하게 되리라,True
1105,,카드를 잘 꾸미면 새로운 만남이 있으리라,True
1106,,강한 빛이 내리쬐는 땅에서 좋은 모험을 하게 되리라,True
1200,인연,생각지 못한 만남이 있으리니 마음의 준비를 하라,True
1201,,일생에 한 번뿐인 인연에서 싹이 트리라,True
1202,,좋은 인연이 닿으리니 나서서 동료를 모으라,True
1203,,친구에게 도움을 받으리니 그 은혜를 갚을지어다,True
1204,,처음에는 결실을 맺기 어려우나 좋은 인연을 소개받으리라,True
1205,,별의 노래가 애정을 자라게 하니 기나긴 환상을 따라가라,True
1206,,때를 같이하여 협력하면 머나먼 별도 개척할 수 있으리라,True
1300,금전,오락장에서 큰 이익을 얻으리니 도량을 넓게 가질지어다,True
1301,,풍어의 기운이 있으니 배에 오르라,True
1302,,집 지을 운이 있으니 투자하라,True
1303,,옛것을 버리고 새것을 취하라,True
1304,,장사 기회를 제대로 잡는다면 견실한 부를 이루리라,True
1305,,,False
1306,,,False
1400,투쟁,거리낄 것 없으니 동료와 대련에 매진하라,True
1401,,지금 다루는 무기가 잘 맞으니 마음 편히 정진하라,True
1402,,패가 잘 돌아 덕망 높은 작패꾼이 될 수 있다,True
1403,,악명 높은 마물을 쫓아 각국을 돌면 행운이 따르리라,True
1404,,지금 다루는 무기가 잘 맞으니 마음 편히 정진하라,True
1405,,,False
1406,,,False
1500,운세,별의 신 같은 총명함이 있다면 모든 운명이 좋게 흐르리라,True
1501,,파괴신 같은 호방함이 있다면 강적도 쓰러뜨릴 수 있으리라,True
1502,,제작신 같은 발상력이 있다면 장인으로서 성장하리라,True
1503,,상업신 같은 명민함이 있다면 좋은 기회를 잡을 수 있다,True
1504,,대지신 같은 포용력이 있다면 새로운 인연이 싹트리라,True
2100,모험,자신의 신념을 관철하면 길이 열리리라,True
2101,,사건의 조짐이 있으니 사건해결사를 의지하라,True
2102,,지역 풍물이나 역사에 눈을 돌리면 새로운 발견을 하리라,True
2103,,단체로 자세를 잡고 여행의 추억을 남겨라,True
2104,,운명에 몸을 맡기면 성장하리라,True
2105,,외딴 섬에서 평온하게 지내라,True
2106,,'12'와 관련된 곳으로 가라,True
2200,인연,감사를 잊지 않으면 좋은 인연이 닿으리라,True
2201,,지금 곁에 있는 동료가 최고의 보물이니 더더욱 소중하게 여겨라,True
2202,,이국에서 동지를 만나리니 두려워 말고 교류하라,True
2203,,손짓 발짓으로 소통하면 마음이 통하리라,True
2204,,인연을 기다리지만 말고 모험가가 주최하는 모임에 참가하라,True
2205,,아낌없이 나누면 인덕의 도움을 받으리라,True
2206,,전우를 얻어 투기장의 정상을 향해라,True
2300,금전,티끌 모아 태산이니 일과를 게을리하지 말라,True
2301,,집을 옮기면 행운이 따를지니 기회를 놓치지 말라,True
2302,,산과 들에서 채집하면 이익이 있으리라,True
2303,,동료의 중개로 장사 기회를 잡으리라,True
2304,,하늘과 바다에 재물이 있으니 비공정이나 잠수함을 파견하라,True
2305,,,False
2306,,,False
2400,투쟁,음식과 약품을 꼼꼼하게 준비하면 이길 수 있다,True
2401,,힘겹게 이길 수 있으니 장비를 새로 갖춰라,True
2402,,이길 수 있으나 자만하면 질 것이다,True
2403,,역량은 충분하니 동료와 손발을 맞춰라,True
2404,,역량은 충분하니 동료와 손발을 맞춰라,True
2405,,,False
2406,,,False
2500,운세,시간신 같은 신념이 있다면 다른 이에게 현혹되지 않으리라,True
2501,,지식신 같은 지혜가 있다면 나쁜 일도 헤쳐 나갈 수 있으리라,True
2502,,전쟁신 같은 의지가 있다면 계속 싸워나갈 수 있으리라,True
2503,,달의 신 같은 시야가 있다면 대세를 읽을 수 있으리라,True
2504,,태양신 같은 호기가 있다면 동료를 이끌 수 있으리라,True
3100,모험,움직이기 전에 목적지를 정하라,True
3101,,이종족을 만나면 솔선해서 부탁을 들어주도록 하라,True
3102,,방해물이 없으니 가는 길에 행운이 따르리라,True
3103,,혼자 하는 여행에 어려움이 있으니 친구와 함께 걸을지어다,True
3104,,맨 처음 방문했던 도시로 가면 운이 트이리라,True
3105,,용사들이 모이는 땅에서 실력을 보여라,True
3106,,무기를 만들어 힘을 추구하라,True
3200,인연,연락을 게을리하지 말고 부지런히 소식을 전하면 평안하리라,True
3201,,옛 친구와 연이 닿으리니 회포를 풀도록 하라,True
3202,,때늦은 만남이 있으니 진득하게 기다려라,True
3203,,다른 이를 도우면 인연을 만나리라,True
3204,,지금의 인연을 귀하게 여기고 더욱 견고히 하라,True
3205,,고독도 마음먹기에 따라 즐거우리라,True
3206,,안경을 쓰면 타인의 진심을 읽을 수 있으리라,True
3300,금전,가지고 있을수록 손해가 나니 팔아라,True
3301,,살림살이를 잘 정리하라,True
3302,,손해를 두려워하지 않으면 소소한 이익을 얻으리라,True
3303,,지출은 크겠지만 원하는 물건을 손에 넣으리라,True
3304,,친구의 도움으로 얻는 것이 있으리라,True
3305,,,False
3306,,,False
3400,투쟁,지겠지만 바닥에 누운 횟수만큼 강해진다,True
3401,,방심할 수 있으니 끝까지 긴장하고 도전하라,True
3402,,수행에 잡념이 많으니 매사에 온 힘을 다하라,True
3403,,동료와 함께 단련하라,True
3404,,동료와 함께 단련하라,True
3405,,,False
3406,,,False
3500,운세,해신 같은 격정이 있다면 운명의 파도에 저항할 수 있으리라,True
3501,,여행신 같은 느긋함이 있다면 작은 실패에 연연하지 않으리라,True
3502,,별의 신 같은 달관이 있다면 운명에 농락당하지 않으리라,True
3503,,파괴신 같은 엄격함이 있다면 곤란한 상황도 타파할 수 있으리라,True
3504,,제작신 같은 기교가 있다면 장비가 부서져도 걱정이 없으리라,True
4100,모험,계획을 충분히 세워라,True
4101,,무리하면 좋지 않으니 몸을 잘 돌보며 여행하라,True
4102,,메기를 닮은 자가 길을 가로막을지니 조심하라,True
4103,,방해물이 없으니 평소처럼 임하라,True
4104,,재앙이 있으리니 자신이 주변 사람들을 도와라,True
4105,,토끼가 많은 땅으로 가라,True
4106,,저편을 추억하며 기분을 전환하라,True
4200,인연,옛 지인 중에 좋은 인연이 있으나 뒤를 조심하라,True
4201,,마음이 기우나 망설여진다,True
4202,,소문에 휘둘리지 말고 동료를 믿어라,True
4203,,싸움의 싹이 보이니 배려를 잊지 말아라,True
4204,,오해를 살지도 모르나 성의를 다하라,True
4205,,열두 길을 둘러보며 망설이니 믿음을 가져라,True
4206,,가까운 곳에서 만남이 적으니 물리적인 경계를 넘어가라,True
4300,금전,침착하게 행동해야 시세를 잘못 보지 않는다,True
4301,,복권 운이 없으니 느긋하게 기다려라,True
4302,,재고가 쌓이지만 헛되지는 않다,True
4303,,이익은 적으나 집사 장비를 새로 갖추면 행운이 있으리라,True
4304,,흉어의 기운이 있으니 낚시는 때를 가려라,True
4305,,,False
4306,,,False
4400,투쟁,동행자에 따라 다르니 관대한 마음으로 도전하라,True
4401,,두려움은 실패로 이어지니 단단히 각오하고 싸움에 임하라,True
4402,,빨리 이기려다가 시간이 더 걸릴 수 있다,True
4403,,승리하지만 원하던 보상을 얻기는 어려우니 반복해서 도전하라,True
4404,,승리하지만 원하던 보상을 얻기는 어려우니 반복해서 도전하라,True
4405,,,False
4406,,,False
4500,운세,파괴신의 번개 같은 갑작스러운 불행에 평소 대비하라,True
4501,,전쟁신의 방패 같은 고난의 벽에도 과감하게 부딪쳐라,True
4502,,달의 신의 수호견 같은 사나운 적에게는 대책을 세운 후 도전하라,True
4503,,해신의 파도 같은 고난에는 때를 기다렸다가 대처하라,True
4504,,지식신의 두루마리 같은 난제에는 새로운 지식으로 답을 찾아라,True
5100,모험,날씨도 돕지 않으니 진득하게 기다려라,True
5101,,방심하면 축제를 놓치니 잊지 말고 참가하라,True
5102,,순서가 올 때까지 조금 더 기다릴지어다,True
5103,,감옥에 갈지도 모르니 평소 행동거지를 되돌아보라,True
5104,,방심하면 파멸하리니 유성에 대비하라,True
5105,,어두운 땅에서 운을 높여라,True
5106,,그리운 시작을 떠올려라,True
5200,인연,소식이 있을지니 상대를 배려하고 말을 가려라,True
5201,,이루어지지 않으니 과분한 상대를 넘보지 말라,True
5202,,깊이 엮이면 진흙탕에 빠진다,True
5203,,말하고 나서 후회하면 늦으니 주의하라,True
5204,,붕괴의 조짐이 보이니 성의에 보답하라,True
5205,,이별이 가까우니 이야기를 나누면 막을 수 있으리라,True
5206,,허영으로 신뢰가 흔들리니 자중하라,True
5300,금전,탐낼수록 작은 숫자가 나오니 마음을 비우고 도전하라,True
5301,,마법 문양과는 인연이 없으니 동료의 지도에 의지하라,True
5302,,즐기는 것이 최고이니 오락장에서는 욕심을 버려라,True
5303,,상급 마테리아일수록 잘 깨지니 목욕재계하고 도전하라,True
5304,,석판 모으기를 잊을 수 있으니 일찌감치 마쳐라,True
5305,,,False
5306,,,False
5400,투쟁,벼락치기는 실패하기 마련이니 갈고닦아온 기술로 도전하라,True
5401,,잡념이 많으니 집중해서 온 힘을 다하라,True
5402,,고전이 계속되니 노력의 방향을 바꿔라,True
5403,,이기지 못해 괴로울 때일수록 동료들과 서로 격려하라,True
5404,,벼락치기는 실패하기 마련이니 갈고닦아온 기술로 도전하라,True
5405,,,False
5406,,,False
5500,운세,별의 신 같은 어긋난 사랑을 놓지 못하면 파멸에 이르리라,True
5501,,상업신 같은 양면성을 놓지 못하면 오해를 사고 신용을 잃으리라,True
5502,,대지신 같은 분노를 놓지 못하면 싸움이 길어지리라,True
5503,,시간신 같은 혼돈을 놓지 못하면 사태는 더욱 악화되리라,True
5504,,태양신 같은 호기로움을 놓지 못하면 주위를 불태우게 되리라,True
