key,0,1
357,"TEXT_VOICEMAN_05400_003420_FANDANIEL","알고 있다마다요…….
참고로 그 친구분 말입니다만, 선전포고 하러 갔다가
떡하니 만났지 뭡니까."
358,"TEXT_VOICEMAN_05400_003430_FANDANIEL","전하께서 기다리고 계시다고 말해 놨습니다.
살짝 태워버렸을지도 모르지만요……?"
359,"TEXT_VOICEMAN_05400_003440_ZENOS","그것도 보고인가?
아니면 나에 대한 선전포고인가……?"
360,"TEXT_VOICEMAN_05400_003450_FANDANIEL","어이쿠, 실례. 말이 너무 많았나 봅니다."
361,"TEXT_VOICEMAN_05400_003460_FANDANIEL","뭐, 당신처럼 뭐든지 '가진 자'와 살육전을 펼치는 것도
나쁘지 않은 종말의 방법이긴 하겠지만요…….
지금은 일단 후보안으로 놔두도록 하지요."
362,"TEXT_VOICEMAN_05400_003470_FANDANIEL","그럼 작전은 계속해서 진행하도록 하겠습니다."
363,"TEXT_VOICEMAN_05400_003480_ZENOS","난 새로운 무기를 찾아야겠군.
나의 벗을 사냥하기에 걸맞은 것으로 말이지……."
