#,Unknown0,Unknown1
0,TEXT_HEAVNC106_02236_SEQ_00,매의 보금자리에 있는 에마넬랭은 할 일이 없는 듯하다.
1,TEXT_HEAVNC106_02236_SEQ_01,"에마넬랭이 식당에서 휴식할 것을 권했다. 모험가는 그 말에 따랐으나, 여자 종업원이 준 음료를 마시고 잠에 빠졌다. 눈을 떴을 때는 드래곤족과의 화합을 반대하는 자들의 폭동이 일어나고 있었다……. 매의 보금자리에 있는 '산크레드'와 대화하자."
2,TEXT_HEAVNC106_02236_SEQ_02,"산크레드와 대화하고, 도시 안을 둘러보기로 했다. '매의 보금자리' 사람들과 이야기를 나누며 정보를 수집하자."
3,TEXT_HEAVNC106_02236_SEQ_03,사람들의 이야기를 들으며 돌아다녔다. 매의 보금자리에 있는 '산크레드'와 대화하자.
4,TEXT_HEAVNC106_02236_SEQ_04,"산크레드와 대화했다. 눈에 띄는 혼란이 발생한 건 아니지만, 모두가 충격을 금하지 못한 듯하다. 이대로 슬픔의 파문이 퍼져 나가는 것인가……."
5,TEXT_HEAVNC106_02236_SEQ_05,
6,TEXT_HEAVNC106_02236_SEQ_06,
7,TEXT_HEAVNC106_02236_SEQ_07,
8,TEXT_HEAVNC106_02236_SEQ_08,
9,TEXT_HEAVNC106_02236_SEQ_09,
10,TEXT_HEAVNC106_02236_SEQ_10,
11,TEXT_HEAVNC106_02236_SEQ_11,
12,TEXT_HEAVNC106_02236_SEQ_12,
13,TEXT_HEAVNC106_02236_SEQ_13,
14,TEXT_HEAVNC106_02236_SEQ_14,
15,TEXT_HEAVNC106_02236_SEQ_15,
16,TEXT_HEAVNC106_02236_SEQ_16,
17,TEXT_HEAVNC106_02236_SEQ_17,
18,TEXT_HEAVNC106_02236_SEQ_18,
19,TEXT_HEAVNC106_02236_SEQ_19,
20,TEXT_HEAVNC106_02236_SEQ_20,
21,TEXT_HEAVNC106_02236_SEQ_21,
22,TEXT_HEAVNC106_02236_SEQ_22,
23,TEXT_HEAVNC106_02236_SEQ_23,
24,TEXT_HEAVNC106_02236_TODO_00,산크레드와 대화
25,TEXT_HEAVNC106_02236_TODO_01,매의 보금자리에서 정보 수집
26,TEXT_HEAVNC106_02236_TODO_02,산크레드와 대화
27,TEXT_HEAVNC106_02236_TODO_03,
28,TEXT_HEAVNC106_02236_TODO_04,
29,TEXT_HEAVNC106_02236_TODO_05,
30,TEXT_HEAVNC106_02236_TODO_06,
31,TEXT_HEAVNC106_02236_TODO_07,
32,TEXT_HEAVNC106_02236_TODO_08,
33,TEXT_HEAVNC106_02236_TODO_09,
34,TEXT_HEAVNC106_02236_TODO_10,
35,TEXT_HEAVNC106_02236_TODO_11,
36,TEXT_HEAVNC106_02236_TODO_12,
37,TEXT_HEAVNC106_02236_TODO_13,
38,TEXT_HEAVNC106_02236_TODO_14,
39,TEXT_HEAVNC106_02236_TODO_15,
40,TEXT_HEAVNC106_02236_TODO_16,
41,TEXT_HEAVNC106_02236_TODO_17,
42,TEXT_HEAVNC106_02236_TODO_18,
43,TEXT_HEAVNC106_02236_TODO_19,
44,TEXT_HEAVNC106_02236_TODO_20,
45,TEXT_HEAVNC106_02236_TODO_21,
46,TEXT_HEAVNC106_02236_TODO_22,
47,TEXT_HEAVNC106_02236_TODO_23,
48,TEXT_HEAVNC106_02236_HONOROIT_000_000,"오셨군요, Player Player 님.
다행입니다…… 산크레드 님과 길이 엇갈렸으면
어쩌나 걱정했거든요, 네……."
49,TEXT_HEAVNC106_02236_THANCRED_000_003,"아하, 어떻게 된 건지 알겠어…….
이 녀석, 딱 봐도 부모님 속 썩이게 생겼구만."
50,TEXT_HEAVNC106_02236_CITIZENA02233_000_005,"저기 좀 봐, 저 문 위!
이야~ 어떤 조각이 장식될지 궁금한데!"
51,TEXT_HEAVNC106_02236_CITIZENB02233_000_010,"용과 사이좋게 지낸다는 말이 믿어지지 않았지만……
성도에서 하얀 용이 아이를 구하는 걸 직접 봤어.
그래서 아내와 함께 이렇게 먼 곳까지 행사를 보러 왔지."
52,TEXT_HEAVNC106_02236_CITIZENC02233_000_015,"여기 추위는 여전하네. 뼛속까지 얼어붙을 것 같아.
그런데도 행사를 보러 온 손님이 점점 늘어나고 있어.
이거, 우리 기술자들도 기운 내야겠는걸!"
53,TEXT_HEAVNC106_02236_EMMANELLAIN_000_020,"자, 일은 이제 됐으니까 넌 적당히 쉬고 있어.
손님한테 일 시킨 게 들통나면 형님한테 혼쭐이 날 테니까……."
54,TEXT_HEAVNC106_02236_EMMANELLAIN_000_021,"저쪽 병영 1층을 임시 식당으로 꾸며 놨거든.
행사에 온 손님들을 위해 개방돼 있으니까
일단 저기서 요기라도 하고 있을래?"
55,TEXT_HEAVNC106_02236_THANCRED_000_022,"난 이제 막 도착했으니까, 잠깐 거리를 둘러보고 올게.
볼일 있으면 불러, Player Player."
56,TEXT_HEAVNC106_02236_EMMANELLAIN_000_030,……………….
57,TEXT_HEAVNC106_02236_CITIZENA02233_000_035,"어, 어떻게 된 거야…….
어쩌다가 이렇게 된 거냐고!?"
58,TEXT_HEAVNC106_02236_CITIZENB02233_000_040,"행사를 구경하러 기껏 여기까지 왔는데
이게 대체 무슨 일인지……."
59,TEXT_HEAVNC106_02236_CITIZENC02233_000_045,"……공들여 만든 조각에는 피해가 없는 게 불행 중 다행이네.
하지만 행사 자체가 열릴 수 있을지는……."
60,TEXT_HEAVNC106_02236_REDWALD_000_046,"에마넬랭 경이 기병을 재촉하지 않았으면
무고한 백성들이 폭동에 휘말려 피해가 커질 뻔 했소.
경비를 담당하는 자로서 그에게 감사할 따름이오."
61,TEXT_HEAVNC106_02236_REDWALD_000_047,"하지만 결과적으로 가혹한 역할을 맡기게 되었군.
다 내가 부족한 탓이오……."
62,TEXT_HEAVNC106_02236_TOURCENET_000_048,"아까 폭동에는 반란자가 몇 명 가담했는데……
젊은이뿐만 아니라 선해 보이는 노부부까지 덤벼들더라.
무엇 때문에 그렇게까지 하는 걸까……."
63,TEXT_HEAVNC106_02236_AURIAUNE_000_049,"폭동 때문에 동료 기병 중에서도 사상자가 나왔어.
너무 분해…… 평화가 코앞까지 다가왔는데……!"
64,TEXT_HEAVNC106_02236_EMERISSEL_100_049,"……난 이곳 경비를 자주 맡아서
그 여자 종업원이랑도 몇 번 인사를 나눈 적이 있어.
마음이 너무 안 좋아……."
65,TEXT_HEAVNC106_02236_NOIRTEREL_110_049,"혹시 안쪽 자리에 앉아 있었던 게 당신이었나요?
그 자리에 있던 음료를 치우려다가
희미한 약품 냄새…… 수면약 냄새가 나서 깜짝 놀랐어요."
66,TEXT_HEAVNC106_02236_NOIRTEREL_120_049,"약을 넣은 게 누구였건 여긴 제 주방이니……
당신에게 정말 죄송하다는 말씀을 드리고 싶습니다.
행사를 기념하고 잔치를 즐겨야 할 자리였는데……."
67,TEXT_HEAVNC106_02236_ROTHE_130_049,"다들 갑자기 표정이 싹 얼어붙는 거 보고 소름이 돋았다니까.
평화 행사를 진심으로 기대했던 건 나밖에 없었나 봐……."
68,TEXT_HEAVNC106_02236_INGARET_140_049,"매의 보금자리는 커르다스 서부고지의 재출발을 상징합니다.
행사 개최지로 선정되어 더 활기가 돌 줄 알았는데……
앞으로 어떻게 되는 걸까요?"
69,TEXT_HEAVNC106_02236_THANCRED_000_050,"………………끔찍한 참극이었어.
드래곤족과의 화합을 반대하는 세력이
책임자가 없는 틈을 타 폭동을 일으킨 모양이야……."
70,TEXT_HEAVNC106_02236_THANCRED_000_051,"에마넬랭은 얘길 할 만한 상태가 아닌 것 같지만……
빠르게 연락이 갔으니 곧 루키아 일행이 돌아오겠지."
71,TEXT_HEAVNC106_02236_THANCRED_000_052,"……그때까지 마을을 좀 둘러봐 줄래?
괜한 소동이 생기지 않았으면 좋겠어……."
72,TEXT_HEAVNC106_02236_THANCRED_000_060,"마을 사람들은 어땠어?
나도 주민들의 이야기를 좀 더 들어볼게."
73,TEXT_HEAVNC106_02236_CITIZENB02233_000_070,"같이 행사를 보러 온 아내가 폭동에 휘말렸어.
다행히 가벼운 상처만 입고 끝났지만……
반역자 놈들, 절대로 용서 못 해!"
74,TEXT_HEAVNC106_02236_CITIZENB02233_000_071,"하여간 눈앞의 복수 따위에 얽매여서는…… 쯧쯧.
지금은 큰 그림을 봐야 할 때라는 걸 왜 모른단 말이냐!
어리석은 놈들 같으니!"
75,TEXT_HEAVNC106_02236_CITIZENB02233_000_080,"같이 행사를 보러 온 아내가 폭동에 휘말렸어.
다행히 가벼운 상처만 입고 끝났지만……
반역자 놈들, 절대로 용서 못 해!"
76,TEXT_HEAVNC106_02236_CITIZENC02233_000_090,"그 여자한테 화살을 쏘도록 명령한 게
방탕하기로 소문난 포르탕 가 둘째놈 맞지?
옛날부터 나쁜 소문이 자자하더니만, 정말 사람이 글러먹었어!"
77,TEXT_HEAVNC106_02236_CITIZENC02233_000_091,"결국 변혁의 중심에 귀족이 존재하는 한
우리 평민은 행복해질 수 없는 건가 봐…….
어쩐지 꿈에서 확 깬 기분이야."
78,TEXT_HEAVNC106_02236_CITIZENC02233_000_100,"결국 변혁의 중심에 귀족이 존재하는 한
우리 평민은 행복해질 수 없는 건가 봐…….
어쩐지 꿈에서 확 깬 기분이야."
79,TEXT_HEAVNC106_02236_JOSSELOUX_000_110,"폭동에 찬성하는 건 아니지만,
그 여자가 한 말은 가슴에 와 박히더라.
나도 친구와 선배를 전쟁으로 잃었으니까……."
80,TEXT_HEAVNC106_02236_JOSSELOUX_000_111,"그나저나 교황청 농성 사건에 이어서
이런 일까지 벌어지다니……
이슈가르드는 요즘 왜 이렇게 뒤숭숭한 거야?"
81,TEXT_HEAVNC106_02236_JOSSELOUX_000_112,"드래곤족을 쓰러뜨리자면서 단결할 땐 언제고,
지금은 인간끼리 서로 헐뜯기 바쁘잖아.
용과 화해하는 게 정말 옳은 일인지 모르겠어……."
82,TEXT_HEAVNC106_02236_JOSSELOUX_000_120,"드래곤족을 쓰러뜨리자면서 단결할 땐 언제고,
지금은 인간끼리 서로 헐뜯기 바쁘잖아.
용과 화해하는 게 정말 옳은 일인지 모르겠어……."
83,TEXT_HEAVNC106_02236_THANCRED_000_130,"왔구나, Player Player…….
그쪽은 어땠어?"
84,TEXT_HEAVNC106_02236_THANCRED_000_131,"그래…….
이쪽도 눈에 띄는 소동은 없었지만,
역시 예전처럼 밝은 분위기로 돌아가진 못할 것 같아."
85,TEXT_HEAVNC106_02236_THANCRED_000_132,"……무고한 희생자가 나온 이상
폭동을 일으킨 반란자들은 엄연히 죄인이다.
에마넬랭이 대응을 크게 잘못한 건 아니었어."
86,TEXT_HEAVNC106_02236_THANCRED_000_133,"다만, 사람 마음이라는 게 선악만으로 납득할 순 없으니까…….
누군가를 잃는 슬픔을 모두가 아는 나라이니, 파문이 클 거다."
87,TEXT_HEAVNC106_02236_THANCRED_000_134,"앞으로 이 일을 어떻게 처리할지……
과거에 얽매인 마음을 움직이는 건 쉬운 일이 아니야……."
