key,0,1
#,,
int32,str,str
0,"TEXT_CTSHWDCRAFTERSUPPLY_00649_POTKIN_000_000","어, 영웅님!?
설마 창천 거리를 시찰하러 오셨습니까!?
화,화, 황송합니다!"
1,"TEXT_CTSHWDCRAFTERSUPPLY_00649_POTKIN_010_000","그 유명한 영웅님께서 부흥 사업에 참여해주신다는 얘기는
오그베르트 감독님한테서 들었습니다!
외람되지만 이 사업에 대해서 설명을 드리겠습니다!"
2,"TEXT_CTSHWDCRAFTERSUPPLY_00649_POTKIN_010_010","먼저 이 창천 거리에서는
도시 부흥 계획에 필요한 물자의 제작을
장인 여러분들께 부탁 드리고 있습니다."
3,"TEXT_CTSHWDCRAFTERSUPPLY_00649_POTKIN_010_020","아무래도 도시 전체를 부흥시키고 운용해야 하니까
굉장히 많은 물자가 필요하거든요.
모쪼록 협력을 부탁드립니닷!"
4,"TEXT_CTSHWDCRAFTERSUPPLY_00649_POTKIN_010_030","제작한 물자의 납품은
이곳 카운터에서 제가 접수하고 있습니다!
어떤 물자가 필요한지도 편하게 물어보세요!"
5,"TEXT_CTSHWDCRAFTERSUPPLY_00649_POTKIN_010_040","물론 보수도 공공사업이니 만큼 성도에서 지급해드릴 겁니다!
납품해 주신 물자의 품질 및 종류에 따라서
'<Sheet(Item,28063,0)/>'<13>FF0F02280BFF054974656DF26D9F0103FF04EBA5BCFF04EC9D84</13> 드리겠습니닷."
6,"TEXT_CTSHWDCRAFTERSUPPLY_00649_POTKIN_010_050","'<Sheet(Item,28063,0)/>'<13>FF0F02280BFF054974656DF26D9F0103FF04EB8A94FF04EC9D80</13> 저쪽에 있는 '에니'가
여러 가지 답례품과 교환해 드리고 있답니다!
꼭 그녀의 얘기도 들어주십시오!"
7,"TEXT_CTSHWDCRAFTERSUPPLY_00649_POTKIN_020_000","영웅님은 이번 부흥 사업에 사용되는 재료에 대해
누구에게든 설명을 들으신 적이 있으신지요?
혹시 괜찮으시다면 제가 설명해 드리겠습니닷!"
8,"TEXT_CTSHWDCRAFTERSUPPLY_00649_POTKIN_020_010","장인 여러분께서 제작하실 때 필요한 재료는
이미 시장에서 팔고 있는 것도 있지만,
이번에 처음으로 시장 가격이 책정되는 재료도 있습니닷!"
9,"TEXT_CTSHWDCRAFTERSUPPLY_00649_POTKIN_020_020","만약 채집 쪽도 잘 아신다면
재료를 구하는 일도 협력해 주십시오!"
10,"TEXT_CTSHWDCRAFTERSUPPLY_00649_SYSTEM_020_030","이슈가르드 부흥에 필요한 재료 정보는
'채집수첩'의 '이슈가르드 부흥' 항목에서
확인하실 수 있습니다."
11,"TEXT_CTSHWDCRAFTERSUPPLY_00649_POTKIN_030_000","어랏………….
영웅님께 이런 말씀 드리기가 좀 곤란합니다만,
장인으로서는 아직 많이 미숙하시군요……."
12,"TEXT_CTSHWDCRAFTERSUPPLY_00649_POTKIN_030_010","죄송합니닷……!
이번 부흥 사업에서는 장인 여러분들의 기술에 대해
일정 수준 이상이 되어야 하는 기준이 설정되어 있어서……"
13,"TEXT_CTSHWDCRAFTERSUPPLY_00649_POTKIN_030_020","지금 영웅님께는
납품을 부탁드릴 수 있는 의뢰가 없습니다……."
14,"TEXT_CTSHWDCRAFTERSUPPLY_00649_SYSTEM_030_030","포트킨에게 물자를 납품하려면
제작자 클래스 하나 이상의 레벨이 20 이상이 되어야 합니다."
15,"TEXT_CTSHWDCRAFTERSUPPLY_00649_POTKIN_040_000","흠흠………….
살짝 확인을 해봤습니다만,
영웅님은 장인으로서도 아주 우수하시군요!"
16,"TEXT_CTSHWDCRAFTERSUPPLY_00649_POTKIN_040_010","그렇다면 영웅님의 '제작수첩'에
의뢰 물자 리스트를 기재해 드리겠습니다!
그걸 참고하셔서 납품 물자를 제작해 주십시오!"
17,"TEXT_CTSHWDCRAFTERSUPPLY_00649_POTKIN_040_020","필요한 물자는 때에 따라 달라질 수도 있으니
지금 무엇이 필요한지는 저한테 물어 주세요!
잘 부탁드립니다!"
18,"TEXT_CTSHWDCRAFTERSUPPLY_00649_SYSTEM_040_030","이슈가르드 부흥에 관한 제작물은
'제작수첩'의 '이슈가르드 부흥' 항목에서
제작하실 수 있습니다."
19,"TEXT_CTSHWDCRAFTERSUPPLY_00649_POTKIN_050_000","물자를 납품하러 오셨습니까?
아니면 필요한 물자를 확인하시고 싶으십니까?
어느 쪽이든 대환영입니다, 장인 영웅님!"
20,"TEXT_CTSHWDCRAFTERSUPPLY_00649_POTKIN_060_000","현재 대규모 부흥 사업이 이루어지고 있습니닷!
그쪽의 작업 인력도 모집하고 있습니다만,
물론 물자 보급도 대환영이랍니닷!"
21,"TEXT_CTSHWDCRAFTERSUPPLY_00649_POTKIN_070_000","장인 여러분 덕분에
현재 예정되어 있던 부흥 계획은 모두 완료되었습니닷!
계속해서 비품 등의 납품을 기다리고 있겠습니다!"
22,"TEXT_CTSHWDCRAFTERSUPPLY_00649_POTKIN_000_010","어랏, 영웅님!
오그베르트 감독님께서 당신을 찾고 있었습니다!"
23,"TEXT_CTSHWDCRAFTERSUPPLY_00649_POTKIN_080_000","아, 영웅님!
장인 여러분 덕분에 부흥 계획이 순조롭게 진행되었습니다!
새로운 물자가 필요하게 되었으니 괜찮으시다면 협력해 주세요!"
24,"TEXT_CTSHWDCRAFTERSUPPLY_00649_POTKIN_090_000","아, 그리고
장인님께서 더 즐겁게 사업에 참여하시라고
새로운 기획을 시작했답니닷!"
25,"TEXT_CTSHWDCRAFTERSUPPLY_00649_POTKIN_090_010","그 이름하여……
바로 '쿠뽀 복권'!"
26,"TEXT_CTSHWDCRAFTERSUPPLY_00649_POTKIN_090_020","저희가 의뢰드린 물건 중에서
쿠뽀 복권 대상품을 정해드릴 텐데요……"
27,"TEXT_CTSHWDCRAFTERSUPPLY_00649_POTKIN_090_030","바로 그 쿠뽀 복권 대상 의뢰품을 납품해주신 분에게는
도장을 찍어 드립니다!"
28,"TEXT_CTSHWDCRAFTERSUPPLY_00649_POTKIN_090_040","도장을 5개 모으시면
그 종이가 쿠뽀 복권 교환권이 됩니다.
그것을 쿠뽀 복권 담당자에게 주세요."
29,"TEXT_CTSHWDCRAFTERSUPPLY_00649_POTKIN_090_050","자, 그럼 쿠뽀 복권에 대한 상세한 설명은
영웅님 기준 오른쪽에 있는 '리즈베스'에게 물어주세욧!"
30,"TEXT_CTSHWDCRAFTERSUPPLY_00649_SYSTEM_100_000","또한 이슈가르드 부흥 사업 진행 시, 높은 수준의 제작물에
특수한 '고난도 제작법'이 추가되었습니다.
제작수첩 및 도움말을 확인하시고 제작에 도전해 보세요!"
31,"TEXT_CTSHWDCRAFTERSUPPLY_00649_SYSTEM_100_010","또한 이슈가르드 부흥 사업 진행 시, 높은 수준의 제작물에는
특수한 '고난도 제작법'이 존재합니다.
제작수첩 및 도움말을 확인하시고 제작에 도전해 보세요!"
