key,0,1
#,,
int32,str,str
0,"TEXT_REGROC2JAQUOINIE_00671_JAQUOINIE_000_000","저희는 아유나르트 가의 오르바엘 님을 모시는 사병입니다.
주인님은 새로운 사업을 준비하시느라
죄송합니다만, 현재 자리를 비우셨습니다."
1,"TEXT_REGROC2JAQUOINIE_00671_JAQUOINIE_000_001","저희는 아유나르트 가의 오르바엘 님을 모시는 사병입니다.
주인님은 현재 창천 거리에서 새로운 사업에 매진 중이십니다."
2,"TEXT_REGROC2JAQUOINIE_00671_JAQUOINIE_000_002","여기서는 잠긴 상자를 여는 일과 함께
하늘도적들 사이에서 유사 화폐로 통용되는 전리품,
하늘도적의 전리품을 거래할 수 있습니다."
3,"TEXT_REGROC2JAQUOINIE_00671_JAQUOINIE_000_003","현재는 입수 경로가 제한된 물품들이지만,
이곳에서는 거래가 가능하오니
입수하고 싶으시다면 찾아와 주십시오."
4,"TEXT_REGROC2JAQUOINIE_00671_JAQUOINIE_000_010","저희 주인님이신 오르바엘 님께 볼일이 있으십니까?
주인님은 새로운 사업을 준비하고 계시느라
죄송하지만, 지금은 자리에 안 계십니다."
5,"TEXT_REGROC2JAQUOINIE_00671_JAQUOINIE_000_011","저희 주인님이신 오르바엘 님께 볼일이 있으십니까?
주인님은 현재 창천 거리에서 새로운 사업에 매진 중이십니다."
6,"TEXT_REGROC2JAQUOINIE_00671_JAQUOINIE_000_012","그러므로 앞으로는 계속해서 잠긴 상자를 열거나
하늘도적들 사이에서 유사 화폐로 통용되는 전리품,
하늘도적의 전리품을 거래할 수 있습니다."
