#,Unknown0,Unknown1
0,TEXT_FESVLT2023PRESENTATION_00794_EMILIE_000_000,"아, 모험가님!
함께 홍보해준 사랑을 말하는 이벤트, 지금부터 할 거야!
이 새로운 의상을 입어볼 수도 있으니까 괜찮으면 보고 가!"
1,TEXT_FESVLT2023PRESENTATION_00794_Q2_100_000,이벤트를 보고 가시겠습니까?
2,TEXT_FESVLT2023PRESENTATION_00794_Q1_000_000,누구의 스테이지를 보시겠습니까?
3,TEXT_FESVLT2023PRESENTATION_00794_A1_000_001,모험가 길드의 대표와 원예가 길드마스터
4,TEXT_FESVLT2023PRESENTATION_00794_A2_000_001,목수 길드마스터와 도토리 놀이터의 소년
5,TEXT_FESVLT2023PRESENTATION_00794_A3_000_001,사랑하는 사랑의 전도사들
6,TEXT_FESVLT2023PRESENTATION_00794_A4_000_001,'새벽'의 모험가 자매
7,TEXT_FESVLT2023PRESENTATION_00794_A5_000_001,실력 좋은 점술사와 달에서 온 손님
8,TEXT_FESVLT2023PRESENTATION_00794_ASTRID_000_010,"뮨 님 그리고 푸푸차 님,
이벤트에 참가해주셔서 감사합니다!
참가해주신 이유부터 우선 말씀해주시면 감사하겠습니다!"
9,TEXT_FESVLT2023PRESENTATION_00794_MIOUNNE_000_011,"칼라인 카페와 모험가 길드의 홍보가 될 것 같아서
참가해 봤어."
10,TEXT_FESVLT2023PRESENTATION_00794_FUFUCHA_000_012,"저도 뮨 님과 비슷해요.
원예가 길드의 홍보가 되면 좋겠다 싶어서 참가했어요."
11,TEXT_FESVLT2023PRESENTATION_00794_EMILIE_000_013,"감사합니다!
그럼, 자신의 '사랑'에 대해서 말씀해 주세요!"
12,TEXT_FESVLT2023PRESENTATION_00794_MIOUNNE_000_014,"내가 사랑 이야기를 하자면 차를 빼놓을 수 없지.
끓이는 것도, 마시는 것도, 대접하는 것도 좋아하고
찻잎의 발효 정도도 꼼꼼히 따져서 여러 가지 시도해 보고 있어."
13,TEXT_FESVLT2023PRESENTATION_00794_MIOUNNE_100_014,"칼라인 카페에서 내놓고 있는 차는
모두 최고급 품질로 엄선한 제품들이니 꼭 마시러 와줬으면 해."
14,TEXT_FESVLT2023PRESENTATION_00794_FUFUCHA_000_015,"제 경우는 찻잎 쪽이겠네요……
전 나무와 풀, 꽃을 사랑해요."
15,TEXT_FESVLT2023PRESENTATION_00794_FUFUCHA_100_015,"자연의 은혜를 받아 어떻게 활용할지를 생각하고
그것을 필요로 하는 사람들에게 전달해주는 일이 기뻐요."
16,TEXT_FESVLT2023PRESENTATION_00794_ASTRID_000_016,"사랑의 계절과 어울리는 꽃, 그리고 차에 관심이 있으신 분은
꼭 한 번 칼라인 카페와 원예가 길드에 들러 주세요!
참가해 주셔서 감사합니다!"
17,TEXT_FESVLT2023PRESENTATION_00794_ASTRID_000_020,"베아탱 님 그리고 니콜리오 님.
이벤트에 참가해 주셔서 감사드립니다!
이번에 참가하신 이유부터 들려주시기 바랍니다!"
18,TEXT_FESVLT2023PRESENTATION_00794_BEATINE_000_021,"참가 이유…… 후후후후……
그야 물론 '사랑'을 말하기 위해서죠."
19,TEXT_FESVLT2023PRESENTATION_00794_NICOLIAUX_000_022,"난 선생님의 조수…… 감시 역할?
하, 하지만 도토리 놀이터의 친구도 모집하고 싶어."
20,TEXT_FESVLT2023PRESENTATION_00794_EMILIE_000_023,"감사합니다!
그럼 자신의 '사랑'에 대해서 말씀해 주실까요?"
21,TEXT_FESVLT2023PRESENTATION_00794_BEATINE_000_024,"개성이 풍부한 나무들에게 목수가 애정을 담아서 만들어내는
훌륭한 목재의 감촉과 부드러운 탄력은……
하아…………."
22,TEXT_FESVLT2023PRESENTATION_00794_BEATINE_100_024,"가공하는 도중에 날리는 톱밥의 향기로움,
세월이 쌓이면서 새겨지는 나이테의 훌륭한 곡선미…….
후후, 후후후…… 선생님, 두근거림이 멈추지 않는군요……!"
23,TEXT_FESVLT2023PRESENTATION_00794_NICOLIAUX_000_025,"아, 그러니까……
선생님은 늘 이러시니까 신경 쓰지 마."
24,TEXT_FESVLT2023PRESENTATION_00794_NICOLIAUX_100_025,"그래서 난 도토리 놀이터에서 놀 친구랑
놀이기구를 만들어주시는 목수분들이 좋아!
물론 베아탱 선생님도!"
25,TEXT_FESVLT2023PRESENTATION_00794_ASTRID_000_026,"음, 그럼 목재나 목공예품을 좋아하시는 분은 목수 길드로
같이 놀 친구와 수제 놀이기구에 관심이 있는 어린이는
도토리 놀이터로 가시기 바랍니다! 참가해 주셔서 감사합니다!"
26,TEXT_FESVLT2023PRESENTATION_00794_ASTRID_000_030,"리제트 양 그리고 오르트팡스 님,
이벤트에 참가해 주셔서 감사합니다!
일단 이번에 참가해주신 이유부터 말씀해 주시기 바랍니다!"
27,TEXT_FESVLT2023PRESENTATION_00794_LISETTE_000_031,"그야 물론 우리 귀여운~
사랑의 전도사들의 이벤트를 성공시키기 위해서지☆"
28,TEXT_FESVLT2023PRESENTATION_00794_HORTEFENSE_000_032,"나도 마찬가지야!
아, 그리고 리제트 양을 향한 사랑을 말하고 싶기도 하고!"
29,TEXT_FESVLT2023PRESENTATION_00794_EMILIE_000_033,"뜨거운 선배님들, 감사합니다!
그럼 자신의 사랑에 대해서 말씀해 주세요!"
30,TEXT_FESVLT2023PRESENTATION_00794_HORTEFENSE_000_034,"나의 사랑하는 리제트가 얼마나 훌륭한 여성인지를 말하고 싶어!
시간이 한정되어 있어 이 마음을 모두 다 말할 순 없겠지만
아무튼 난 그녀의 매력에서 빠져나올 수 없어!"
31,TEXT_FESVLT2023PRESENTATION_00794_HORTEFENSE_100_034,"길가에 쓰러져 있던 내 앞에 나타난
도도하고 아름다운 성녀님……!
그녀와 함께 있을 수 있다는 사실이 기뻐 미칠 지경이야!"
32,TEXT_FESVLT2023PRESENTATION_00794_LISETTE_000_035,"부, 부끄러운 얘기 좀 그만해!"
33,TEXT_FESVLT2023PRESENTATION_00794_LISETTE_100_035,"아, 이런 하, 하지만 그렇게 제대로
마음을 표현해주는 건…… 좋…… 좋아……."
34,TEXT_FESVLT2023PRESENTATION_00794_ASTRID_000_036,"아…… 아, 그러니까…… 이건 그냥 자랑인 거네요……?
부끄러움은 우리 몫이군요, 이 연인들에게 박수 부탁드려요!
차, 참가해주셔서 감사합니다!"
35,TEXT_FESVLT2023PRESENTATION_00794_ASTRID_000_040,"애노어 님, 클레멘스 님
이벤트에 참가해 주셔서 감사합니다!
그럼 이번에 참가해 주신 이유부터 말씀해 주시기 바랍니다!"
36,TEXT_FESVLT2023PRESENTATION_00794_AENOR_000_041,"마침 그리다니아에 머물고 있어서
즉흥적으로 참가해 봤어."
37,TEXT_FESVLT2023PRESENTATION_00794_CLEMENCE_000_042,"언니와 만나려고 그리다니아까지 온 김에
기념으로 참가해 봤어요!"
38,TEXT_FESVLT2023PRESENTATION_00794_EMILIE_000_043,"감사합니다!
그럼 자신의 '사랑'에 대해서 말씀해 주십시오!"
39,TEXT_FESVLT2023PRESENTATION_00794_AENOR_000_044,"사랑…… 그래, 사랑! 바로 형제간의 우애!!
서로를 존중하고 지켜주는, 뜨겁고 흔들림 없는 유대관계……
크으으으…… 요즘엔 정말이지 너무 부족해!"
40,TEXT_FESVLT2023PRESENTATION_00794_AENOR_100_044,"아아, 괴로워! 너무 힘들어!
멋진 형제간의 우애를 내 눈에 직접 새기고 싶다고!!"
41,TEXT_FESVLT2023PRESENTATION_00794_CLEMENCE_000_045,"아아아앗, 언니가 입을 열면 늘 이렇다니까……!
여러분, 지금 한 얘기는 안 들은 걸로 해주세요!"
42,TEXT_FESVLT2023PRESENTATION_00794_CLEMENCE_100_045,"참고로 전 최근에 배우고 있는 점성술이 재미있고 좋아요!
이슈가르드에서 조금 더 공부하고 난 뒤에는
니므의 군학도 배워보고 싶어요!"
43,TEXT_FESVLT2023PRESENTATION_00794_ASTRID_000_046,"어, 그게…… 안 들은 걸로 해달라고 했으니……
자매분 두 분이서 축제를 오붓하게 즐겨 주세요!
참가해 주셔서 감사합니다!"
44,TEXT_FESVLT2023PRESENTATION_00794_ASTRID_000_050,"위리앙제 님 그리고 푸딩웨이 님.
이벤트에 참가해 주셔서 감사합니다!
그럼 이번에 참가해 주신 이유부터 말씀해 주시기 바랍니다!"
45,TEXT_FESVLT2023PRESENTATION_00794_URIANGER_000_051,"사랑에 대해 이야기한다는 훌륭한 행사가 있다고 들어서 말입니다.
객석에서 익숙한 얼굴을 발견한 것도 참가 이유라 할 수 있겠군요."
46,TEXT_FESVLT2023PRESENTATION_00794_PUDDINGWAY_000_052,위리앙제와 함께 참가해 보고 싶어서 왔어요!
47,TEXT_FESVLT2023PRESENTATION_00794_EMILIE_000_053,"감사합니다!
그럼 자신의 '사랑'에 대해서 말씀해 주십시오!!"
48,TEXT_FESVLT2023PRESENTATION_00794_PUDDINGWAY_000_054,"사랑 하면 푸딩!
그래요, 바로 푸딩이죠……!"
49,TEXT_FESVLT2023PRESENTATION_00794_PUDDINGWAY_100_054,"부들부들 부드러운 것부터 탱글탱글 탄력 있는 것도 있고
말린 과일이 들어 있는 것도 있다니, 우와아아아……!
여러 가지 푸딩을 실컷 먹어보고 싶습니다!"
50,TEXT_FESVLT2023PRESENTATION_00794_URIANGER_000_055,"요리에 대한 사랑을 말하자면, 저는 코카트리스 미트볼입니다…….
제가 좋아한다는 것을 알고 자주 만들어주던 분이 계셨거든요.
추억 속에 남아 있는 소중한 요리입니다."
51,TEXT_FESVLT2023PRESENTATION_00794_URIANGER_100_055,"처음 만들었을 때의 탄 맛도, 점차 발전해서 맛있어진 그 맛도
떠올릴수록 그립습니다."
52,TEXT_FESVLT2023PRESENTATION_00794_ASTRID_000_056,"좋아하는 요리에 대해 말씀해주셔서 배가 고파졌어요!
참고로 저는 추운 날에 먹는 양파 그라탱 수프를 좋아합니다!
참가해 주셔서 감사합니다!"
