#,Unknown0,Unknown1
151,TEXT_CTSDKBCHARACTER3_00569_BETHRIC_000_950,"음후후…… 저도 밤이 무서웠습니다만 해결돼서 다행이네요.
아 참, 스킵은 간만의 밤이 반가운가 봐요.
어린 아마로들은 밤하늘을 신기한 듯이 올려다보는데, 참 귀여워요!"
152,TEXT_CTSDKBCHARACTER3_00569_BETHRIC_000_960,"Player Player 님! 알고 있다마다요!
모웬 도구는 중용의 공예관에서도 소문이 자자하거든요."
153,TEXT_CTSDKBCHARACTER3_00569_BETHRIC_000_961,"저는 수의사지만 중용의 공예관에 소속된 자로서
조제도 하나의 장인의 길이라고 생각하고 있어요.
이번 도구 제작에도 도움이 됐다면 다행이에요."
154,TEXT_CTSDKBCHARACTER3_00569_BETHRIC_000_962,"새로운 도구를 사용해서 좋은 음식과 약으로 사람들을
도울 수 있다면…… 사람을 좋아하는 아마로들도 기뻐하겠죠!
멋진 도구, 감사드려요!"
