key,0,1
183,"TEXT_AKTKBA111_04103_KANESENNA_000_204","글레이프니르와 독 문제는 제가 반드시 해결하겠습니다.
그러니 여러분은 무슨 일이 있어도 절망해서는 안 됩니다.
부디 희망을 잃지 마세요."
184,"TEXT_AKTKBA111_04103_REFUGEEMAN3_000_205","……알겠습니다."
185,"TEXT_AKTKBA111_04103_KANESENNA_000_206","아무래도 글레이프니르는
이 주변에서 모습을 감춘 것 같군요.
이만 돌아가 주시겠습니까?"
186,"TEXT_AKTKBA111_04103_REFUGEEMAN3_000_207","네……."
187,"TEXT_AKTKBA111_04103_KANESENNA_000_208","……이곳 상황은 진정되었지만
근본적인 문제는 아무것도 해결되지 않았어요."
188,"TEXT_AKTKBA111_04103_KANESENNA_000_209","죽음에 대한 공포는 앞으로도 사람들의 마음에 점점 퍼져서
글레이프니르에게 습격당하지 않아도 야수로 전락하는 자가
생길 수 있습니다. 그 정도로 사태가 절박합니다."
189,"TEXT_AKTKBA111_04103_KANESENNA_000_210","정령의 목소리는 저희에게 야수를 퇴치하라고 하지만
이대로 가다간 희생자만 늘어날 뿐……."
190,"TEXT_AKTKBA111_04103_KANESENNA_000_211","지금은 라야 오의 말대로 숲의 대정령에게 말을 걸어
그 힘을 빌리는 방법밖에 없겠어요."
191,"TEXT_AKTKBA111_04103_KANESENNA_100_211","저는 대화에 대비해 몸을 정화하러 '말없는 선인의 좌탁'으로
가겠어요. 당신들은 '쌍사당 통합사령부'로 돌아가
제가 준비를 마칠 때까지 기다려 주시겠어요?"
192,"TEXT_AKTKBA111_04103_RAYAOSENNA_000_221","국경에서 일어났던 일은 들었어요.
저도 뿔의 아이가 무력하다고 생각하긴 싫지만……
지금은 정령의 힘에 의지하는 수밖에 없을 것 같아요."
193,"TEXT_AKTKBA111_04103_KEEPEROFTHEENTWINEDSERPENTS_000_230","지난번에 이어, 이번에도 희생자가 나오고 말았습니다.
생명을 구한다는 것이 얼마나 어려운 일인지……."
194,"TEXT_AKTKBA111_04103_KEEPEROFTHEENTWINEDSERPENTS_000_231","그럼에도 우리는 앞으로 나아가야 합니다.
한시라도 빨리 글레이프니르의 위협에 종지부를 찍어야 합니다……!"
195,"TEXT_AKTKBA111_04103_KEEPEROFTHEENTWINEDSERPENTS_000_232","영웅님은 카느 에 님의 준비가 끝날 때까지
준비가 끝날 때까지 잠시 대기해 주세요."
