key,0,1
#,,
int32,str,str
0,"TEXT_JOBDEFDRK_00300_SIDURGU_000_001","……말상대를 찾는 거라면 저리 가라.
지금 잡담할 기분 아니니까."
1,"TEXT_JOBDEFDRK_00300_SIDURGU_000_005","이 기운은…… 너도 '암흑'의 힘을 쓰나 보군.
하지만 너와 난 각자 갈 길이 다른 모양이다.
쓸데없이 알은척하지 말고 저리 가라."
2,"TEXT_JOBDEFDRK_00300_SIDURGU_000_010","……즐거운 대화를 기대하지는 마라.
암흑기사가 알아야 할 것을 가르쳐주겠다는 약속이었으니
궁금한 점이 있으면 말해봐라."
3,"TEXT_JOBDEFDRK_00300_Q1_000_050","무엇을 물어보시겠습니까?"
4,"TEXT_JOBDEFDRK_00300_A1_000_051","당신의 이야기를 들려달라고 한다"
5,"TEXT_JOBDEFDRK_00300_A1_000_052","'암흑기사'에 대한 설명을 요청한다"
6,"TEXT_JOBDEFDRK_00300_A1_000_053","취소"
7,"TEXT_JOBDEFDRK_00300_SIDURGU_000_060","내 얘기는 전에도 했을 텐데.
그것 말고도 다른 게 궁금하다면……
내 스승님 얘기를 하는 게 좋겠군."
8,"TEXT_JOBDEFDRK_00300_SIDURGU_000_061","내 스승님은 위대한 암흑기사셨다.
스승님께서 생명을 구한 이름 없는 자들은 수십, 수백……
아무튼, 셀 수도 없을 정도지."
9,"TEXT_JOBDEFDRK_00300_SIDURGU_000_062","스승님은 살해당할 뻔한 나를 구해주신 데다
암흑검을 배우고 싶다는 내 부탁에도 진지하게 응해주셨다.
……뭐든 과장하는 경향이 있는 분이긴 했지만."
10,"TEXT_JOBDEFDRK_00300_SIDURGU_000_063","스승님께서 날 거두신 후, 프레이도 바로 내 후배로 들어왔다.
내가 분노와 힘으로 타오르는 불꽃과 같다면
녀석은 잔잔한 호수와 같다고 스승님께서 말씀하셨지……."
11,"TEXT_JOBDEFDRK_00300_SIDURGU_000_064","나와 프레이는 약자를 수호할 것을 소망했고
그 과정에서 둘 중 하나가 쓰러지더라도
절대 뒤돌아보지 않겠다고 맹세했다."
12,"TEXT_JOBDEFDRK_00300_SIDURGU_000_065","그러니 나는 멈추지 않을 것이다.
지금 내게 주어진 임무…… 생명을……
반드시 지켜내고 말 것이다."
13,"TEXT_JOBDEFDRK_00300_SIDURGU_000_070","우리가 존재하는 이유는 '최초의 암흑기사' 이야기로 귀결된다.
……그 사람은 누구보다 정의감이 강한 기사였지."
14,"TEXT_JOBDEFDRK_00300_SIDURGU_000_071","그런데 어느 날, 빈민 아이들을 희롱하던 사제를 베어 죽인 일로
당국은 그에게 성직자를 살해한 죄를 묻게 되었다."
15,"TEXT_JOBDEFDRK_00300_SIDURGU_000_072","사람들은 그를 '암흑'의 길에 물든 자라며 매도했다.
하지만 본인은 당당했어. '암흑기사'라 부르고 싶으면 부르라고,
자기는 그 이름을 명예롭게 생각한다며 큰소리쳤지."
16,"TEXT_JOBDEFDRK_00300_SIDURGU_000_073","게다가 결투재판에서도 멋지게 승리를 거머쥐었어.
그로 인해 처형은 면했지만, 결국 권력자의 계략에 빠져
작위와 영지, 기사의 증표인 문장을 빼앗겼다."
17,"TEXT_JOBDEFDRK_00300_SIDURGU_000_074","그는 그 후 문장이 그려진 방패를 버리고
검 한 자루만을 들고 약자의 편에 서서 끝까지 싸웠다.
그 뜻을 이어 스스로 업을 짊어진 자…… 그것이 암흑기사다."
18,"TEXT_JOBDEFDRK_00300_SIDURGU_000_075","역대 암흑기사들은 오랜 세월에 걸쳐
타인을 수호하는 존재이면서도
굳이 ""방패를 버리고 검만으로 싸우는"" 기술을 발전시켰다."
19,"TEXT_JOBDEFDRK_00300_SIDURGU_000_076","방패 대신 자신의 내면에서 소용돌이치는
어두운 감정을 힘으로 바꿔서 말이야.
그것이 암흑기사에게 반드시 필요한 '암흑'의 힘이다."
20,"TEXT_JOBDEFDRK_00300_SIDURGU_000_100","여긴 웬일이냐, <Highlight>ObjectParameter(1)</Highlight>.
네가 말한 '지켜야 할 자'는 잘 지키고 있나?
……하긴, 내가 걱정할 필요도 없겠지."
21,"TEXT_JOBDEFDRK_00300_SIDURGU_000_101","빨리 몸이 나아야 하는데…….
그나저나, 무슨 질문이라도 있나?"
22,"TEXT_JOBDEFDRK_00300_SIDURGU_000_102","<Highlight>ObjectParameter(1)</Highlight>.
다시 성가신 일에 휘말려 든 건 아니겠지?
누누히 말하지만 모쪼록 조심하라고……."
23,"TEXT_JOBDEFDRK_00300_Q2_000_150","무엇을 물어보시겠습니까?"
24,"TEXT_JOBDEFDRK_00300_A2_000_151","근황에 대해서 물어본다"
25,"TEXT_JOBDEFDRK_00300_A2_000_152","'암흑기사'에 대한 설명을 요청한다"
26,"TEXT_JOBDEFDRK_00300_A2_000_153","취소"
27,"TEXT_JOBDEFDRK_00300_A3_000_154","리엘을 둘러싼 소동에 대해서 묻는다"
28,"TEXT_JOBDEFDRK_00300_A3_000_155","미스트를 둘러싼 소동에 대해서 묻는다"
29,"TEXT_JOBDEFDRK_00300_SIDURGU_000_160","그 후로 다른 추격자가 리엘을 노리는 낌새는 없다.
이스트리드는 약속을 지킨 모양이야…….
그 나름대로 올곧은 성격이었는지도 모르겠군."
30,"TEXT_JOBDEFDRK_00300_SIDURGU_000_161","하지만 리엘의 싸움은 아직 끝나지 않았다.
앞으로 시간이 지날수록, 살아남기 위해 했던 선택이
비수가 되어 녀석의 마음에 꽂히겠지."
31,"TEXT_JOBDEFDRK_00300_SIDURGU_000_162","그 아픔만은 나도 어찌해줄 수가 없다.
물론 나 역시 리엘의 선택에 관여한 자로서
당분간 돌봐줄 생각은 있…………."
32,"TEXT_JOBDEFDRK_00300_SIDURGU_000_163","무, 무슨 짓이냐! 손 치우지 못해!?
너까지 그 모그리족 같은 헛소리를 하려는 거냐!?
난 그런 뜻이 아니라…… 그러니까…… 젠장…………."
33,"TEXT_JOBDEFDRK_00300_SIDURGU_000_164","솔직히 난, 이 녀석이 삶을 포기하지 않은 게 기쁘다.
암흑기사로서 이보다 자랑스러운 일이 있나?
너도, 그리고 나도…… 살아서 이 길을 끝까지 나아가자고."
34,"TEXT_JOBDEFDRK_00300_SIDURGU_000_170","우리가 존재하는 이유는 '최초의 암흑기사' 이야기로 귀결된다.
전에도 말했지만…… 그 사람은
누구보다 정의감이 강한 기사였지."
35,"TEXT_JOBDEFDRK_00300_SIDURGU_000_171","그런데 어느 날, 빈민 아이들을 희롱하던 사제를 베어 죽인 일로
당국은 그에게 성직자를 살해한 죄를 묻게 되었다."
36,"TEXT_JOBDEFDRK_00300_SIDURGU_000_172","사람들은 그를 '암흑'의 길에 물든 자라며 매도했다.
하지만 본인은 당당했어. '암흑기사'라 부르고 싶으면 부르라고,
자기는 그 이름을 명예롭게 생각한다고 오히려 큰소리쳤지."
37,"TEXT_JOBDEFDRK_00300_SIDURGU_000_173","게다가 결투재판에서도 멋지게 승리를 거머쥐었어.
그로 인해 처형은 면했지만, 결국 권력자의 계략에 빠져
작위와 영지, 기사의 증표인 문장을 빼앗겼다."
38,"TEXT_JOBDEFDRK_00300_SIDURGU_000_174","그는 그 후 문장이 그려진 방패를 버리고
검 한 자루만을 들고 약자의 편에 서서 끝까지 싸웠다.
그 뜻을 이어 스스로 업을 짊어진 자…… 그것이 암흑기사다."
39,"TEXT_JOBDEFDRK_00300_SIDURGU_000_175","역대 암흑기사들은 오랜 세월에 걸쳐
타인을 수호하는 존재이면서도
굳이 ""방패를 버리고 검만으로 싸우는"" 기술을 발전시켰다."
40,"TEXT_JOBDEFDRK_00300_SIDURGU_000_176","방패 대신 자신의 내면에서 소용돌이치는 어두운 감정을……
그리고 그 감정을 낳는 사랑을 힘으로 바꿔서 말이야.
그걸 '암흑'이라고 부르다니, 참 솔직하지 못한 것 같지 않나?"
41,"TEXT_JOBDEFDRK_00300_SIDURGU_000_180","암흑기사의 소울 크리스탈에서 태어난 녀석 말이로군…….
우리가 안고 있는 상실에 대한 두려움과 고통이
설마 그런 형태로 나타날 줄이야."
42,"TEXT_JOBDEFDRK_00300_SIDURGU_000_181","마음으로 떠올리는 상대를 실체화하는 '힘'이란,
아마도 망자의 소생이라기보단 상상의 구현에 가까울 거다."
43,"TEXT_JOBDEFDRK_00300_SIDURGU_000_182","기억은 기록과는 다르다.
거기엔 의식하고 있든 의식하지 않든
생각하는 자의 주관이 섞여 있으니까 말이다."
44,"TEXT_JOBDEFDRK_00300_SIDURGU_000_183","그래서 우리 앞에 나타난 창천기사와 이스트리드,
그리고 나의 스승 옹파뉴도
엄밀히 말하면 본인이 아니라, 상상하는 이가 떠올린…………"
45,"TEXT_JOBDEFDRK_00300_SIDURGU_000_184","아니, 여기까지만 하지.
이런 얘기를 너무 깊게 하면 위험해…… 특히나 내 수치심이……."
46,"TEXT_JOBDEFDRK_00300_SIDURGU_000_185","어찌 됐건 실체화된 사람들이 했던 말들은
사라진 망자들의 유언은 아니다.
지금도 누군가의 가슴 속에 있는 마음이지."
47,"TEXT_JOBDEFDRK_00300_SIDURGU_000_186","하긴, 처음부터 오직 마음 속에서만 존재하는 사람이
실체화된 거라면……
그 사람만은 예외적으로 '본인'이라 할 수 있겠지만."
